ID,Name,Author,Publisher,Publishing_Date,Format,Pages,Rating
1539,"Black Magick Volume 1: Awakening, Part One (Black Magick 1)",Greg Rucka,Image Comics,2016-5-3,Paperback,128.0,4.6
1540,Breathless: A Novel of Suspense,Dean Koontz,Bantam,2010-11-23,Paperback,432.0,3.4
1541,"Danse Macabre (Anita Blake, Vampire Hunter, Book 14)",Laurell K. Hamilton,Berkley,2007-3-27,Kindle,576.0,3.1
1542,"The Harlequin: An Anita Blake, Vampire Hunter Novel",Laurell K. Hamilton,Berkley,2008-4-29,Hardcover,448.0,4.0
1543,The Splendour Falls,Susanna Kearsley,Sourcebooks Landmark,2014-1-14,Paperback,384.0,4.0
1544,"Vagabond (The Grail Quest, Book 2)",Bernard Cornwell,HarperCollins,2006-1-3,Paperback,416.0,4.5
1545,Green: The Beginning and the End (Circle Trilogy),Ted Dekker,Thomas Nelson Inc,2010-6-1,Hardcover,392.0,4.6
1546,Declare: A Novel,Tim Powers,William Morrow Paperbacks,2013-2-19,Paperback,624.0,4.3
1547,The Descent,Jeff Long,Berkley,2001-11-1,Hardcover,592.0,4.2
1548,Some Enchanted Éclair (A Magical Bakery Mystery),Bailey Cates,Berkley,2014-7-1,Kindle,336.0,4.6
1549,Chasm City (Revelation Space),Alastair Reynolds,Ace,2003-5-27,Paperback,704.0,3.9
1550,Gunpowder Moon,David Pedreira,Harper Voyager,2018-2-13,Hardcover,304.0,4.2
1551,The Firebird,Susanna Kearsley,Sourcebooks Landmark,2013-6-4,Kindle,544.0,4.5
1552,The Banks Sisters,Nikki Turner,Urban Books,2015-8-25,Kindle,432.0,3.9
1553,MEG: Nightstalkers,Steve Alten,Tor Books,2017-5-2,Hardcover,448.0,4.3
1554,The Serpent of Venice: A Novel,Christopher Moore,William Morrow Paperbacks,2015-2-17,Hardcover,352.0,4.3
1555,"Micah (Anita Blake, Vampire Hunter, Book 13)",Laurell K. Hamilton,Berkley,2006-2-28,Paperback,288.0,3.3
1556,The Last Policeman: A Novel (The Last Policeman Trilogy),Ben H. Winters,Quirk Books,2013-5-13,Kindle,336.0,4.1
1557,"The Rogue Hunter (Argeneau Vampires, Book 10)",Lynsay Sands,Avon,2008-9-30,Hardcover,384.0,4.3
1558,I Shot the Buddha (A Dr. Siri Paiboun Mystery),Colin Cotterill,Soho Crime,2017-7-4,Kindle,368.0,4.5
1559,Pecan Pies and Homicides (A Charmed Pie Shoppe Mystery),Ellery Adams,Berkley,2014-1-7,Hardcover,304.0,4.6
1560,"Fearless (The Lost Fleet, Book 2)",Jack Campbell,Ace,2007-1-30,Kindle,304.0,4.3
1561,Lexicon: A Novel,Max Barry,Penguin Books,2014-4-1,Hardcover,400.0,4.3
1562,"The Confusion (The Baroque Cycle, Vol. 2)",Neal Stephenson,William Morrow Paperbacks,2005-6-14,Kindle,848.0,4.6
1563,Wolf in White Van: A Novel,John Darnielle,Picador,2015-9-1,Hardcover,224.0,4.0
1564,Inherit the Wind: The Powerful Drama of the Greatest Courtroom Clash of the Century,Jerome Lawrence,Ballantine Books,2003-11-4,Kindle,129.0,4.6
1565,Frankenstein: Lost Souls: A Novel,Dean Koontz,Bantam,2011-1-25,Hardcover,416.0,4.0
1566,Extinction Aftermath (The Extinction Cycle Book 6),Nicholas Sansbury Smith,Orbit,2017-10-31,Hardcover,432.0,4.8
1567,Lost Souls,Poppy Z. Brite,Dell,1993-9-10,Hardcover,384.0,4.2
1568,Deadly Crossing: A Tom Dugan Novel,R.E. McDermott,R.E. McDermott,2014-4-10,Paperback,412.0,4.6
1569,Another Roadside Attraction: A Novel,Tom Robbins,Bantam,1990-4-1,Hardcover,352.0,4.1
1570,The Berets (Brotherhood of War (Book 5),W.E.B. Griffin,Jove Books,1985-10-15,Kindle,408.0,4.6
1571,Crux: Nexus Arc Book 2,Ramez Naam,Angry Robot,2015-4-7,Paperback,624.0,4.6
1572,The Remaining: Aftermath,D.J. Molles,Orbit,2014-6-24,Hardcover,448.0,4.7
1573,The Trench,Steve Alten,Pinnacle,2013-5-7,Kindle,496.0,4.5
1574,MEG: Primal Waters,Steve Alten,Forge Books,2005-5-1,Hardcover,463.0,4.4
1575,The King Must Die: A Novel,Mary Renault,Vintage Books,1988-2-12,Paperback,338.0,4.4
1576,Horns: A Novel,Joe Hill,William Morrow Paperbacks,2011-3-8,Hardcover,416.0,4.2
1577,Assassin's Code: A Joe Ledger Novel,Jonathan Maberry,St. Martin's Griffin,2012-4-10,Kindle,432.0,4.6
1578,"First Among Sequels (Thursday Next, Book 5)",Jasper Fforde,Penguin Books,2008-7-29,Hardcover,384.0,4.3
1579,Cry to Heaven: A Novel,Anne Rice,Ballantine Books,1995-4-1,Paperback,576.0,4.4
1580,"Killer Pancake (Goldy Culinary Mysteries, Book 5)",Diane Mott Davidson,Crimeline,1996-8-1,Hardcover,368.0,4.3
1581,Nothing Left to Lose: A Novel (John Cleaver),Dan Wells,Tor Books,2017-6-6,Hardcover,336.0,4.4
1582,The Peripheral,William Gibson,Berkley,2015-10-6,Paperback,496.0,4.2
1583,The Other Side of Midnight,Simone St. James,Berkley,2015-4-7,Hardcover,318.0,4.4
1584,The Winter Queen: A Novel (An Erast Fandorin Mystery),Boris Akunin,Random House Trade Paperbacks,2004-3-9,Paperback,264.0,4.2
1585,Destiny Blues (Hand of Fate) (Volume 1),Sharon Joss,Aja Publishing,2015-12-17,Kindle,324.0,4.2
1586,The Remaining: Extinction,D.J. Molles,Orbit,2015-7-28,Paperback,480.0,4.7
1587,The Eight,Katherine Neville,Ballantine Books,1990-1-14,Hardcover,624.0,4.1
1588,HANAMONOGATARI,NISIOISIN,Vertical,2018-6-26,Kindle,1.0,
1589,Seer of Sevenwaters,Juliet Marillier,Ace,2011-9-6,Hardcover,448.0,4.3
1590,Battle Royale: Remastered (Battle Royale (Novel)),Koushun Takami,Haikasoru,2014-4-1,Paperback,600.0,4.5
1591,The Vampire Armand (The Vampire Chronicles) Book 6,Anne Rice,Ballantine Books,2000-10-3,Hardcover,457.0,4.0
1592,Promises To Keep (The Disruption Trilogy) (Volume 3),R E McDermott,R.E. McDermott,2017-9-8,Paperback,388.0,4.9
1593,Blood Canticle (The Vampire Chronicles),Anne Rice,Ballantine Books,2004-8-31,Paperback,401.0,3.9
1594,Mark of Evil (The End Series),Tim LaHaye,Zondervan,2014-2-4,Hardcover,416.0,4.6
1595,Ghost Run (Day by Day Armageddon),J. L. Bourne,Gallery Books,2016-7-19,Kindle,256.0,4.8
1596,The Fall: Book Two of the Strain Trilogy,Chuck Hogan,William Morrow Paperbacks,2012-10-2,Paperback,480.0,4.4
1597,Animal: The Beginning,K'wan,Urban Books,2016-6-28,Paperback,304.0,4.3
1598,Tomorrow War: Serpent Road: A Novel (The Chronicles of Max),J. L. Bourne,Gallery Books,2017-7-25,Kindle,320.0,4.9
1599,The Luster of Lost Things,Sophie Chen Keller,G.P. Putnam's Sons,2017-8-8,Hardcover,336.0,4.3
1600,Los Pilares de la Tierra (Spanish Edition),Ken Follett,Vintage Espanol,2010-7-13,Paperback,1040.0,4.7
1601,Code Zero: A Joe Ledger Novel,Jonathan Maberry,St. Martin's Griffin,2014-3-25,Hardcover,480.0,4.6
1602,The Assault: Cycle Two of the Harbingers Series,Angela Hunt,Bethany House Publishers,2017-8-1,Paperback,368.0,4.2
1603,The Remaining: Fractured,D.J. Molles,Orbit,2014-8-26,Kindle,720.0,4.8
1604,The Anubis Gates (Ace Science Fiction),Tim Powers,Ace,1997-1-1,Hardcover,400.0,4.0
1605,Countdown City: The Last Policeman Book II (The Last Policeman Trilogy),Ben H. Winters,Quirk Books,2013-7-16,Hardcover,316.0,4.2
1606,Deadeye Dick: A Novel,Kurt Vonnegut,Dial Press Trade Paperback,1999-5-11,Kindle,271.0,4.2
1607,The Apothecary's Poison (Glass and Steele),C.J. Archer,C.J. Archer,2017-11-7,Hardcover,324.0,4.7
1608,The Last Time I Saw Her: A Novel (Dr. Charlotte Stone),Karen Robards,Ballantine Books,2016-5-31,Kindle,384.0,4.8
1609,Forbidden (The Books of Mortals),Ted Dekker,FaithWords,2012-10-30,Hardcover,448.0,4.4
1610,The Magus,John Fowles,Dell,1985-4-1,Kindle,672.0,4.1
1611,The Bookseller: A Novel,Cynthia Swanson,Harper Paperbacks,2016-3-22,Kindle,368.0,4.1
1612,Dead Souls,Nikolai Gogol,Vintage,1997-3-25,Hardcover,432.0,3.9
1613,The Castle,Franz Kafka,Schocken,1998-12-15,Hardcover,352.0,4.0
1614,Assassin's Creed: Renaissance,Oliver Bowden,Ace,2010-2-23,Kindle,496.0,4.1
1615,"Tempting Danger (The World of the Lupi, Book 1)",Eileen Wilks,Berkley,2004-10-5,Hardcover,320.0,4.3
1616,The King of Plagues: A Joe Ledger Novel,Jonathan Maberry,St. Martin's Paperbacks,2016-8-2,Paperback,624.0,4.4
1617,Satoshi Kon's: Opus,Satoshi Kon,Dark Horse Manga,2014-12-9,Kindle,384.0,4.5
1618,Accelerando (Singularity),Charles Stross,Ace,2006-6-27,Paperback,415.0,3.7
1619,The Ruins,Scott Smith,Vintage,2008-2-26,Hardcover,384.0,3.3
1620,Into the Storm (Destroyermen),Taylor Anderson,Ace,2009-2-3,Paperback,416.0,4.4
1621,Carter Beats the Devil,Glen David Gold,Hachette Books,2002-9-18,Hardcover,496.0,4.4
1622,Pastoralia,George Saunders,Riverhead Books,2001-6-1,Hardcover,188.0,4.2
1623,Hopscotch: A Novel (Pantheon Modern Writers Series),Julio Cortazar,Pantheon,1987-2-12,Kindle,576.0,4.1
1624,When Dreams Cross (Second Chances Series #2),Terri Blackstock,Zondervan,2000-6-1,Hardcover,240.0,4.3
1625,The Abyss Beyond Dreams: A Novel of the Commonwealth (Commonwealth: Chronicle of the Fallers),Peter F. Hamilton,Del Rey,2015-9-1,Hardcover,640.0,4.3
1626,"On What Grounds (Coffeehouse Mysteries, No. 1)",Cleo Coyle,Berkley,2003-9-2,Kindle,288.0,3.9
1627,"Sharper Than a Serpent's Tooth (Nightside, Book 6)",Simon R. Green,Ace,2006-2-28,Kindle,256.0,4.3
1628,Refugees (The Remaining),D.J. Molles,Orbit,2014-7-29,Paperback,544.0,4.8
1629,World of Trouble: The Last Policeman Book III (The Last Policeman Trilogy),Ben H. Winters,Quirk Books,2014-7-15,Hardcover,320.0,4.4
1630,Brownies and Broomsticks: A Magical Bakery Mystery,Bailey Cates,Berkley,2012-5-1,Hardcover,336.0,4.4
1631,Faust (Bantam Classics) (Part I) (English and German Edition),Johann Wolfgang von Goethe,Bantam Books,1988-8-1,Hardcover,327.0,3.9
1632,American Elsewhere,Robert Jackson Bennett,Orbit,2013-2-12,Paperback,688.0,4.0
1633,A Puzzle in Paxton Park (A Paxton Park Mystery) (Volume 3),J A Whiting,CreateSpace Independent Publishing Platform,2018-2-28,Paperback,264.0,4.9
1634,Assassin's Creed: Unity,Oliver Bowden,Ace,2014-12-2,Kindle,432.0,4.4
1635,The End: A Postapocalyptic Novel (The New World Series),G. Michael Hopf,Plume,2014-1-7,Kindle,384.0,4.1
1636,Forever Peace,Joe Haldeman,Ace,1998-10-1,Paperback,368.0,3.4
1637,Blonde: A Novel,Joyce Carol Oates,Ecco,2009-9-15,Kindle,752.0,4.0
1638,A Familiar Tail (A Witch's Cat Mystery),Delia James,Berkley,2016-2-2,Paperback,336.0,4.7
1639,If Walls Could Talk (Haunted Home Renovation Mysteries),Juliet Blackwell,OBSIDIAN,2010-12-7,Hardcover,326.0,4.3
1640,Eaters of the Dead,Michael Crichton,Harper,2009-4-28,Kindle,179.0,4.2
1641,Dog Food 2: K'wan Presents,Raynesha Pittman,Urban Books,2016-11-29,Hardcover,304.0,4.9
1642,Over Your Dead Body (John Cleaver),Dan Wells,Tor Books,2016-5-3,Paperback,304.0,4.5
1643,77 Shadow Street (with bonus novella The Moonlit Mind): A Novel,Dean Koontz,Bantam,2012-8-28,Hardcover,720.0,3.4
1644,Extinction Machine: A Joe Ledger Novel,Jonathan Maberry,St. Martin's Griffin,2013-3-26,Kindle,448.0,4.6
1645,The Good Guy: A Novel,Dean Koontz,Bantam,2012-6-26,Paperback,464.0,4.2
1646,Touch the Dark (Cassandra Palmer),Karen Chance,Ace,2006-6-6,Hardcover,320.0,3.6
1647,Mr. Monster (John Cleaver),Dan Wells,Tor Books,2010-9-28,Kindle,288.0,4.5
1648,The Day the Streets Stood Still (Urban Books),JaQuavis Coleman,Urban Books,2014-9-30,Paperback,288.0,4.5
1649,An Inquiry Into Love and Death,Simone St. James,Berkley,2013-3-5,Kindle,368.0,4.3
1650,More Than Human,Theodore Sturgeon,Vintage,1998-12-29,Hardcover,192.0,4.3
1651,Her Last Whisper: A Novel (Dr. Charlotte Stone),Karen Robards,Ballantine Books,2015-6-30,Paperback,400.0,4.5
1652,The Last Victim: A Novel (Dr. Charlotte Stone),Karen Robards,Ballantine Books,2013-4-30,Hardcover,416.0,4.1
1653,Ghost Night (The Bone Island Trilogy),Heather Graham,MIRA,2010-7-27,Paperback,400.0,4.5
1654,Meg: Hell's Aquarium,Steve Alten,Tor Books,2010-4-27,Paperback,512.0,4.3
1655,Warlock Holmes: The Hell-Hound of the Baskervilles: Warlock Holmes 2,G.S. Denning,Titan Books,2017-5-16,Kindle,320.0,4.9
1656,"Shatter the Bones (Logan McRae, Book 7)",Stuart MacBride,HarperCollins,2012-1-5,Paperback,464.0,4.4
1657,Caught Dead Handed (A Witch City Mystery),Carol J. Perry,Kensington,2014-9-2,Hardcover,416.0,4.3
1658,From the Corner of His Eye: A Novel,Dean Koontz,Bantam,2012-5-29,Paperback,752.0,4.5
1659,"The Vampire Chronicles Collection, Volume 1",Anne Rice,Ballantine Books,2002-10-1,Hardcover,1280.0,4.6
1660,Company Town,Madeline Ashby,Tor Books,2017-7-18,Hardcover,288.0,4.1
1661,Twilight Eyes,Dean Koontz,Berkley,2007-12-4,Paperback,480.0,4.3
1662,Lord Foulgrin's Letters,Randy Alcorn,Multnomah,2001-9-13,Hardcover,208.0,4.6
1663,The Perfect Poison (Arcane Society),Amanda Quick,Berkley,2010-3-30,Hardcover,464.0,4.5
1664,An Artificial Night (October Daye),Seanan McGuire,DAW,2010-9-7,Hardcover,384.0,4.5
1665,After Atlas (A Planetfall Novel),Emma Newman,Ace,2016-11-8,Paperback,384.0,4.4
1666,Beatlebone,Kevin Barry,Anchor,2016-10-4,Paperback,320.0,3.5
1667,Rise of a Merchant Prince: Book Two of the Serpentwar Saga,Raymond E Feist,Harper Voyager,2010-12-28,Paperback,464.0,4.0
1668,Hunger (Penguin Twentieth-Century Classics),Knut Hamsun,Penguin Classics,1998-2-1,Kindle,240.0,4.3
1669,Blood Price (Blood Books),Tanya Huff,DAW,2007-9-25,Kindle,272.0,4.0
1670,Carl Weber's Kingpins: Miami,Nikki Turner,Urban Books,2016-6-28,Kindle,304.0,4.1
1671,Chest of Bone (Afterworld Chronicles),Vicki Stiefel,Curiosity Quills Press,2017-2-14,Hardcover,,4.3
1672,Assassin's Creed: Brotherhood,Oliver Bowden,Ace,2010-11-30,Kindle,528.0,4.4
1673,Gone South,Robert McCammon,Gallery Books,2008-10-14,Paperback,416.0,4.4
1674,One Lucky Vampire: An Argeneau Novel (Argeneau Vampire),Lynsay Sands,Avon,2013-9-24,Kindle,384.0,4.5
1675,Symbiont (Parasitology),Mira Grant,Orbit,2015-10-13,Paperback,544.0,3.8
1676,I Will Fear No Evil,Robert A. Heinlein,Ace,1987-4-15,Paperback,512.0,3.7
1677,"A Quick Bite (Argeneau Vampires, Book 1)",Lynsay Sands,Avon,2005-10-25,Hardcover,384.0,4.1
1678,At Swim-Two-Birds (Irish Literature),Flann O'Brien,Dalkey Archive Press,2005-9-1,Hardcover,239.0,3.8
1679,A Cry In The Night,Mary Higgins Clark,Pocket Books,1993-12-1,Kindle,352.0,4.3
1680,Kill Switch: A Joe Ledger Novel,Jonathan Maberry,St. Martin's Griffin,2016-4-26,Hardcover,544.0,4.6
1681,Cold Silence (A Joe Rush Novel),James Abel,Berkley,2017-5-30,Paperback,400.0,4.2
1682,Blood Orbit: A Gattis File Novel,K. R. Richardson,Pyr,2018-5-8,Kindle,496.0,
1683,The Presence: A Novel,John Saul,Ballantine Books,1998-4-29,Kindle,432.0,4.3
1684,Vampires Like It Hot: An Argeneau Novel,Lynsay Sands,Avon,2018-9-18,Hardcover,384.0,
1685,Heir to Sevenwaters,Juliet Marillier,Ace,2009-11-3,Hardcover,416.0,4.5
1686,The Cormorant (Miriam Black),Chuck Wendig,Saga Press,2016-2-23,Hardcover,352.0,4.5
1687,Fear Nothing: A Novel (Christopher Snow),Dean Koontz,Bantam,2012-7-31,Paperback,448.0,4.2
1688,The Case of the Green-Dressed Ghost (Dr Ribero's Agency of the Supernatural),Lucy Banks,Amberjack Publishing,2017-3-7,Kindle,284.0,4.4
1689,The Shadow Girl,Misty Mount,Between the Lines Publishing,2017-12-29,Paperback,298.0,4.9
1690,Resident Evil: City of the Dead,S.D. Perry,Titan Books,2012-9-18,Hardcover,336.0,4.7
1691,Look Both Ways (A Witch City Mystery),Carol J. Perry,Kensington,2015-10-27,Hardcover,352.0,4.5
1692,The Engines of God,Jack McDevitt,Ace,1995-12-1,Hardcover,432.0,4.0
1693,A Vision of Fire: Book 1 of The EarthEnd Saga,Gillian Anderson,Simon & Schuster/ Simon451,2015-11-24,Hardcover,304.0,4.0
1694,The Damnation Game,Clive Barker,Berkley,2002-11-5,Kindle,448.0,4.1
1695,Concrete Island: A Novel,J. G. Ballard,Picador,2001-10-5,Paperback,176.0,3.8
1696,Road Dawgz: Triple Crown Collection (The Triple Crown Collection),K'wan,Urban Books,2015-10-27,Hardcover,304.0,4.1
1697,Flintlock,William W. Johnstone,Pinnacle,2013-10-1,Paperback,384.0,3.9
1698,Seize the Night: A Novel (Christopher Snow),Dean Koontz,Bantam,2012-7-31,Paperback,464.0,4.3
1699,The Haunted Heist (Southern Ghost Hunter) (Volume 3),Angie Fox,Angie Fox,2016-3-17,Hardcover,264.0,4.8
1700,A Winter Haunting,Dan Simmons,HarperTorch,2002-12-31,Hardcover,384.0,4.0
1701,Warlock Holmes - A Study in Brimstone,G.S. Denning,Titan Books,2016-5-17,Kindle,336.0,4.5
1702,Inspector Hobbes and the Blood: unhuman I - A fast paced comedy crime fantasy (Volume 1),Wilkie Martin,The Witcherley Book Company,2013-7-24,Paperback,312.0,4.0
1703,Southern Bastards Volume 4,Jason Aaron,Image Comics,2018-6-12,Paperback,160.0,
1704,The Golem of Hollywood,Jesse Kellerman,Berkley,2015-7-28,Kindle,688.0,2.7
1705,War God: Night of Sorrows,Graham Hancock,Peach Publishing,2017-4-21,Paperback,512.0,4.9
1706,"Better Read Than Dead (Psychic Eye Mysteries, Book 2)",Victoria Laurie,Berkley,2005-6-7,Kindle,304.0,4.4
1707,Below,Ryan Lockwood,Pinnacle,2013-6-25,Kindle,416.0,4.2
1708,Company of Liars: A Novel,Karen Maitland,Delta,2009-8-25,Kindle,480.0,4.1
1709,Moonshine,Jasmine Gower,Angry Robot,2018-2-6,Paperback,320.0,3.9
1710,Sinner: A Paradise Novel (The Books of History Chronicles) (The Books of History Chronicles: The Paradise Books),Dekker Ted,Thomas Nelson,2009-6-30,Hardcover,384.0,4.0
1711,The Jefferson Key (with bonus short story The Devil's Gold): A Novel (Cotton Malone),Steve Berry,Ballantine Books,2011-12-27,Hardcover,592.0,4.1
1712,Letter from an Unknown Woman and Other Stories,Stefan Zweig,Pushkin Press,2013-8-13,Paperback,200.0,4.4
1713,Panic in Paxton Park (A Paxton Park Mystery) (Volume 2),J A Whiting,CreateSpace Independent Publishing Platform,2017-10-25,Paperback,260.0,4.7
1714,Hood Misfits Volume 2: Carl Weber Presents,Brick,Urban Books,2015-7-28,Kindle,304.0,4.8
1715,Floating Dragon,Peter Straub,Berkley,2003-8-5,Kindle,624.0,4.3
1716,The Awakening: A Paranormal Romance Novel (The Graveyard Queen),Amanda Stevens,MIRA,2017-3-28,Hardcover,416.0,4.8
1717,"Nightingale's Lament (Nightside, Book 3)",Simon R. Green,Ace,2004-4-27,Paperback,256.0,4.5
1718,A Panicked Premonition (Psychic Eye Mystery),Victoria Laurie,Berkley,2018-6-5,Hardcover,368.0,4.5
1719,Odds Against Tomorrow: A Novel,Nathaniel Rich,Picador,2014-4-1,Hardcover,320.0,3.6
1720,Dead Man's Song (A Pine Deep Novel),Jonathan Maberry,Kensington,2016-8-30,Kindle,512.0,4.1
1721,Lord Valentine's Castle: Book One of the Majipoor Cycle,Robert K. Silverberg,Ace,2012-5-1,Kindle,480.0,4.1
1722,The Ghost and Mrs. Muir: Vintage Movie Classics,R. A. Dick,Vintage,2014-9-23,Paperback,192.0,4.6
1723,The Third Angel: A Novel,Alice Hoffman,Broadway Books,2009-3-3,Kindle,289.0,3.9
1724,The Map of Time: A Novel (The Map of Time Trilogy),Félix J. Palma,Pocket Books,2012-6-26,Hardcover,720.0,3.4
1725,Cat Under Fire: A Joe Grey Mystery (Joe Grey Mystery Series),Shirley Rousseau Murphy,Avon,1998-12-9,Paperback,256.0,4.7
1726,A Flicker of Steel (The Avalon Chronicles),Steve McHugh,47North,2018-7-3,Hardcover,,
1727,Give Up the Ghost (Haunted Home Renovation),Juliet Blackwell,Berkley,2015-12-1,Hardcover,336.0,4.8
1728,The Magic Circle,Katherine Neville,Ballantine Books,1999-1-30,Hardcover,560.0,3.4
1729,"If You've Got It, Haunt It (A Haunted Vintage Mystery)",Rose Pressey,Kensington,2014-12-2,Hardcover,304.0,4.1
1730,Ghost Road Blues (A Pine Deep Novel),Jonathan Maberry,Kensington,2016-5-31,Kindle,480.0,4.2
1731,White Colander Crime (A Vintage Kitchen Mystery),Victoria Hamilton,Berkley,2015-11-3,Hardcover,304.0,4.2
1732,Powerless,Tim Washburn,Pinnacle,2015-10-27,Paperback,464.0,4.2
1733,Phantom Evil (Krewe of Hunters),Heather Graham,MIRA,2012-3-27,Hardcover,368.0,4.3
1734,The Invisibility Cloak (New York Review Books Classics),Ge Fei,NYRB Classics,2016-10-11,Paperback,144.0,4.1
1735,Dead Bolt: A Haunted Home Renovation Mystery (Haunted Home Repair Mystery),Juliet Blackwell,Berkley,2011-12-6,Kindle,336.0,4.4
1736,Home for the Haunting: A Haunted Home Renovation Mystery,Juliet Blackwell,Berkley,2013-12-3,Kindle,336.0,4.6
1737,Every Witch Way But Wicked: A Wicked Witches of the Midwest Mystery (Volume 2),Amanda M. Lee,CreateSpace Independent Publishing Platform,2013-3-28,Paperback,206.0,4.6
1738,The Pyramid of Doom: A Novel,Andy McDermott,Bantam,2010-9-28,Hardcover,496.0,4.1
1739,The Word Exchange,Alena Graedon,Anchor,2015-2-3,Hardcover,384.0,3.8
1740,Crooked Little Vein,Warren Ellis,William Morrow Paperbacks,2008-7-22,Kindle,304.0,4.0
1741,The Life and Loves of a She Devil,Fay Weldon,Ballantine Books,1985-8-12,Hardcover,288.0,3.9
1742,By Familiar Means (A Witch's Cat Mystery),Delia James,Berkley,2016-9-27,Hardcover,336.0,4.6
1743,The Last Girl (The Dominion Trilogy),Joe Hart,Thomas & Mercer,2016-3-1,Paperback,384.0,4.1
1744,Echo Moon (A Ghost Gifts Novel),Laura Spinella,Montlake Romance,2018-5-22,Paperback,428.0,
1745,The Drafter (The Peri Reed Chronicles),Kim Harrison,Pocket Books,2016-4-19,Hardcover,560.0,4.0
1746,"Bitter Gold Hearts (Garrett, P.I., Book 2)",Glen Cook,Ace,2007-4-1,Hardcover,288.0,4.7
1747,Inspector Hobbes and the Curse: unhuman II - a Fast Paced Comedy Crime Fantasy Romance (Volume 2),Wilkie Martin,The Witcherley Book Company,2013-10-28,Kindle,354.0,4.4
1748,Pure,Julianna Baggott,Grand Central Publishing,2012-9-4,Hardcover,431.0,4.1
1749,Bad Monkeys: A Novel (P.S.),Matt Ruff,Harper Perennial,2008-8-12,Paperback,256.0,3.8
1750,Carl Weber's Kingpins: ATL,Brick,Urban Books,2017-3-28,Kindle,304.0,3.9
1751,Push Back: A Post Apocalyptic Thriller (The Disruption Series) (Volume 2),R E McDermott,R.E. McDermott,2016-7-26,Paperback,390.0,4.8
1752,The Skill of Our Hands: A Novel (The Incrementalists),Steven Brust,Tor Books,2018-1-2,Hardcover,352.0,4.1
1753,"Krondor the Assassins (The Riftwar Legacy, Book 2)",Raymond E Feist,HarperTorch,2000-11-7,Paperback,416.0,4.2
1754,Grave Creatures (Las Vegas Paranormal Police Department) (Volume 2),John P. Logsdon,CreateSpace Independent Publishing Platform,2017-11-15,Hardcover,244.0,4.7
1755,The Drowning Girl,Caitlin R. Kiernan,Ace,2012-3-6,Kindle,352.0,4.0
1756,American Short Story Masterpieces: A Rich Selection of Recent Fiction from America's Best Modern Writers,Tom Jenks,Dell,1989-4-2,Hardcover,528.0,4.2
1757,Dead Spots (Scarlett Bernard),Melissa F. Olson,47North,2012-10-30,Hardcover,293.0,4.3
1758,Personal Demon,Kelley Armstrong,Bantam,2008-9-30,Paperback,544.0,4.2
1759,Cast in Flight (Chronicles of Elantra),Michelle Sagara,MIRA,2016-10-25,Paperback,544.0,4.6
1760,Aunt Dimity: Vampire Hunter (Aunt Dimity Mystery),Nancy Atherton,Penguin Books,2009-1-27,Hardcover,304.0,4.5
1761,Whalestoe Letters,Mark Z. Danielewski,Pantheon,2000-10-10,Paperback,86.0,3.9
1762,The Universal Baseball Association,Robert Coover,The Overlook Press,2011-11-1,Hardcover,256.0,4.1
1763,Glass Predator (Harmony Black Series),Craig Schaefer,47North,2017-3-28,Hardcover,332.0,4.5
1764,A Deadly Web (A Bishop Files Novel),Kay Hooper,Berkley,2015-4-7,Kindle,304.0,3.8
1765,Decapitation: Kubikiri Cycle (Zaregoto Series),NISIOISIN,Vertical,2017-1-24,Kindle,322.0,5.0
1766,The Queen of All Crows: The First Book in The Map of Unknown Things (1map of Unknown Things),Rod Duncan,Angry Robot,2018-1-2,Paperback,352.0,4.3
1767,A King's Commander: The Alan Lewrie Naval Adventures #7 (Bk. 7),Dewey Lambdin,McBooks Press,2008-1-1,Hardcover,448.0,4.3
1768,The Bride Wore Black Leather (A Nightside Book),Simon R. Green,Ace,2012-12-24,Paperback,320.0,4.4
1769,Who Killed Sherlock Holmes? (Shadow Police),Paul Cornell,Pan Macmillan,2017-5-1,Paperback,368.0,4.3
1770,Dopefiend,Donald Goines,Holloway House,2007-5-1,Hardcover,320.0,4.6
1771,Sookie Stackhouse 8-copy Boxed Set (Sookie Stackhouse / Southern Vampire),Charlaine Harris,Ace,2009-9-29,Hardcover,2500.0,4.6
1772,Rage of a Demon King: Book Three of the Serpentwar Saga,Raymond E Feist,Harper Voyager,2010-12-28,Hardcover,608.0,4.2
1773,The Glass Bees (New York Review Books Classics),Ernst Junger,NYRB Classics,2000-9-30,Paperback,224.0,4.5
1774,The Darkest Evening of the Year: A Novel,Dean Koontz,Bantam,2012-5-29,Hardcover,480.0,3.9
1775,Conspiracies: A Repairman Jack Novel,F. Paul Wilson,Tor Books,2008-9-30,Paperback,416.0,4.2
1776,Aftermath (Splinter Cell: Blacklist),Peter Telep,Berkley,2013-10-1,Hardcover,384.0,4.1
1777,Trick Or Treat Murder (A Lucy Stone Mystery),Leslie Meier,Kensington,2011-9-1,Hardcover,256.0,4.1
1778,The Law of Nines,Terry Goodkind,Jove,2010-8-31,Kindle,576.0,4.0
1779,Finding Camlann: A Novel,Sean Pidgeon,W. W. Norton & Company,2014-1-13,Kindle,352.0,4.0
1780,The Angel of Death (The Soul Summoner Series) (Volume 3),Elicia Hyder,Forge Creek Press,2016-7-16,Hardcover,406.0,4.8
1781,Collision Course,David Crawford,Berkley,2012-11-6,Kindle,339.0,3.2
1782,"Tangle of Need: A Psy-Changeling Novel (Psy-Changeling Novel, A)",Nalini Singh,Berkley,2012-12-4,Hardcover,448.0,4.2
1783,Lock and Key: The Initiation,Ridley Pearson,HarperCollins,2017-5-2,Hardcover,384.0,4.3
1784,Learning Tree,Gordon Parks,Fawcett,1987-6-12,Paperback,240.0,4.6
1785,The Man Who Was Thursday: A Nightmare (Penguin Classics),G. K. Chesterton,Penguin Classics,2011-5-31,Kindle,192.0,4.1
1786,Bannerless (The Bannerless Saga),Carrie Vaughn,John Joseph Adams/Mariner Books,2017-7-11,Kindle,288.0,4.0
1787,The Thought Readers (Mind Dimensions Book 1) (Volume 1),Dima Zales,Mozaika Publications,2014-10-2,Paperback,302.0,4.2
1788,Harmony Black (Harmony Black Series),Craig Schaefer,47North,2016-2-1,Kindle,332.0,4.3
1789,Empire of Gold: A Novel (Nina Wilde and Eddie Chase),Andy McDermott,Bantam,2011-9-27,Hardcover,544.0,4.1
1790,The Swarm: A Novel,Frank Schatzing,William Morrow Paperbacks,2007-5-8,Paperback,912.0,4.0
1791,The Operator (The Peri Reed Chronicles),Kim Harrison,Pocket Books,2016-11-22,Paperback,496.0,4.4
1792,"A Deeper Blue (Paladin of Shadows, Book 5)",John Ringo,Baen,2008-5-20,Kindle,432.0,4.6
1793,Babylon Rising: The Secret on Ararat,Tim LaHaye,Bantam,2006-11-28,Kindle,416.0,4.5
1794,Storm Surge (Destroyermen),Taylor Anderson,Ace,2014-5-6,Paperback,512.0,4.6
1795,"The New Girl (Fear Street, No. 1)",R. L. Stine,Simon Pulse,2006-8-1,Kindle,176.0,4.2
1796,Carl Weber's Kingpins: Cleveland,Brandi Johnson,Urban Books,2017-4-25,Paperback,304.0,4.5
1797,The Ark: Children of a Dead Earth Book One,Patrick S. Tomlinson,Angry Robot,2015-11-3,Hardcover,400.0,3.9
1798,The Midwich Cuckoos,John Wyndham,Penguin UK,2008-9-23,Kindle,224.0,4.1
1799,A Toxic Trousseau,Juliet Blackwell,Berkley,2016-7-5,Paperback,352.0,4.8
1800,Knot the Usual Suspects (Haunted Yarn Shop Mystery),Molly MacRae,Berkley,2015-9-1,Paperback,352.0,4.3
1801,"Haunted Destiny: A paranormal, thrilling suspense novel (Krewe of Hunters)",Heather Graham,MIRA,2016-5-24,Kindle,368.0,4.6
1802,The Hidden (Krewe of Hunters),Heather Graham,MIRA,2015-9-29,Paperback,368.0,4.6
1803,Devil's Pocket,John Dixon,Gallery Books,2015-8-4,Kindle,352.0,4.5
