ID,Name,Author,Publisher,Publishing_Date,Format,Pages,Rating
813,"Portals, Passages & Pathways: Book 1: In the Land of Magnanthia (Volume 1)",B. R. Maul,CreateSpace Independent Publishing Platform,2014-4-24,Kindle,478.0,4.3
814,Leviathan Wakes,James S. A. Corey,Orbit,2011-6-15,Kindle,592.0,4.5
815,The Pillars of the Earth: A Novel (Kingsbridge),Ken Follett,Penguin Books,1990-7-9,Paperback,983.0,4.5
816,Super Friends: Flying High (DC Super Friends) (Step into Reading),Nick Eliopulos,Random House Books for Young Readers,2008-5-27,Paperback,32.0,4.6
817,Train Your Angry Dragon: Teach Your Dragon To Be Patient. A Cute Children Story To Teach Kids About Emotions and Anger Management. (Dragon Books for Kids) (My Dragon Books) (Volume 2),Steve Herman,DG Books Publishing,2018-1-22,Hardcover,44.0,4.6
818,The Princess in Black and the Perfect Princess Party,Shannon Hale,Candlewick,2016-4-12,Hardcover,96.0,4.9
819,Wicked: The Life and Times of the Wicked Witch of the West (Wicked Years),Gregory Maguire,Harper,2007-9-25,Kindle,560.0,3.8
820,Romeo and Juliet,William Shakespeare,CreateSpace Independent Publishing Platform,2017-11-23,Kindle,92.0,4.5
821,Bloodfire: Blood Destiny I (Volume 1),Helen Harper,CreateSpace Independent Publishing Platform,2013-7-25,Kindle,316.0,4.3
822,"Delicious in Dungeon, Vol. 4",Ryoko Kui,Yen Press,2018-2-27,Hardcover,192.0,4.6
823,Witchblood (Volume 1),Emma Mills,CreateSpace Independent Publishing Platform,2012-10-12,Hardcover,328.0,4.3
824,His Driven Domme (The Dungeon Fantasy Club) (Volume 4),Anya Summers,Blushing Books Publications,2016-7-14,Kindle,220.0,4.6
825,Fantasy Online: Hyperborea (Volume 1),Harmon Cooper,CreateSpace Independent Publishing Platform,2017-5-6,Hardcover,570.0,4.1
826,The Gender Game 2: The Gender Secret (Volume 2),Bella Forrest,CreateSpace Independent Publishing Platform,2016-11-21,Paperback,424.0,4.6
827,Hot and Badgered (The Honey Badgers),Shelly Laurenston,Kensington,2018-3-27,Hardcover,432.0,5.0
828,The Legend of Zelda: Twilight Princess Vol. 1,Akira Himekawa,VIZ Media LLC,2017-3-14,Kindle,200.0,4.7
829,Journal 29: Interactive Book Game,Dimitris Chassapakis,Primedia eLaunch LLC,2017-2-1,Kindle,148.0,4.6
830,Bone: The Complete Cartoon Epic in One Volume,Jeff Smith,Cartoon Books,,Hardcover,1344.0,4.6
831,Disney Dreams Collection Thomas Kinkade Studios Coloring Book,Thomas Kinkade,Andrews McMeel Publishing,2017-9-19,Paperback,128.0,4.7
832,The BFG,Roald Dahl,Puffin Books,2007-8-16,Kindle,224.0,4.7
833,Cat's Cradle: A Novel,Kurt Vonnegut,Dell Publishing,1998-9-8,Hardcover,304.0,4.3
834,Island of Glass (Guardians Trilogy),Nora Roberts,Berkley,2016-12-6,Kindle,352.0,4.8
835,"The Son of Neptune (Heroes of Olympus, Book 2)",Rick Riordan,Disney-Hyperion,2013-7-2,Paperback,560.0,4.8
836,Cress,Marissa Meyer,Square Fish,2015-1-27,Kindle,592.0,4.8
837,"Heroes of Olympus, The Book Three The Mark of Athena (The Heroes of Olympus)",Rick Riordan,Disney-Hyperion,2014-4-8,Kindle,672.0,4.8
838,Warriors #1: Into the Wild (Warriors: The Prophecies Begin),Erin Hunter,HarperCollins,2015-3-17,Kindle,320.0,4.8
839,The Killer Angels: The Classic Novel of the Civil War (Civil War Trilogy),Michael Shaara,Ballantine Books,1987-8-12,Kindle,355.0,4.7
840,Legend,Marie Lu,Speak,2013-4-16,Paperback,352.0,4.5
841,Binti,Nnedi Okorafor,Tor.com,2015-9-22,Kindle,96.0,4.5
842,Stories of Your Life and Others,Ted Chiang,Vintage,2016-6-14,Paperback,304.0,4.4
843,How to Hang a Witch,Adriana Mather,Ember,2017-9-12,Kindle,368.0,4.8
844,"Harry Potter and the Cursed Child, Parts One and Two: The Official Playscript of the Original West End Production",J.K. Rowling,Arthur A. Levine Books,2017-7-25,Hardcover,336.0,3.8
845,The Once and Future King,T. H. White,Ace Books,,Hardcover,639.0,4.2
846,Hotbloods (Volume 1),Bella Forrest,CreateSpace Independent Publishing Platform,2017-11-26,Hardcover,350.0,4.4
847,The Trouble with Twelfth Grave: A Charley Davidson Novel (Charley Davidson Series),Darynda Jones,St. Martin's Paperbacks,2018-2-27,Paperback,304.0,4.7
848,"Sonatas, Fantasias & Rondos, Vol 2 (Kalmus Edition)",Carl Philipp Emanuel Bach,Alfred Music,1985-3-1,Kindle,108.0,
849,The Night Circus,Erin Morgenstern,Anchor Books,2012-7-3,Paperback,516.0,4.4
850,Howl's Moving Castle,Diana Wynne Jones,Greenwillow Books,2008-4-22,Hardcover,448.0,4.7
851,Scarlet,Marissa Meyer,Square Fish,2014-0-0,Hardcover,512.0,4.7
852,The Year's Best Fantasy and Horror: Eighteenth Annual Collection (Year's Best Fantasy & Horror (Paperback)),Ellen Datlow,St. Martin's Griffin,2005-8-1,Kindle,608.0,3.8
853,"Water, Book One of the Akasha Series",Terra Harmony,CreateSpace Independent Publishing Platform,2012-7-13,Paperback,292.0,3.5
854,The Chosen: A Novel of the Black Dagger Brotherhood,J.R. Ward,Ballantine Books,2017-9-26,Paperback,576.0,4.7
855,Fledgling: The Shapeshifter Chronicles (Volume 1),Natasha Brown,Natasha S Brown,2012-1-15,Hardcover,242.0,4.1
856,ONSET: To Serve and Protect (Volume 1),Glynn Stewart,Faolan's Pen Publishing Inc.,2016-11-29,Kindle,400.0,4.5
857,Darkstalker (Wings of Fire: Legends),Tui T. Sutherland,Scholastic Inc.,2017-11-28,Paperback,400.0,4.8
858,The Prince and the Dressmaker,Jen Wang,First Second,2018-2-13,Hardcover,288.0,4.7
859,The Essential Calvin and Hobbes: a Calvin and Hobbes Treasury,Bill Watterson,Andrews McMeel Publishing,1988-0-0,Hardcover,256.0,4.8
860,Between Shades of Gray,Ruta Sepetys,Speak,2012-4-3,Paperback,384.0,4.7
861,The Wind Through the Keyhole: The Dark Tower IV-1/2,Stephen King,Scribner,2016-12-6,Hardcover,320.0,4.6
862,"The Shadow Throne (The Ascendance Trilogy, Book 3): Book 3 of The Ascendance Trilogy",Jennifer A. Nielsen,Scholastic Paperbacks,2015-1-27,Paperback,336.0,4.7
863,The Watchmaker's Daughter (Glass and Steele),C.J. Archer,C.J. Archer,2017-11-7,Hardcover,300.0,4.3
864,Ishmael:A Novel,Daniel Quinn,Bantam,1995-5-1,Kindle,263.0,4.6
865,Armada: A novel by the author of Ready Player One,Ernest Cline,Broadway Books,2016-4-12,Paperback,384.0,3.6
866,The Martian,Andy Weir,Broadway Books,2014-10-28,Hardcover,387.0,4.7
867,"7: The Dark Tower VII (The Dark Tower, Book 7)",Stephen King,Pocket Books,2006-9-1,Hardcover,1072.0,4.5
868,Gwendy's Button Box: A Novella,Stephen King,Gallery Books,2017-10-31,Kindle,176.0,4.3
869,"The Dark Tower V: The Wolves of the Calla (The Dark Tower, Book 5)",Stephen King,Pocket Books,2006-2-1,Hardcover,960.0,4.6
870,Annihilation: A Novel: Movie Tie-In Edition (The Southern Reach Trilogy),Jeff VanderMeer,MCD x FSG Originals,2018-2-13,Paperback,208.0,3.6
871,Never Let Me Go,Kazuo Ishiguro,Vintage,2006-3-14,Hardcover,288.0,3.7
872,Broken Angels: A Novel (Takeshi Kovacs),Richard K. Morgan,Del Rey,2004-3-2,Hardcover,384.0,3.9
873,Twice Bitten: An Argeneau Novel,Lynsay Sands,Avon,2018-3-27,Kindle,384.0,
874,The Final Day: A John Matherson Novel,William R. Forstchen,Forge Books,2017-10-31,Paperback,480.0,4.7
875,The Sorcerer of the North: Book Five (Ranger's Apprentice),John Flanagan,Puffin Books,2009-6-25,Paperback,336.0,4.6
876,One Year After: A John Matherson Novel,William R. Forstchen,Forge Books,2016-6-28,Paperback,448.0,4.4
877,'Salem's Lot,Stephen King,Anchor,2011-12-27,Paperback,672.0,4.5
878,"Shadow of Night (All Souls Trilogy, Bk 2)",Deborah Harkness,Penguin Books,2013-5-28,Paperback,592.0,4.5
879,Fool Moon (Dresden Files),Jim Butcher,Roc,2001-1-1,Paperback,432.0,4.5
880,The Book of Life: A Novel (All Souls Trilogy),Deborah Harkness,Penguin Books,2015-5-26,Hardcover,576.0,4.6
881,Death Masks (Dresden Files),Jim Butcher,Roc,2003-8-5,Paperback,464.0,4.7
882,"Dead Until Dark  (Sookie Stackhouse/True Blood, Book 1)",Charlaine Harris,Ace Books,2001-5-1,Hardcover,292.0,4.4
883,The Eyes of the Dragon: A Novel,Stephen King,Gallery Books,2018-1-9,Hardcover,384.0,4.5
884,Neuromancer,William Gibson,Ace,1984-7-1,Kindle,271.0,4.2
885,The Passage: A Novel (Book One of The Passage Trilogy),Justin Cronin,Ballantine Books,2011-5-17,Kindle,785.0,4.2
886,Summer Knight (Dresden Files),Jim Butcher,Roc,2002-9-3,Hardcover,371.0,4.6
887,"Blood Rites (The Dresden Files, Book 6)",Jim  Butcher,Roc,2004-8-3,Paperback,372.0,4.7
888,Wayward (The Wayward Pines Trilogy),Blake Crouch,Thomas & Mercer,2013-9-17,Paperback,322.0,4.5
889,Lord of the Flies: (Penguin Classics Deluxe Edition),William Golding,Penguin Classics,2016-11-15,Kindle,336.0,4.5
890,Watchers,Dean Koontz,Berkley,2003-1-28,Hardcover,624.0,4.8
891,The Changeling: A Novel,Victor LaValle,Spiegel & Grau,2018-3-6,Hardcover,448.0,3.9
892,The Lost World: A Novel (Jurassic Park),Michael Crichton,Ballantine Books,2012-10-30,Hardcover,432.0,4.5
893,World War Z: An Oral History of the Zombie War,Max Brooks,Three Rivers Press,2007-10-16,Hardcover,342.0,4.3
894,"Night Shift (A Novel of Midnight, Texas)",Charlaine Harris,Ace,2017-2-7,Kindle,400.0,4.7
895,The Dark Tower II: The Drawing of the Three,Stephen King,Pocket Books,2016-12-27,Kindle,528.0,4.3
896,Ghost Story (Dresden Files),Jim Butcher,Roc,2012-8-7,Kindle,608.0,4.4
897,"White Night (The Dresden Files, Book 9)",Jim Butcher,Roc,2008-2-5,Hardcover,528.0,4.7
898,Changes (Dresden Files),Jim Butcher,Roc,2011-3-1,Hardcover,560.0,4.7
899,"Small Favor (The Dresden Files, Book 10)",Jim Butcher,Roc,2009-3-3,Paperback,560.0,4.8
900,"Proven Guilty (The Dresden Files, Book 8)",Jim Butcher,Roc,2007-2-6,Hardcover,576.0,4.7
901,Fatherland: A Novel,Robert Harris,Random House Trade Paperbacks,2006-9-5,Paperback,352.0,4.3
902,The Historian,Elizabeth Kostova,Back Bay Books,2009-9-1,Hardcover,720.0,4.0
903,Crónica de una muerte anunciada (Spanish Edition),Gabriel Garc\u00eda M\u00e1rquez,Vintage Espanol,2003-10-14,Hardcover,128.0,4.4
904,The Dark Tower III: The Waste Lands,Stephen King,Pocket Books,2016-12-27,Kindle,720.0,4.3
905,"Turn Coat (The Dresden Files, Book 11)",Jim Butcher,Roc,2010-3-2,Paperback,576.0,4.8
906,Race for the Flash Stone (The Anlon Cully Chronicles) (Volume 2),K Patrick Donoghue,"Leaping Leopard Enterprises, LLC",2017-5-9,Hardcover,358.0,4.3
907,The Thief of Always,Clive Barker,Harper Perennial,2008-11-11,Hardcover,288.0,4.3
908,Something Wicked This Way Comes: A Novel,Ray Bradbury,Simon & Schuster,2017-10-24,Hardcover,352.0,4.2
909,We Have Always Lived in the Castle (Penguin Classics Deluxe Edition),Shirley Jackson,Penguin Classics,2006-10-31,Paperback,146.0,4.2
910,"Midnight Crossroad (A Novel of Midnight, Texas)",Charlaine Harris,Ace,2015-3-31,Kindle,384.0,4.3
911,The Cartel 4: Diamonds are Forever (Urban Books),Ashley,Urban Books,2014-2-4,Kindle,352.0,4.6
912,Sleeping Giants (The Themis Files),Sylvain Neuvel,Del Rey,2017-1-24,Hardcover,336.0,3.9
913,The City of Mirrors: A Novel (Passage Trilogy),Justin Cronin,Ballantine Books,2017-5-16,Hardcover,624.0,4.5
914,"Crocodile on the Sandbank (Amelia Peabody, Book 1)",Elizabeth Peters,Grand Central Publishing,2013-5-28,Paperback,352.0,4.5
915,I Have No Mouth and I Must Scream: Stories,Harlan Ellison,Open Road Media,2014-6-3,Kindle,162.0,4.1
916,"Dead And Gone (Sookie Stackhouse/True Blood, Book 9)",Charlaine Harris,Ace,2010-4-6,Kindle,320.0,4.3
917,The Turn: The Hollows Begins with Death,Kim Harrison,Pocket Books,2017-10-31,Kindle,560.0,4.5
918,Shadow Hunt (Disrupted Magic),Melissa F. Olson,47North,2018-2-13,Paperback,316.0,4.9
919,"Crossroads of Twilight (Wheel of Time, Book 10)",Robert Jordan,Tor Fantasy,,Kindle,846.0,3.1
920,Murder of Crows (A Novel of the Others),Anne Bishop,Roc,2015-2-3,Hardcover,448.0,4.7
921,A Scanner Darkly,Philip K. Dick,Mariner Books,2011-10-18,Hardcover,304.0,4.3
922,The Fireman: A Novel,Joe Hill,William Morrow Paperbacks,2017-1-3,Hardcover,768.0,4.2
923,El Laberinto de los Espiritus (Spanish Edition),Carlos Ruiz Zafon,Vintage Espanol,2017-10-24,Hardcover,928.0,4.8
924,Horrorstor: A Novel,Grady Hendrix,Quirk Books,2014-9-23,Hardcover,240.0,4.2
925,Sixth Grave on the Edge (Charley Davidson),Darynda Jones,St. Martin's Paperbacks,2014-8-26,Paperback,400.0,4.7
926,The Long Dark Tea-Time of the Soul (Dirk Gently),Douglas Adams,Gallery Books,2014-10-7,Hardcover,256.0,4.3
927,Timeline,Michael Crichton,Ballantine Books,2003-11-4,Hardcover,512.0,4.1
928,Altar of Eden,James Rollins,Harper,2010-12-28,Kindle,528.0,4.3
929,VALIS (Valis Trilogy),Philip K. Dick,Mariner Books,2011-10-18,Paperback,288.0,3.8
930,The First City (The Dominion Trilogy),Joe Hart,Thomas & Mercer,2017-3-28,Paperback,444.0,4.6
931,"Grave Surprise (Harper Connelly Mysteries, Book 2)",Charlaine Harris,Berkley,2007-9-25,Paperback,320.0,4.4
932,You May Now Kill the Bride (Return to Fear Street),R.L. Stine,HarperTeen,2018-7-24,Hardcover,352.0,
933,Empire Games: A Tale of the Merchant Princes Universe,Charles Stross,Tor Books,2017-12-5,Hardcover,336.0,4.3
934,"Mind Game (GhostWalkers, Book 2)",Christine Feehan,Berkley,2004-7-27,Hardcover,384.0,4.7
935,Deep Storm,Lincoln Child,Anchor,2011-7-19,Hardcover,384.0,4.3
936,Lemon Pies and Little White Lies (A Charmed Pie Shoppe Mystery),Ellery Adams,Berkley,2015-4-7,Hardcover,304.0,4.7
937,Woman on the Edge of Time: A Novel,Marge Piercy,Ballantine Books,1997-6-23,Paperback,432.0,3.9
938,"Vampire, Interrupted (Argeneau Vampires, Book 9)",Lynsay Sands,Avon,2008-2-26,Kindle,384.0,4.7
939,Pandora (New Tales of the Vampires),Anne Rice,Ballantine Books,1998-12-26,Paperback,368.0,4.2
940,The Syndicate: Carl Weber Presents (Urban Renaissance),Brick,Urban Books,2016-8-30,Kindle,288.0,4.6
941,The Final Trade (The Dominion Trilogy),Joe Hart,Thomas & Mercer,2016-9-13,Kindle,352.0,4.6
942,Gangsta,K'wan,Urban Books,2014-8-5,Kindle,304.0,4.1
943,"Shadow of a Dark Queen (The Serpentwar Saga, Book 1)",Raymond E Feist,EOS,2010-12-28,Paperback,497.0,4.5
944,The Edge of the Light (The Edge of Nowhere),Elizabeth George,Speak,2017-8-1,Hardcover,416.0,3.1
945,Wired,Douglas E. Richards,Paragon Press,2012-7-23,Paperback,352.0,4.2
946,Fear the Dark (A Bishop/SCU Novel),Kay Hooper,Berkley,2016-8-30,Paperback,320.0,4.5
947,Skitter: A Novel (The Hatching Series),Ezekiel Boone,Atria/Emily Bestler Books,2017-11-7,Kindle,368.0,4.3
948,Dog Food: K'wan Presents,Raynesha Pittman,Urban Books,2016-7-26,Hardcover,304.0,4.5
949,False Memory: A Novel,Dean Koontz,Bantam,2012-6-26,Hardcover,768.0,4.0
950,"Grave Sight (Harper Connelly Mysteries, Book 1)",Charlaine Harris,Berkley,2006-9-26,Hardcover,310.0,4.0
951,Beware of Pity (New York Review Books Classics),Stefan Zweig,NYRB Classics,2006-6-20,Hardcover,392.0,4.4
952,Secret Honor (Honor Bound),W.E.B. Griffin,G.P. Putnam's Sons,2000-12-1,Hardcover,624.0,4.3
953,Sanctuary: A Postapocalyptic Novel (The New World Series),G. Michael Hopf,Plume,2014-5-27,Paperback,352.0,4.5
954,"Atlantis Found (Dirk Pitt, No. 15)",Clive Cussler,G.P. Putnam's Sons,2001-5-1,Paperback,704.0,4.4
955,The Death of Ivan Ilyich and Other Stories (Vintage Classics),Leo Tolstoy,Vintage,2010-10-5,Kindle,528.0,4.3
956,Night of the Living Deed (A Haunted Guesthouse Mystery),E.J. Copperman,Berkley,2010-6-1,Hardcover,336.0,4.3
957,Rumors of Marty Goode,Jeff Ryan Williams,Moon Fortress Press,2017-11-27,Hardcover,80.0,4.6
958,Magic and Macaroons (A Magical Bakery Mystery),Bailey Cates,Berkley,2015-7-7,Kindle,320.0,4.5
959,Ghost in the Wind (A Haunted Guesthouse Mystery),E.J. Copperman,Berkley,2015-12-1,Hardcover,304.0,4.5
960,"Indiana Jones and the Peril at Delphi (Indiana Jones, No. 1)",Rob MacGregor,Bantam,1991-1-1,Kindle,248.0,3.7
961,"Mr. Peabody's House (Werewolves, Vampires and Demons, Oh My)",Eve Langlais,Eve Langlais,2017-11-30,Paperback,296.0,4.4
962,"Dark Side of the Road, The: A country house murder mystery with a supernatural twist",Simon Green,Severn House Trade Paperback,2015-11-1,Paperback,224.0,4.0
963,To Helvetica and Back (A Dangerous Type Mystery),Paige Shelton,Berkley,2016-1-5,Kindle,304.0,4.4
964,The Quincunx,Charles Palliser,Ballantine Books,,Kindle,800.0,4.0
965,The Wall,Marlen Haushofer,Cleis Press,2013-6-11,Kindle,244.0,3.9
966,The Wolf Road: A Novel,Beth Lewis,Broadway Books,2017-4-11,Paperback,368.0,4.1
967,Dragon Rule: Book Five of the Age of Fire,E.E. Knight,Ace,2012-7-3,Paperback,368.0,4.2
968,Quilt Trip: A Southern Quilting Mystery,Elizabeth Craig,Berkley,2013-12-3,Hardcover,304.0,4.3
969,"Cruel Zinc Melodies (Garrett, P.I. #12)",Glen Cook,Ace,2008-5-6,Kindle,416.0,4.5
970,Ditched 4 Murder (Sophie Kimball Mystery),J.C. Eaton,Kensington,2017-11-28,Paperback,352.0,4.4
971,The Sighting,Christopher Coleman,Independently published,2017-12-11,Hardcover,143.0,4.1
972,"Wicked Bronze Ambition: A Garrett, P.I., Novel",Glen Cook,Ace,2013-7-2,Hardcover,496.0,4.2
973,Dead and Buried (Blackmoore Sisters Cozy Mysteries) (Volume 2),Leighann Dobbs,CreateSpace Independent Publishing Platform,2013-6-25,Kindle,266.0,4.4
974,Queen of the Struggle,Nik Korpon,Angry Robot,2018-3-6,Paperback,320.0,
975,Single White Vampire (Argeneau Vampire),Lynsay Sands,Avon,2010-6-29,Hardcover,384.0,4.5
976,Aunt Dimity Beats the Devil (Aunt Dimity Mystery),Nancy Atherton,Penguin Books,2001-10-1,Hardcover,256.0,4.5
977,Blood Crossed (Netherworld Paranormal Police Department) (Volume 1),John P. Logsdon,CreateSpace Independent Publishing Platform,2018-1-27,Paperback,158.0,4.6
978,The Phoenix Descent,Chuck Grossart,47North,2016-3-15,Paperback,368.0,4.3
979,Mockingbird (Miriam Black),Chuck Wendig,Saga Press,2015-10-20,Hardcover,368.0,4.5
980,The Names,Don DeLillo,Vintage,1989-7-17,Paperback,352.0,3.4
981,The Confessions of Max Tivoli: A Novel,Andrew Sean Greer,Picador,2005-2-1,Paperback,288.0,4.1
982,Vampire Most Wanted: An Argeneau Novel (Argeneau Vampire),Lynsay Sands,Avon,2014-2-18,Paperback,384.0,4.4
983,In a Witch's Wardrobe: A Witchcraft Mystery,Juliet Blackwell,Berkley,2012-7-3,Paperback,336.0,4.6
984,Assassin's Creed: Revelations,Oliver Bowden,Ace,2011-11-29,Kindle,512.0,4.4
985,Forgotten Sins (Sin Brothers),Rebecca Zanetti,Forever,2014-1-28,Paperback,400.0,4.5
986,A Cure for Suicide: A Novel (Vintage Contemporaries),Jesse Ball,Vintage,2016-6-14,Paperback,272.0,3.2
987,The Accidental Alchemist (An Accidental Alchemist Mystery),Gigi Pandian,Midnight Ink,2015-1-8,Kindle,360.0,4.3
988,Innocent Monster (A Moe Prager Mysteries),Reed Farrel Coleman,Gallery Books,2012-1-15,Hardcover,288.0,4.1
989,One of Our Thursdays Is Missing: A Thursday Next Novel,Jasper Fforde,Penguin Books,2012-1-31,Kindle,384.0,4.1
990,The Murders in the Rue Morgue (Modern Library Classics),Edgar Allan Poe,Modern Library,2006-5-23,Hardcover,160.0,3.9
991,Gorgon,Greig Beck,Momentum,2014-7-1,Paperback,414.0,4.5
992,The NightShade Forensic Files: Under Dark Skies (Book 1) (Volume 1),A.J. Scudiere,Griffyn Ink,2015-4-1,Hardcover,378.0,4.5
993,"A Clash of Kings (A Song of Ice and Fire, Book 2)",George R. R. Martin,Bantam,2000-9-5,Kindle,1040.0,4.6
994,The Stone Sky (The Broken Earth),N. K. Jemisin,Orbit,2017-8-15,Paperback,464.0,4.6
995,A Feast for Crows: A Song of Ice and Fire (Game of Thrones),George R. R. Martin,Bantam,2006-9-26,Paperback,1104.0,4.2
996,FINAL FANTASY(R) XI Atlas,Ed Kern,Brady Games,2005-4-22,Paperback,160.0,3.3
997,"Landscapes Art: Gray Scale Photo Adult Coloring Book, Mind Relaxation Stress Relief Coloring Book Vol2: Series of coloring book for adults and grown ... x 27.94 cm) (Adults Coloring Book) (Volume 2)",Banana Leaves,CreateSpace Independent Publishing Platform,2016-12-6,Paperback,62.0,5.0
998,Fantasy Online Polynya: A LitRPG Saga (Volume 2),Harmon Cooper,CreateSpace Independent Publishing Platform,2017-10-18,Kindle,422.0,4.8
999,Saga of the Giants,J. D. Neal,CreateSpace Independent Publishing Platform,2016-2-3,Hardcover,170.0,5.0
1000,"Blood of Requiem: Song of Dragons, Book 1",Daniel Arenson,Moonclipse,2011-5-17,Kindle,318.0,3.9
1001,The Crimson Crown (A Seven Realms Novel),Cinda Williams Chima,Disney-Hyperion,2013-10-1,Hardcover,624.0,4.8
1002,Angels in America: A Gay Fantasia on National Themes: Revised and Complete Edition,Tony Kushner,Theatre Communications Group,2013-12-24,Paperback,304.0,4.3
1003,Isis Orb (The Xanth Novels),Piers Anthony,Open Road Media Sci-Fi & Fantasy,2016-10-18,Kindle,298.0,4.2
1004,The Fantasy Art Techniques Of Tim Hildebrandt,Jack Norton,Sterling,2000-6-30,Kindle,160.0,4.6
1005,The Nine Fantasies That Will Ruin Your Life (and the Eight Realities That Will Save You),Joy Browne,Harmony,1999-9-21,Hardcover,272.0,3.9
1006,Remembering (The Starlight Chronicles) (Volume 4),C. S. Johnson,CreateSpace Independent Publishing Platform,2016-4-1,Paperback,284.0,4.4
1007,The Warlock of Firetop Mountain (Fighting Fantasy),Steve Jackson,Wizard Books,2002-6-3,Kindle,192.0,4.6
1008,Dragonfly in Amber: A Novel (Outlander),Diana Gabaldon,Dell,1993-11-2,Hardcover,976.0,4.6
1009,The Drums of Autumn,Diana Gabaldon,Dell,1997-0-0,Paperback,1070.0,4.7
1010,The Urban Fantasy Anthology,Joe R Lansdale,Tachyon Publications,2011-8-15,Kindle,431.0,2.8
1011,Her Wicked Fantasy,Taylor Johns,CreateSpace Independent Publishing Platform,2016-11-12,Paperback,370.0,4.9
1012,"A Storm of Swords (A Song of Ice and Fire, Book 3)",George R. R. Martin,Bantam,2003-3-4,Paperback,1216.0,4.7
1013,Bridge to Terabithia,Katherine Paterson,HarperCollins,2017-5-2,Kindle,144.0,4.6
1014,Knights: The Eye of Divinity (Knights Series) (Volume 1),Robert E. Keller,CreateSpace Independent Publishing Platform,2013-11-15,Paperback,284.0,3.9
1015,Skip: Book 1 (Volume 1),Perrin Briar,CreateSpace Independent Publishing Platform,2017-1-17,Kindle,262.0,4.1
1016,North! Or Be Eaten (The Wingfeather Saga),Andrew Peterson,WaterBrook,2009-8-18,Paperback,352.0,4.9
1017,The Legend of Korra Turf Wars Part Two,Michael Dante DiMartino,Dark Horse Books,2018-1-30,Kindle,80.0,4.8
1018,Crown of Destruction (Warhammer),Kieron Gillen,Games Workshop,2016-9-27,Kindle,96.0,1.9
1019,The Handmaid's Tale,Margaret Atwood,Anchor,1998-3-16,Kindle,311.0,4.1
1020,Lord of the Flies,William Golding,Penguin Books,2003-12-16,Hardcover,224.0,4.2
1021,"Magic Tree House Boxed Set, Books 1-4: Dinosaurs Before Dark, The Knight at Dawn, Mummies in the Morning, and Pirates Past Noon",Mary Pope Osborne,Random House Books for Young Readers,2001-5-29,Paperback,80.0,4.8
1022,Percy Jackson and the Olympians 5 Book Paperback Boxed Set (new covers w/poster) (Percy Jackson & the Olympians),Rick Riordan,Disney-Hyperion,2014-6-3,Hardcover,1840.0,4.8
1023,Adult Coloring Book: Nice Little : Fantasy Coloring Adventure,Art Lixus,CreateSpace Independent Publishing Platform,2018-2-21,Hardcover,102.0,
1024,Gnome Home Hex-Map Sketchbook: Game Mapping Sketch Pad Notebook (Fantasy 150 Hex-Map) (Volume 22),N.D. Author Services,CreateSpace Independent Publishing Platform,2017-6-23,Paperback,160.0,
1025,"Good Omens: The Nice and Accurate Prophecies of Agnes Nutter, Witch",Neil Gaiman,William Morrow,2006-11-28,Kindle,432.0,4.5
1026,The Fiery Cross (Outlander),Diana Gabaldon,Dell,2005-8-30,Kindle,1443.0,4.6
1027,Voyager: A Novel (Outlander),Diana Gabaldon,Dell,1994-10-1,Paperback,1104.0,4.7
1028,Cien años de soledad (Spanish Edition),Gabriel Garc\u00eda M\u00e1rquez,Vintage Espanol,2009-9-22,Kindle,496.0,4.7
1029,"How to Write a Novel: Step-by-Step | Essential Romance Novel, Mystery Novel and Fantasy Novel Writing Tricks Any Writer Can Learn (Writing Best Seller) (Volume 1)",Sandy Marsh,CreateSpace Independent Publishing Platform,2017-11-30,Hardcover,68.0,4.6
1030,The Siege of Abythos (The Chronicles of the Black Gate) (Volume 3),Phil Tucker,CreateSpace Independent Publishing Platform,2017-3-20,Paperback,722.0,4.6
1031,Borne: A Novel,Jeff VanderMeer,MCD,2018-2-27,Kindle,368.0,4.1
1032,A Dance with Dragons (A Song of Ice and Fire),George R. R. Martin,Bantam,2013-10-29,Hardcover,1152.0,4.3
1033,"Adult Coloring Books: Fantasy World for Men: 40 coloring pages of fantasy, dragons, skulls, monsters, warriors and more",B A Mowery,CreateSpace Independent Publishing Platform,2017-11-22,Kindle,90.0,
1034,The Green Ember (The Green Ember Series: Book 1),S. D. Smith,Story Warren Books,2014-12-12,Kindle,368.0,4.8
1035,Brave New World,Aldous Huxley,Harper Perennial,2006-10-18,Paperback,288.0,4.2
1036,Dreamlings: A magical coloring book,Edwina mc namee,CreateSpace Independent Publishing Platform,2018-2-11,Paperback,112.0,4.6
1037,Sword of Destiny (The Witcher),Andrzej Sapkowski,Orbit,2015-12-1,Kindle,400.0,4.8
1038,Raptor: Urban Fantasy Noir (Volume 1),B.A. Bostick,Enchanted Indie Press,2017-4-23,Paperback,522.0,4.5
1039,Heir of Fire (Throne of Glass),Sarah J. Maas,Bloomsbury USA Childrens,2015-9-1,Hardcover,592.0,4.8
1040,"The Last Olympian (Percy Jackson and the Olympians, Book 5)",Rick Riordan,Disney-Hyperion,2011-1-25,Hardcover,432.0,4.8
1041,Throne of Glass,Sarah J. Maas,Bloomsbury USA Childrens,2013-5-7,Kindle,432.0,4.5
1042,The Oxford Book of Fantasy Stories,Tom Shippey,Oxford University Press,1995-6-1,Hardcover,528.0,4.7
1043,The Left Hand of Darkness,Ursula K. Le Guin,Ace Books,1987-3-15,Kindle,304.0,4.2
1044,Crown of Midnight (Throne of Glass),Sarah J. Maas,Bloomsbury USA Childrens,2014-9-2,Paperback,448.0,4.8
1045,Parable of the Sower (Earthseed),Octavia E. Butler,Grand Central Publishing,2000-1-1,Hardcover,352.0,4.5
1046,Queen of Shadows (Throne of Glass),Sarah J. Maas,Bloomsbury USA Childrens,2016-9-6,Kindle,672.0,4.8
1047,The Obelisk Gate (The Broken Earth),N. K. Jemisin,Orbit,2016-8-16,Paperback,448.0,4.6
1048,"The Heroes of Olympus, Book Five The Blood of Olympus",Rick Riordan,Disney-Hyperion,2016-4-5,Paperback,544.0,4.7
1049,Watership Down: A Novel,Richard Adams,Scribner,2005-11-1,Paperback,476.0,4.7
1050,Kafka on the Shore,Haruki Murakami,Vintage,2006-1-3,Hardcover,480.0,4.3
1051,"Fantasies of a Young Submissive: Dark, beautiful and intensely erotic!",Rosaleen Young,Chimera,2014-8-12,Kindle,110.0,
1052,An Oathbreaker's Vow: The Tahaerin Chronicles Book One (Volume 1),J. Ellen Ross,CreateSpace Independent Publishing Platform,2014-12-1,Paperback,370.0,4.5
1053,Drawing & Painting Fantasy Worlds,Finlay Cowan,IMPACT,2006-5-25,Kindle,128.0,3.6
1054,"Adult Fantasy: searching for true maturity in an age of mortgages, marriages, and other adult milestones",Briohny Doyle,Scribe Publications,2017-7-13,Hardcover,320.0,
