ID,Name,Author,Publisher,Publishing_Date,Format,Pages,Rating
2318,"Night of the Hunter: Companions Codex, I (Forgotten Realms: Companions Codex)",R. A. Salvatore,Wizards of the Coast,2014-9-2,Hardcover,352.0,4.7
2319,The Immortals (Olympus Bound),Jordanna Max Brodsky,Orbit,2016-12-13,Hardcover,496.0,4.2
2320,Excession,Iain M. Banks,Spectra,1998-2-2,Hardcover,499.0,4.3
2321,The High Druid's Blade: The Defenders of Shannara,Terry Brooks,Del Rey,2015-4-28,Paperback,384.0,4.4
2322,Supernatural: Bobby Singer's Guide to Hunting,David Reed,It Books,2011-10-5,Kindle,272.0,4.7
2323,The Dwarves,Markus Heitz,Orbit,2009-7-3,Paperback,752.0,4.0
2324,The Crippled God: Book Ten of The Malazan Book of the Fallen,Steven Erikson,Tor Fantasy,2012-4-24,Paperback,1200.0,4.5
2325,"The Thousand Orcs (Forgotten Realms: The Hunter's Blades Trilogy, Book 1)",R.A. Salvatore,Wizards of the Coast,2003-7-1,Hardcover,384.0,4.5
2326,The Truth: A Novel of Discworld,Terry Pratchett,Harper,2014-7-29,Kindle,448.0,4.7
2327,"Angel Fire East (The Word and the Void Trilogy, Book 3)",Terry Brooks,Del Rey,,Hardcover,384.0,4.4
2328,Chronicles of the Black Company,Glen Cook,Tor Books,2007-11-13,Kindle,704.0,4.4
2329,"Running With the Demon (The Word and the Void Trilogy, Book 1)",Terry Brooks,Del Rey,1998-5-27,Paperback,448.0,4.4
2330,"Blood Bound (Mercy Thompson, Book 2)",Patricia Briggs,Ace,2007-1-30,Kindle,304.0,4.7
2331,The Pillars of Creation (Sword of Truth),Terry Goodkind,Tor Books,2002-11-18,Paperback,736.0,3.7
2332,"Sea of Swords: The Legend of Drizzt, Book XIII",R.A. Salvatore,Wizards of the Coast,2009-6-2,Kindle,416.0,4.6
2333,God Country,Donny Cates,Image Comics,2017-8-8,Hardcover,168.0,4.5
2334,Valor (Faithful and the Fallen),John Gwynne,Orbit,2014-7-22,Hardcover,688.0,4.5
2335,Empty Horizon: Benjamin Ashwood Book 4,AC Cobble,Cobble Publishing LLC,2017-12-7,Paperback,414.0,4.8
2336,Scorched Shadows (The Hellequin Chronicles),Steve McHugh,47North,2017-12-19,Kindle,508.0,4.5
2337,Eric: A Novel of Discworld,Terry Pratchett,Harper,2013-7-30,Paperback,160.0,4.2
2338,Lord of Souls: An Elder Scrolls Novel (The Elder Scrolls),Greg Keyes,Del Rey,2011-9-27,Paperback,336.0,4.4
2339,"The Lone Drow (The Hunter's Blades Trilogy, Book 2)",R.A. Salvatore,Wizards of the Coast,2004-6-1,Hardcover,370.0,4.5
2340,Hogfather: A Novel of Discworld,Terry Pratchett,Harper,2014-1-28,Kindle,416.0,4.7
2341,"The Orc King: Transitions, Book I",R.A. Salvatore,Wizards of the Coast,2008-7-1,Kindle,416.0,4.4
2342,The Measure of the Magic: Legends of Shannara (Pre-Shannara: Legends of Shannara),Terry Brooks,Del Rey,2012-7-31,Hardcover,480.0,4.4
2343,"The Ghost King: Transitions, Book III",R.A. Salvatore,Wizards of the Coast,2010-7-6,Paperback,400.0,4.3
2344,Servant of the Empire (Riftwar Cycle: The Empire Trilogy),Raymond E. Feist,Spectra,1991-12-1,Paperback,704.0,4.6
2345,"Lord Foul's Bane (The Chronicles of Thomas Covenant the Unbeliever, Book 1)",Stephen R. Donaldson,Del Rey,1987-6-12,Hardcover,496.0,4.1
2346,The Red Threads of Fortune (The Tensorate Series),JY Yang,Tor.com,2017-9-26,Paperback,224.0,4.5
2347,The Savage Tales of Solomon Kane,Robert E. Howard,Del Rey,2004-6-29,Kindle,432.0,4.4
2348,The Dreamblood Duology,N. K. Jemisin,Orbit,2016-12-20,Paperback,960.0,4.5
2349,Son of a Witch: Volume Two in The Wicked Years,Gregory Maguire,Harper,2008-9-30,Kindle,464.0,4.0
2350,"Queen of Sorcery (The Belgariad, Book 2)",David Eddings,Del Rey,1986-2-12,Hardcover,336.0,4.7
2351,"Armageddon's Children (The Genesis of Shannara, Book 1)",Terry Brooks,Del Rey,2007-7-31,Hardcover,416.0,4.4
2352,Lady Henterman's Wardrobe (Streets of Maradaine),Marshall Ryan Maresca,DAW,2018-3-6,Kindle,368.0,4.1
2353,Shadow's Bane (Dorina Basarab),Karen Chance,Berkley,2018-8-7,Kindle,544.0,
2354,The Banished of Muirwood (Covenant of Muirwood),Jeff Wheeler,47North,2015-8-18,Hardcover,416.0,4.3
2355,Poisonwell (Whispers from Mirrowen),Jeff Wheeler,47North,2015-4-21,Kindle,505.0,4.7
2356,Copper Chain (The Shifting Tides),James Maxwell,47North,2017-8-3,Hardcover,380.0,4.6
2357,Bloodfire Quest: The Dark Legacy of Shannara,Terry Brooks,Del Rey,2013-6-25,Hardcover,432.0,4.4
2358,Witch Wraith: The Dark Legacy of Shannara,Terry Brooks,Del Rey,2013-12-31,Kindle,512.0,4.4
2359,The Spider's War (The Dagger and the Coin),Daniel Abraham,Orbit,2016-3-8,Hardcover,528.0,4.3
2360,Bearers of the Black Staff: Legends of Shannara (Pre-Shannara: Legends of Shannara),Terry Brooks,Del Rey,2011-7-26,Kindle,448.0,4.4
2361,A Natural History of Dragons: A Memoir by Lady Trent (The Lady Trent Memoirs),Marie Brennan,Tor Books,2014-2-4,Hardcover,352.0,4.3
2362,"King of the Murgos (The Malloreon, Book 2)",David Eddings,Del Rey,1989-2-13,Hardcover,416.0,4.5
2363,Moreta: Dragonlady of Pern,Anne McCaffrey,Del Rey,1984-9-12,Kindle,384.0,4.5
2364,Sky Dragons: Dragonriders of Pern,Anne McCaffrey,Del Rey,2013-5-28,Paperback,400.0,4.4
2365,"Phantom: Chainfire Trilogy, Part 2 (Sword of Truth, Book 10)",Terry Goodkind,Tor Fantasy,2007-5-29,Hardcover,673.0,4.1
2366,Polgara the Sorceress (Malloreon),David Eddings,Del Rey,1998-12-26,Hardcover,768.0,4.5
2367,Fevre Dream: A Novel,George R. R. Martin,Bantam,2012-4-24,Hardcover,480.0,4.2
2368,"The Gypsy Morph (Genesis of Shannara, Book 3)",Terry Brooks,Del Rey,2009-7-28,Paperback,480.0,4.5
2369,Age of Assassins (The Wounded Kingdom),RJ Barker,Orbit,2017-8-1,Paperback,432.0,4.6
2370,Nightblade's Vengeance (Blades of the Fallen),Ryan Kirk,47North,2017-10-24,Kindle,336.0,4.3
2371,Dancer's Lament: Path to Ascendancy Book 1,Ian C. Esslemont,Tor Books,2016-5-31,Kindle,416.0,4.6
2372,The Book of Jhereg,Steven Brust,Ace,1999-8-1,Kindle,480.0,4.4
2373,Heroes Die,Matthew Woodring Stover,Del Rey,1999-5-29,Kindle,560.0,4.5
2374,"The Talismans of Shannara (The Heritage of Shannara, Book 4)",Terry Brooks,Del Rey Books,1994-1-31,Hardcover,440.0,4.5
2375,Magic Kingdom for Sale--Sold! (Landover),Terry Brooks,Del Rey,1987-3-12,Paperback,384.0,4.5
2376,Gatefather: A Novel of the Mithermages,Orson Scott Card,Tor Fantasy,2016-8-30,Paperback,432.0,3.3
2377,"The Histories of Middle Earth, Volumes 1-5",J.R.R. Tolkien,Del Rey,2003-8-26,Kindle,,4.4
2378,Soul Music: A Novel of Discworld,Terry Pratchett,Harper,2013-10-29,Paperback,432.0,4.4
2379,Bloody Rose (The Band),Nicholas Eames,Orbit,2018-8-28,Hardcover,544.0,
2380,The Druid of Shannara (The Heritage of Shannara),Terry Brooks,Del Rey,1992-1-22,Hardcover,384.0,4.6
2381,"Castle of Wizardry (The Belgariad, Book 4)",David Eddings,Del Rey,1985-12-12,Kindle,384.0,4.6
2382,Green Rider,Kristen Britain,DAW,2000-4-1,Hardcover,480.0,4.4
2383,Carrion Comfort: A Novel,Dan Simmons,St. Martin's Griffin,2009-11-24,Kindle,800.0,3.9
2384,The Last Dark (Last Chronicles of Thomas Covenant),Stephen R. Donaldson,Ace,2014-9-2,Paperback,592.0,4.3
2385,Wards of Faerie: The Dark Legacy of Shannara,Terry Brooks,Del Rey,2013-2-26,Kindle,464.0,4.5
2386,"Sorceress of Darshiva (The Malloreon, Book 4)",David Eddings,Del Rey,1990-10-13,Hardcover,371.0,4.6
2387,"The Seeress of Kell (The Malloreon, Book 5)",David Eddings,Del Rey,1992-3-22,Kindle,384.0,4.5
2388,Burned (An Alex Verus Novel),Benedict Jacka,Ace,2016-4-5,Paperback,336.0,4.3
2389,"Split Infinity (The Apprentice Adept, Book 1)",Piers Anthony,Del Rey,1987-10-12,Kindle,368.0,4.5
2390,Antrax (The Voyage of the Jerle Shannara),Terry Brooks,Del Rey,2002-8-27,Paperback,416.0,4.4
2391,The King's Blood (The Dagger and the Coin),Daniel Abraham,Orbit,2012-5-22,Kindle,528.0,4.3
2392,Crystal Singer: A Novel (Crystal Singer Trilogy),Anne Mccaffrey,Del Rey,1982-8-12,Kindle,311.0,4.7
2393,Lords and Ladies (Discworld),Terry Pratchett,Harper,2013-10-29,Kindle,384.0,4.6
2394,"The Last Threshold: Neverwinter Saga, Book IV (Forgotten Realms: Neverwinter Saga)",R. A. Salvatore,Wizards of the Coast,2013-9-3,Kindle,434.0,4.1
2395,Blood of Assassins (The Wounded Kingdom),RJ Barker,Orbit,2018-2-13,Paperback,480.0,4.4
2396,"The Illuminatus! Trilogy: The Eye in the Pyramid, The Golden Apple, Leviathan",Robert Shea,Dell,,Hardcover,805.0,4.2
2397,The Traitor Baru Cormorant (The Masquerade),Seth Dickinson,Tor Books,2016-11-29,Paperback,400.0,4.6
2398,"The Scions of Shannara (Heritage of Shannara, Book One) (The Heritage of Shannara)",Terry Brooks,Del Rey,1991-2-13,Hardcover,432.0,4.4
2399,"Magician's Gambit (The Belgariad, Book 3)",David Eddings,Del Rey,1986-2-12,Kindle,320.0,4.6
2400,"Legend (Drenai Tales, Book 1)",David Gemmell,Del Rey,1994-10-1,Hardcover,345.0,4.5
2401,The Tropic of Serpents: A Memoir by Lady Trent (The Lady Trent Memoirs),Marie Brennan,Tor Books,2015-2-17,Paperback,352.0,4.3
2402,The War of the Dwarves,Markus Heitz,Orbit,2010-3-23,Hardcover,784.0,4.4
2403,Skyfarer (The Drifting Lands),Joseph Brassey,Angry Robot,2017-9-5,Kindle,352.0,4.8
2404,Dragonseye (Pern),Anne McCaffrey,Del Rey,1997-12-27,Paperback,416.0,4.6
2405,Knight's Shadow (The Greatcoats),Sebastien de Castell,Jo Fletcher Books,2016-5-3,Hardcover,592.0,4.6
2406,River of Teeth,Sarah Gailey,Tor.com,2017-5-23,Kindle,176.0,3.9
2407,Sharp Ends: Stories from the World of the First Law,Joe Abercrombie,Orbit,2017-3-14,Hardcover,336.0,4.5
2408,"The Two Swords (The Hunter's Blades Trilogy, Book 3)",R.A. Salvatore,Wizards of the Coast,2005-9-1,Paperback,376.0,4.3
2409,Thief of Time: A Novel of Discworld,Terry Pratchett,Harper,2014-7-29,Paperback,432.0,4.7
2410,"The Elf Queen of Shannara (Heritage of Shannara, Book 3)",Terry Brooks,Del Rey,1993-1-23,Kindle,368.0,4.6
2411,The Legend of Sigmar (Warhammer Chronicles),Graham McNeill,Games Workshop,2017-9-5,Hardcover,944.0,4.4
2412,The Lost Gate (Mither Mages),Orson Scott Card,Tor Fantasy,2011-11-29,Hardcover,464.0,4.0
2413,Night Angel: The Complete Trilogy (The Night Angel Trilogy),Brent Weeks,Orbit,2012-4-24,Kindle,1264.0,4.5
2414,Malice (The Faithful and the Fallen),John Gwynne,Orbit,2013-12-3,Paperback,656.0,4.2
2415,Tigana: Anniversary Edition,Guy Gavriel Kay,Ace,1999-12-1,Kindle,676.0,4.3
2416,The High King's Tomb (Green Rider),Kristen Britain,DAW,2009-8-4,Paperback,656.0,4.5
2417,The Given Sacrifice (A Novel of the Change),S. M. Stirling,Ace,2014-9-2,Paperback,496.0,4.1
2418,Three Parts Dead (Craft Sequence),Max Gladstone,Tor Books,2013-7-23,Hardcover,336.0,4.4
2419,The Widow's House (The Dagger and the Coin),Daniel Abraham,Orbit,2014-8-5,Hardcover,544.0,4.4
2420,Orb Sceptre Throne: A Novel of the Malazan Empire (Novels of the Malazan Empire),Ian C. Esslemont,Tor Books,2012-5-22,Kindle,608.0,4.3
2421,Saint's Blood (The Greatcoats),Sebastien de Castell,Jo Fletcher Books,2017-3-7,Paperback,400.0,4.6
2422,A Dance of Blades (Shadowdance 2),David Dalglish,Orbit,2013-11-5,Hardcover,416.0,4.4
2423,"Grass for His Pillow (Tales of the Otori, Book 2)",Lian Hearn,Riverhead Books,2004-6-1,Kindle,368.0,4.5
2424,The Palace Job (Rogues of the Republic),Patrick Weekes,47North,2013-10-8,Hardcover,438.0,4.1
2425,The Hidden Relic (The Evermen Saga),James Maxwell,47North,2014-7-29,Paperback,496.0,4.4
2426,Haroun and the Sea of Stories,Salman Rushdie,Granta Books/Penguin,1991-0-0,Paperback,216.0,4.3
2427,Vampire Wars (Warhammer Chronicles),Steven Savile,Games Workshop,2018-1-9,Paperback,800.0,4.0
2428,The Summer Tree (Fionavar Tapestry),Guy Gavriel Kay,Ace,2001-4-1,Kindle,383.0,3.9
2429,The Long Earth,Terry Pratchett,Harper,2013-6-25,Hardcover,432.0,3.7
2430,The Dragon's Path (The Dagger and the Coin),Daniel Abraham,Orbit,2011-4-7,Paperback,592.0,3.8
2431,"Seventh Son (Tales of Alvin Maker, Book 1)",Orson Scott Card,Tor Fantasy,1993-6-15,Paperback,256.0,4.3
2432,"The Malloreon, Vol. 1 (Books 1-3): Guardians of the West, King of the Murgos, Demon Lord of Karanda",David Eddings,Del Rey,2005-8-30,Kindle,816.0,4.5
2433,Winter of the Gods (Olympus Bound),Jordanna Max Brodsky,Orbit,2017-7-11,Hardcover,512.0,4.2
2434,The Gate to Women's Country: A Novel,Sheri S. Tepper,Spectra,1993-2-1,Hardcover,336.0,4.3
2435,Peter Pan,J M Barrie,Kingman Books,2016-1-20,Kindle,134.0,4.3
2436,"Castle Roogna (The Magic of Xanth, No. 3)",Piers Anthony,Ballantine Books / Del Rey,1979-0-0,Paperback,329.0,4.6
2437,"Elven Star (The Death Gate Cycle, Volume 2)",Margaret Weis,Spectra,1991-7-1,Kindle,416.0,4.3
2438,The Many Deaths of the Black Company (Chronicles of The Black Company),Glen Cook,Tor Books,2010-1-5,Kindle,784.0,4.6
2439,The Court of Broken Knives (Empires of Dust),Anna Smith Spark,Orbit,2017-8-15,Paperback,512.0,4.2
2440,The Wall of Storms (The Dandelion Dynasty),Ken Liu,Saga Press,2017-7-18,Paperback,880.0,4.2
2441,Robert E. Howard's Conan the Cimmerian Barbarian: The Complete Weird Tales Omnibus,Robert E Howard,Pulp-Lit Productions,2017-6-1,Kindle,684.0,5.0
2442,"The Legend of Drizzt 25th Anniversary Edition, Book II",R. A. Salvatore,Wizards of the Coast,2013-10-1,Kindle,1024.0,3.9
2443,"Black Sun Rising (The Coldfire Trilogy, Book 1)",C.S. Friedman,DAW,1992-9-1,Kindle,586.0,4.0
2444,And the Rest Is History: The Chronicles of St. Mary's Book Eight,Jodi Taylor,Night Shade Books,2017-7-18,Kindle,376.0,4.5
2445,Recluce Tales: Stories from the World of Recluce (Saga of Recluce),L. E. Modesitt Jr.,Tor Books,2018-2-20,Kindle,480.0,4.4
2446,A Dance of Shadows (Shadowdance 4),David Dalglish,Orbit,2014-5-20,Kindle,480.0,4.5
2447,The War-Torn Kingdom (Fabled Lands) (Volume 1),Jamie Thomson,Fabled Lands LLP,2017-3-15,Kindle,236.0,4.8
2448,Centaur Aisle (Xanth),Piers Anthony,Del Rey,1987-9-12,Kindle,304.0,4.5
2449,Knife of Dreams: Book Eleven of 'The Wheel of Time',Robert Jordan,Tor Books,2014-10-14,Kindle,752.0,4.3
2450,Supernatural: John Winchester's Journal,Alex Irvine,It Books,2011-4-26,Hardcover,224.0,4.5
2451,"Prince of the Blood, 15th Anniversary Edition",Raymond Feist,Spectra,2005-6-28,Kindle,448.0,4.5
2452,Mirror Sight (Green Rider),Kristen Britain,DAW,2016-4-5,Paperback,768.0,3.8
2453,The Eye of the World: Book One of 'The Wheel of Time',Robert Jordan,Tor Books,2012-5-8,Kindle,752.0,4.5
2454,The Midnight Front: A Dark Arts Novel,David Mack,Tor Books,2018-1-30,Kindle,480.0,4.5
2455,The Lost Stars: Imperfect Sword,Jack Campbell,Ace,2015-9-29,Hardcover,368.0,4.5
2456,The Fifth Ward: First Watch,Dale Lucas,Orbit,2017-7-11,Kindle,416.0,4.3
2457,"Troy: Lord of the Silver Bow (Troy Trilogy, Book 1)",David Gemmell,Ballantine Books,2006-10-31,Hardcover,496.0,4.5
2458,One Velvet Glove: A Tale of the King's Blades (Tales of the King's Blades),Dave Duncan,Five Rivers Chapmanry,2018-2-1,Paperback,308.0,4.2
2459,Battlemage (Age of Darkness),Stephen Aryan,Orbit,2015-9-22,Kindle,512.0,4.3
2460,"Enchanters' End Game (The Belgariad, Book 5)",David Eddings,Del Rey,1986-8-12,Hardcover,384.0,4.6
2461,Labyrinth,Kate Mosse,Berkley,2007-2-6,Kindle,528.0,3.8
2462,The Chronicles of Narnia,C. S. Lewis,HarperCollins,2001-10-1,Hardcover,768.0,4.7
2463,Blood of Elves,Andrzej Sapkowski,Orbit,2009-5-1,Kindle,416.0,4.4
2464,The Towers of the Sunset: 25th Anniversary Edition (Saga of Recluce),L. E. Modesitt Jr.,Tor Fantasy,2017-8-1,Paperback,544.0,4.2
2465,The City Stained Red (Bring Down Heaven),Sam Sykes,Orbit,2015-1-27,Paperback,640.0,4.2
2466,Markswoman (Book 1 of Asiana),Rati Mehrotra,Harper Voyager,2018-1-23,Paperback,384.0,4.4
2467,"Wizard at Large (Magic Kingdom of Landover, Book 3)",Terry Brooks,Del Rey,1989-7-17,Paperback,320.0,4.5
2468,The Darkest Road (Fionavar Tapestry),Guy Gavriel Kay,Ace,2001-6-1,Kindle,448.0,4.4
2469,Fireborn (Seraphim),David Dalglish,Orbit,2016-11-22,Paperback,496.0,4.6
2470,"To Light a Candle: The Obsidian Trilogy, Book Two (The Obsidian Mountain Trilogy)",Mercedes Lackey,Tor Books,2005-12-27,Kindle,864.0,4.6
2471,"Luck in the Shadows (Nightrunner, Vol. 1)",Lynn Flewelling,Spectra,1996-8-1,Paperback,496.0,4.4
2472,"Straken (High Druid of Shannara, Book 3)",Terry Brooks,Del Rey,2007-8-28,Paperback,432.0,4.3
2473,The Legion Of Shadow: DestinyQuest Book 1,Michael J. Ward,Gollancz,2013-6-4,Kindle,544.0,4.2
2474,The Silent Corner: A Novel of Suspense (Thorndike Press Large Print Core),Dean Koontz,Large Print Press,2017-11-8,Hardcover,688.0,4.0
2475,Closer to Home (Valdemar: The Herald Spy),Mercedes Lackey,DAW,2015-10-6,Hardcover,368.0,4.4
2476,Dragons of Summer Flame,Margaret Weis,Wizards of the Coast,,Kindle,608.0,4.1
2477,Final Fantasy VI - Guía Argumental (Spanish Edition),Chris Herraiz,CreateSpace Independent Publishing Platform,2016-10-7,Kindle,128.0,
2478,A Dance of Cloaks (Shadowdance 1),David Dalglish,Orbit,2013-10-8,Kindle,480.0,4.0
2479,WarCraft: War of The Ancients Book one: The Well of Eternity (Blizzard Legends),Richard A. Knaak,Blizzard Entertainment,2017-10-15,Hardcover,370.0,5.0
2480,The Elenium: The Diamond Throne   The Ruby Knight   The Sapphire Rose,David Eddings,Del Rey,2007-9-25,Kindle,912.0,4.7
2481,"First Lord's Fury (Codex Alera, Book 6)",Jim Butcher,Ace,2010-11-30,Kindle,784.0,4.7
2482,"The Malloreon, Vol. 2 (Books 4 & 5): Sorceress of Darshiva, The Seeress of Kell",David Eddings,Del Rey,2005-8-30,Hardcover,528.0,4.7
2483,Dawn Study (Study Series),Maria V. Snyder,MIRA,2017-1-31,Hardcover,480.0,4.5
2484,Being a Green Mother (Book Five of Incarnations of Immortality),Piers Anthony,Del Rey,1988-9-12,Kindle,320.0,4.4
2485,Dragongirl (Pern),Todd J. McCaffrey,Del Rey,2011-6-7,Kindle,480.0,3.8
2486,"The Bloody Crown of Conan (Conan of Cimmeria, Book 2)",Robert E. Howard,Del Rey,2004-11-23,Hardcover,384.0,4.7
2487,Return of the Crimson Guard: A Novel of the Malazan Empire (Novels of the Malazan Empire),Ian C. Esslemont,Tor Fantasy,2011-5-24,Paperback,880.0,4.0
2488,Writers of the Future Vol 34: #1 Bestselling Sci-Fi & Fantasy Short Stories of the Year,L. Ron Hubbard,Galaxy Press,2018-4-10,Kindle,400.0,
2489,A Princess of Landover,Terry Brooks,Del Rey,2010-7-27,Paperback,400.0,4.2
2490,"The Legend of Drizzt 25th Anniversary Edition, Book I",R. A. Salvatore,Wizards of the Coast,2013-9-3,Kindle,944.0,4.7
2491,The Tyrant's Law (The Dagger and the Coin),Daniel Abraham,Orbit,2013-5-14,Kindle,528.0,4.4
2492,The Dragon Lords: Fool's Gold,Jon Hollins,Orbit,2016-7-19,Paperback,544.0,3.5
2493,A Dance of Chaos (Shadowdance),David Dalglish,Orbit,2015-5-12,Hardcover,480.0,4.7
2494,Angel of Storms (Millennium's Rule),Trudi Canavan,Orbit,2016-8-16,Paperback,608.0,4.4
2495,The Rowan,Anne McCaffrey,Ace,1991-9-1,Kindle,336.0,4.6
2496,Magic Strikes (Kate Daniels),Ilona Andrews,Ace,2009-3-31,Kindle,310.0,4.8
2497,Witch Hunter: The Mathias Thulmann Trilogy (Warhammer Chronicles),C L Werner,Games Workshop,2018-6-12,Hardcover,816.0,3.8
2498,Winter's Heart: Book Nine of The Wheel of Time,Robert Jordan,Tor Books,2014-3-25,Hardcover,560.0,4.0
2499,The King's Buccaneer (Riftwar Cycle: Krondor's Sons),Raymond E. Feist,Spectra,1994-1-1,Hardcover,544.0,4.5
2500,"Winter Warriors (Drenai Tales, Book 8)",David Gemmell,Del Rey,2000-6-6,Kindle,352.0,4.7
2501,The Shining Ones (Book Two of The Tamuli),David Eddings,Del Rey,1994-7-2,Hardcover,480.0,4.3
2502,Skyborn (Seraphim),David Dalglish,Orbit,2015-11-17,Paperback,464.0,4.3
2503,Magician's End: Book Three of the Chaoswar Saga,Raymond E Feist,Harper Voyager,2014-9-30,Hardcover,576.0,4.5
2504,The Wandering Fire (Fionavar Tapestry),Guy Gavriel Kay,Ace,2001-5-1,Kindle,400.0,4.3
2505,The Path of the Storm (The Evermen Saga),James Maxwell,47North,2014-7-29,Kindle,496.0,4.6
2506,The Tethered Mage (Swords and Fire),Melissa Caruso,Orbit,2017-10-24,Paperback,480.0,4.2
2507,"Dissolution (Forgotten Realms: R.A. Salvatore's War of the Spider Queen, Book 1)",Richard Lee Byers,Wizards of the Coast,2003-8-1,Kindle,384.0,4.3
2508,Dryad-Born (Whispers from Mirrowen),Jeff Wheeler,47North,2014-2-4,Paperback,466.0,4.6
2509,The Night Angel Trilogy,Brent Weeks,Orbit,2009-10-1,Kindle,2064.0,4.5
2510,The Traders' War: A Merchant Princes Omnibus,Charles Stross,Tor Books,2014-11-11,Kindle,624.0,3.7
2511,The Bloodline Feud: A Merchant Princes Omnibus,Charles Stross,Tor Books,2014-9-9,Hardcover,576.0,4.0
2512,"The Sentinel: The Sundering, Book V",Troy Denning,Wizards of the Coast,2014-10-7,Kindle,352.0,4.0
2513,My Name is Memory,Ann Brashares,Riverhead Books,2011-6-7,Hardcover,352.0,4.0
2514,The Dinosaur Lords: A Novel,Victor Milán,Tor Fantasy,2016-5-31,Kindle,608.0,3.1
2515,The Children of Húrin (Pre-Lord of the Rings),J. R. R. Tolkien,Del Rey,2010-5-25,Kindle,313.0,4.2
2516,Magi'i of Cyador (The Saga of Recluce),L. E. Modesitt Jr.,Tor Fantasy,2001-5-15,Paperback,560.0,4.4
2517,Djinn City,Saad Z. Hossain,The Unnamed Press,2017-11-28,Hardcover,238.0,4.2
2518,Night of Knives: A Novel of the Malazan Empire (Novels of the Malazan Empire),Ian C. Esslemont,Tor Fantasy,2010-3-30,Hardcover,336.0,3.9
2519,Blood and Bone: A Novel of the Malazan Empire (Novels of the Malazan Empire),Ian C. Esslemont,Tor Books,2013-5-21,Kindle,592.0,4.0
2520,The Diamond Throne (The Elenium),David Eddings,Del Rey,1990-6-13,Paperback,448.0,3.9
2521,"The Adversary: The Sundering, Book III",Erin M. Evans,Wizards of the Coast,2014-5-6,Hardcover,528.0,3.7
2522,Redoubt: Book Four of the Collegium Chronicles (A Valdemar Novel),Mercedes Lackey,DAW,2013-10-1,Kindle,400.0,4.1
2523,Curse of the Chosen (The Endarian Prophecy),Richard Phillips,47North,2018-2-20,Paperback,252.0,4.6
2524,The Spirit War (Eli Monpress Book 4),Rachel Aaron,Orbit,2012-6-5,Hardcover,544.0,4.6
2525,Wind Warrior (World Aflame),Jon Messenger,Clean Teen Publishing,2013-10-5,Hardcover,216.0,4.1
2526,"WorldEnd: What Do You Do at the End of the World? Are You Busy? Will You Save Us?, Vol. 1",Akira Kareno,Yen On,2018-7-24,Paperback,192.0,
2527,The Fate of the Dwarves,Markus Heitz,Orbit,2012-8-7,Hardcover,800.0,4.3
2528,The White Road (Nightrunner),Lynn Flewelling,Spectra,2010-5-25,Hardcover,400.0,4.3
2529,Darksiders: The Abomination Vault: A Novel,Ari Marmell,Del Rey,2012-7-24,Paperback,368.0,4.6
2530,"Serpent Mage (The Death Gate Cycle, Vol 4)",Margaret Weis,Spectra,1993-3-1,Kindle,464.0,4.3
2531,Casket of Souls (Nightrunner),Lynn Flewelling,Spectra,2012-5-29,Hardcover,496.0,4.3
2532,Death of the Old World (Warhammer: The End Times),Guy Haley,Games Workshop,2016-6-7,Paperback,816.0,4.1
2533,Bound (An Alex Verus Novel),Benedict Jacka,Ace,2017-4-4,Hardcover,352.0,4.7
2534,Dragon Champion (One of the Age of Fire  #1),E.E. Knight,Ace,2010-11-2,Paperback,384.0,4.4
2535,Kings of the North: Paladin's Legacy (Legend of Paksenarrion),Elizabeth Moon,Del Rey,2012-1-31,Paperback,512.0,4.6
2536,Malice of Crows (The Shadow),Lila Bowen,Orbit,2018-3-20,Paperback,384.0,4.6
2537,The Void of Muirwood (Covenant of Muirwood),Jeff Wheeler,47North,2015-10-27,Paperback,410.0,4.6
2538,"The Godborn: The Sundering, Book II",Paul S. Kemp,Wizards of the Coast,2014-3-4,Paperback,400.0,4.2
2539,Stonewielder: A Novel of the Malazan Empire (Novels of the Malazan Empire),Ian C. Esslemont,Tor Books,2011-5-10,Paperback,640.0,4.2
2540,With Blood Upon the Sand (Song of Shattered Sands),Bradley P. Beaulieu,DAW,2018-2-6,Paperback,672.0,4.6
2541,The Wings of Creation,R. David Anderson,Independently published,2017-6-10,Paperback,150.0,4.5
2542,Choque de Reyes (Spanish Edition),George R. R. Martin,Vintage Espanol,2012-5-1,Hardcover,928.0,4.6
2543,"White Gold Wielder (The Second Chronicles of Thomas Covenant, Book 3)",Stephen R. Donaldson,Del Rey,1987-10-12,Hardcover,512.0,4.5
2544,The Order War: A Novel in the Saga of Recluse (Saga of Recluce),L. E. Modesitt Jr.,Tor Fantasy,2017-12-5,Paperback,608.0,4.5
2545,Mage-Guard of Hamor (Saga of Recluce),L. E. Modesitt Jr.,Tor Fantasy,2009-3-3,Paperback,736.0,4.6
2546,Two Serpents Rise (Craft Sequence),Max Gladstone,Tor Books,2014-4-29,Kindle,368.0,4.4
2547,"The Crystal City: The Tales of Alvin Maker, Volume VI",Orson Scott Card,Tor Fantasy,2004-10-1,Paperback,352.0,3.6
2548,"Guardians of the West (The Malloreon, Book 1)",David Eddings,Del Rey,1988-2-12,Paperback,448.0,4.2
2549,The Ciphers of Muirwood (Covenant of Muirwood),Jeff Wheeler,47North,2015-9-15,Paperback,400.0,4.6
2550,A Dance of Ghosts (Shadowdance),David Dalglish,Orbit,2014-11-11,Kindle,512.0,4.8
2551,"The Reaver: The Sundering, Book IV",Richard Lee Byers,Wizards of the Coast,2014-7-1,Hardcover,352.0,4.2
2552,Fatal Revenant: The Last Chronicles of Thomas Covenant,Stephen R. Donaldson,Ace,2008-8-5,Paperback,640.0,4.1
2553,"The Book of Lost Tales, Part Two (The History of Middle-Earth, Vol. 2)",J.R.R. Tolkien,Del Rey,1992-4-22,Hardcover,391.0,4.2
2554,Throne of the Crescent Moon (Crescent Moon Kingdoms),Saladin Ahmed,DAW,2012-12-31,Paperback,384.0,4.2
2555,Stranger Magics,Ash Fitzsimmons,Harper Voyager,2018-1-9,Kindle,464.0,4.7
2556,The Dinosaur Knights (The Dinosaur Lords),Victor Milán,Tor Fantasy,2017-5-30,Paperback,624.0,4.3
2557,Among the Fallen (Godserfs),NS Dolkart,Angry Robot,2017-4-4,Paperback,480.0,5.0
2558,The Revenge of the Dwarves,Markus Heitz,Orbit,2011-11-3,Hardcover,816.0,4.6
2559,"Stalking Darkness (Nightrunner, Vol. 2)",Lynn Flewelling,Spectra,1997-2-3,Kindle,512.0,4.4
2560,Eagle and Empire: The Clash of Eagles Trilogy Book III,Alan Smale,Del Rey,2017-10-31,Kindle,608.0,4.4
2561,Dark Wraith of Shannara,Terry Brooks,Del Rey,2008-3-25,Hardcover,208.0,3.3
2562,Flame of Sevenwaters,Juliet Marillier,Ace,2013-11-5,Hardcover,448.0,4.5
2563,Spirit's End (Eli Monpress Book 5),Rachel Aaron,Orbit,2012-11-20,Kindle,560.0,4.6
2564,Conspiracy of Ravens (The Shadow),Lila Bowen,Orbit,2017-7-18,Paperback,400.0,4.1
2565,The Urth of the New Sun: The sequel to 'The Book of the New Sun',Gene Wolfe,Orb Books,1997-11-15,Kindle,384.0,4.0
2566,A Dance of Mirrors (Shadowdance 3),David Dalglish,Orbit,2013-12-3,Kindle,400.0,4.3
2567,"The Seventh Gate: A Death Gate Novel, Volume 7",Margaret Weis,Spectra,1995-10-1,Kindle,368.0,4.3
2568,The Dolphins of Pern (Dragonriders of Pern),Anne McCaffrey,Del Rey,1995-9-27,Paperback,371.0,4.7
2569,"Ogre, Ogre (Xanth)",Piers Anthony,Del Rey,1987-11-12,Paperback,320.0,4.5
2570,Covert Fae: A Demons of Fire and Night Novel (A Spy Among the Fallen),C.N. Crawford,Independently published,2018-1-22,Paperback,272.0,4.5
2571,"The Death of Chaos (Saga of Recluce, Book 5)",L. E. Modesitt Jr.,Tor Fantasy,1996-6-15,Kindle,629.0,4.6
