Author,Format,ID,Name,Pages,Publisher,Publishing_Date,Rating
Ted Dekker,Hardcover,1609.0,Forbidden (The Books of Mortals),448.0,FaithWords,2012-10-30,4.4
John Fowles,Kindle,1610.0,The Magus,672.0,Dell,1985-4-1,4.1
Cynthia Swanson,Kindle,1611.0,The Bookseller: A Novel,368.0,Harper Paperbacks,2016-3-22,4.1
Nikolai Gogol,Hardcover,1612.0,Dead Souls,432.0,Vintage,1997-3-25,3.9
Franz Kafka,Hardcover,1613.0,The Castle,352.0,Schocken,1998-12-15,4.0
Oliver Bowden,Kindle,1614.0,Assassin's Creed: Renaissance,496.0,Ace,2010-2-23,4.1
Eileen Wilks,Hardcover,1615.0,"Tempting Danger (The World of the Lupi, Book 1)",320.0,Berkley,2004-10-5,4.3
Jonathan Maberry,Paperback,1616.0,The King of Plagues: A Joe Ledger Novel,624.0,St. Martin's Paperbacks,2016-8-2,4.4
Satoshi Kon,Kindle,1617.0,Satoshi Kon's: Opus,384.0,Dark Horse Manga,2014-12-9,4.5
Charles Stross,Paperback,1618.0,Accelerando (Singularity),415.0,Ace,2006-6-27,3.7
Scott Smith,Hardcover,1619.0,The Ruins,384.0,Vintage,2008-2-26,3.3
Taylor Anderson,Paperback,1620.0,Into the Storm (Destroyermen),416.0,Ace,2009-2-3,4.4
Glen David Gold,Hardcover,1621.0,Carter Beats the Devil,496.0,Hachette Books,2002-9-18,4.4
George Saunders,Hardcover,1622.0,Pastoralia,188.0,Riverhead Books,2001-6-1,4.2
Julio Cortazar,Kindle,1623.0,Hopscotch: A Novel (Pantheon Modern Writers Series),576.0,Pantheon,1987-2-12,4.1
Terri Blackstock,Hardcover,1624.0,When Dreams Cross (Second Chances Series #2),240.0,Zondervan,2000-6-1,4.3
Peter F. Hamilton,Hardcover,1625.0,The Abyss Beyond Dreams: A Novel of the Commonwealth (Commonwealth: Chronicle of the Fallers),640.0,Del Rey,2015-9-1,4.3
Cleo Coyle,Kindle,1626.0,"On What Grounds (Coffeehouse Mysteries, No. 1)",288.0,Berkley,2003-9-2,3.9
Simon R. Green,Kindle,1627.0,"Sharper Than a Serpent's Tooth (Nightside, Book 6)",256.0,Ace,2006-2-28,4.3
D.J. Molles,Paperback,1628.0,Refugees (The Remaining),544.0,Orbit,2014-7-29,4.8
Ben H. Winters,Hardcover,1629.0,World of Trouble: The Last Policeman Book III (The Last Policeman Trilogy),320.0,Quirk Books,2014-7-15,4.4
Bailey Cates,Hardcover,1630.0,Brownies and Broomsticks: A Magical Bakery Mystery,336.0,Berkley,2012-5-1,4.4
Johann Wolfgang von Goethe,Hardcover,1631.0,Faust (Bantam Classics) (Part I) (English and German Edition),327.0,Bantam Books,1988-8-1,3.9
Robert Jackson Bennett,Paperback,1632.0,American Elsewhere,688.0,Orbit,2013-2-12,4.0
J A Whiting,Paperback,1633.0,A Puzzle in Paxton Park (A Paxton Park Mystery) (Volume 3),264.0,CreateSpace Independent Publishing Platform,2018-2-28,4.9
Oliver Bowden,Kindle,1634.0,Assassin's Creed: Unity,432.0,Ace,2014-12-2,4.4
G. Michael Hopf,Kindle,1635.0,The End: A Postapocalyptic Novel (The New World Series),384.0,Plume,2014-1-7,4.1
Joe Haldeman,Paperback,1636.0,Forever Peace,368.0,Ace,1998-10-1,3.4
Joyce Carol Oates,Kindle,1637.0,Blonde: A Novel,752.0,Ecco,2009-9-15,4.0
Delia James,Paperback,1638.0,A Familiar Tail (A Witch's Cat Mystery),336.0,Berkley,2016-2-2,4.7
Juliet Blackwell,Hardcover,1639.0,If Walls Could Talk (Haunted Home Renovation Mysteries),326.0,OBSIDIAN,2010-12-7,4.3
Michael Crichton,Kindle,1640.0,Eaters of the Dead,179.0,Harper,2009-4-28,4.2
Raynesha Pittman,Hardcover,1641.0,Dog Food 2: K'wan Presents,304.0,Urban Books,2016-11-29,4.9
Dan Wells,Paperback,1642.0,Over Your Dead Body (John Cleaver),304.0,Tor Books,2016-5-3,4.5
Dean Koontz,Hardcover,1643.0,77 Shadow Street (with bonus novella The Moonlit Mind): A Novel,720.0,Bantam,2012-8-28,3.4
Jonathan Maberry,Kindle,1644.0,Extinction Machine: A Joe Ledger Novel,448.0,St. Martin's Griffin,2013-3-26,4.6
Dean Koontz,Paperback,1645.0,The Good Guy: A Novel,464.0,Bantam,2012-6-26,4.2
Karen Chance,Hardcover,1646.0,Touch the Dark (Cassandra Palmer),320.0,Ace,2006-6-6,3.6
Dan Wells,Kindle,1647.0,Mr. Monster (John Cleaver),288.0,Tor Books,2010-9-28,4.5
JaQuavis Coleman,Paperback,1648.0,The Day the Streets Stood Still (Urban Books),288.0,Urban Books,2014-9-30,4.5
Simone St. James,Kindle,1649.0,An Inquiry Into Love and Death,368.0,Berkley,2013-3-5,4.3
Theodore Sturgeon,Hardcover,1650.0,More Than Human,192.0,Vintage,1998-12-29,4.3
Karen Robards,Paperback,1651.0,Her Last Whisper: A Novel (Dr. Charlotte Stone),400.0,Ballantine Books,2015-6-30,4.5
Karen Robards,Hardcover,1652.0,The Last Victim: A Novel (Dr. Charlotte Stone),416.0,Ballantine Books,2013-4-30,4.1
Heather Graham,Paperback,1653.0,Ghost Night (The Bone Island Trilogy),400.0,MIRA,2010-7-27,4.5
Steve Alten,Paperback,1654.0,Meg: Hell's Aquarium,512.0,Tor Books,2010-4-27,4.3
G.S. Denning,Kindle,1655.0,Warlock Holmes: The Hell-Hound of the Baskervilles: Warlock Holmes 2,320.0,Titan Books,2017-5-16,4.9
Stuart MacBride,Paperback,1656.0,"Shatter the Bones (Logan McRae, Book 7)",464.0,HarperCollins,2012-1-5,4.4
Carol J. Perry,Hardcover,1657.0,Caught Dead Handed (A Witch City Mystery),416.0,Kensington,2014-9-2,4.3
Dean Koontz,Paperback,1658.0,From the Corner of His Eye: A Novel,752.0,Bantam,2012-5-29,4.5
Anne Rice,Hardcover,1659.0,"The Vampire Chronicles Collection, Volume 1",1280.0,Ballantine Books,2002-10-1,4.6
Madeline Ashby,Hardcover,1660.0,Company Town,288.0,Tor Books,2017-7-18,4.1
Dean Koontz,Paperback,1661.0,Twilight Eyes,480.0,Berkley,2007-12-4,4.3
Randy Alcorn,Hardcover,1662.0,Lord Foulgrin's Letters,208.0,Multnomah,2001-9-13,4.6
Amanda Quick,Hardcover,1663.0,The Perfect Poison (Arcane Society),464.0,Berkley,2010-3-30,4.5
Seanan McGuire,Hardcover,1664.0,An Artificial Night (October Daye),384.0,DAW,2010-9-7,4.5
Emma Newman,Paperback,1665.0,After Atlas (A Planetfall Novel),384.0,Ace,2016-11-8,4.4
Kevin Barry,Paperback,1666.0,Beatlebone,320.0,Anchor,2016-10-4,3.5
Raymond E Feist,Paperback,1667.0,Rise of a Merchant Prince: Book Two of the Serpentwar Saga,464.0,Harper Voyager,2010-12-28,4.0
Knut Hamsun,Kindle,1668.0,Hunger (Penguin Twentieth-Century Classics),240.0,Penguin Classics,1998-2-1,4.3
Tanya Huff,Kindle,1669.0,Blood Price (Blood Books),272.0,DAW,2007-9-25,4.0
Nikki Turner,Kindle,1670.0,Carl Weber's Kingpins: Miami,304.0,Urban Books,2016-6-28,4.1
Vicki Stiefel,Hardcover,1671.0,Chest of Bone (Afterworld Chronicles),,Curiosity Quills Press,2017-2-14,4.3
Oliver Bowden,Kindle,1672.0,Assassin's Creed: Brotherhood,528.0,Ace,2010-11-30,4.4
Robert McCammon,Paperback,1673.0,Gone South,416.0,Gallery Books,2008-10-14,4.4
Lynsay Sands,Kindle,1674.0,One Lucky Vampire: An Argeneau Novel (Argeneau Vampire),384.0,Avon,2013-9-24,4.5
Mira Grant,Paperback,1675.0,Symbiont (Parasitology),544.0,Orbit,2015-10-13,3.8
Robert A. Heinlein,Paperback,1676.0,I Will Fear No Evil,512.0,Ace,1987-4-15,3.7
Lynsay Sands,Hardcover,1677.0,"A Quick Bite (Argeneau Vampires, Book 1)",384.0,Avon,2005-10-25,4.1
Flann O'Brien,Hardcover,1678.0,At Swim-Two-Birds (Irish Literature),239.0,Dalkey Archive Press,2005-9-1,3.8
Mary Higgins Clark,Kindle,1679.0,A Cry In The Night,352.0,Pocket Books,1993-12-1,4.3
Jonathan Maberry,Hardcover,1680.0,Kill Switch: A Joe Ledger Novel,544.0,St. Martin's Griffin,2016-4-26,4.6
James Abel,Paperback,1681.0,Cold Silence (A Joe Rush Novel),400.0,Berkley,2017-5-30,4.2
K. R. Richardson,Kindle,1682.0,Blood Orbit: A Gattis File Novel,496.0,Pyr,2018-5-8,
John Saul,Kindle,1683.0,The Presence: A Novel,432.0,Ballantine Books,1998-4-29,4.3
Lynsay Sands,Hardcover,1684.0,Vampires Like It Hot: An Argeneau Novel,384.0,Avon,2018-9-18,
Juliet Marillier,Hardcover,1685.0,Heir to Sevenwaters,416.0,Ace,2009-11-3,4.5
Chuck Wendig,Hardcover,1686.0,The Cormorant (Miriam Black),352.0,Saga Press,2016-2-23,4.5
Dean Koontz,Paperback,1687.0,Fear Nothing: A Novel (Christopher Snow),448.0,Bantam,2012-7-31,4.2
Lucy Banks,Kindle,1688.0,The Case of the Green-Dressed Ghost (Dr Ribero's Agency of the Supernatural),284.0,Amberjack Publishing,2017-3-7,4.4
Misty Mount,Paperback,1689.0,The Shadow Girl,298.0,Between the Lines Publishing,2017-12-29,4.9
S.D. Perry,Hardcover,1690.0,Resident Evil: City of the Dead,336.0,Titan Books,2012-9-18,4.7
Carol J. Perry,Hardcover,1691.0,Look Both Ways (A Witch City Mystery),352.0,Kensington,2015-10-27,4.5
Jack McDevitt,Hardcover,1692.0,The Engines of God,432.0,Ace,1995-12-1,4.0
Gillian Anderson,Hardcover,1693.0,A Vision of Fire: Book 1 of The EarthEnd Saga,304.0,Simon & Schuster/ Simon451,2015-11-24,4.0
Clive Barker,Kindle,1694.0,The Damnation Game,448.0,Berkley,2002-11-5,4.1
J. G. Ballard,Paperback,1695.0,Concrete Island: A Novel,176.0,Picador,2001-10-5,3.8
K'wan,Hardcover,1696.0,Road Dawgz: Triple Crown Collection (The Triple Crown Collection),304.0,Urban Books,2015-10-27,4.1
William W. Johnstone,Paperback,1697.0,Flintlock,384.0,Pinnacle,2013-10-1,3.9
Dean Koontz,Paperback,1698.0,Seize the Night: A Novel (Christopher Snow),464.0,Bantam,2012-7-31,4.3
Angie Fox,Hardcover,1699.0,The Haunted Heist (Southern Ghost Hunter) (Volume 3),264.0,Angie Fox,2016-3-17,4.8
Dan Simmons,Hardcover,1700.0,A Winter Haunting,384.0,HarperTorch,2002-12-31,4.0
G.S. Denning,Kindle,1701.0,Warlock Holmes - A Study in Brimstone,336.0,Titan Books,2016-5-17,4.5
Wilkie Martin,Paperback,1702.0,Inspector Hobbes and the Blood: unhuman I - A fast paced comedy crime fantasy (Volume 1),312.0,The Witcherley Book Company,2013-7-24,4.0
Jason Aaron,Paperback,1703.0,Southern Bastards Volume 4,160.0,Image Comics,2018-6-12,
Jesse Kellerman,Kindle,1704.0,The Golem of Hollywood,688.0,Berkley,2015-7-28,2.7
Graham Hancock,Paperback,1705.0,War God: Night of Sorrows,512.0,Peach Publishing,2017-4-21,4.9
Victoria Laurie,Kindle,1706.0,"Better Read Than Dead (Psychic Eye Mysteries, Book 2)",304.0,Berkley,2005-6-7,4.4
Ryan Lockwood,Kindle,1707.0,Below,416.0,Pinnacle,2013-6-25,4.2
Karen Maitland,Kindle,1708.0,Company of Liars: A Novel,480.0,Delta,2009-8-25,4.1
Jasmine Gower,Paperback,1709.0,Moonshine,320.0,Angry Robot,2018-2-6,3.9
Dekker Ted,Hardcover,1710.0,Sinner: A Paradise Novel (The Books of History Chronicles) (The Books of History Chronicles: The Paradise Books),384.0,Thomas Nelson,2009-6-30,4.0
Steve Berry,Hardcover,1711.0,The Jefferson Key (with bonus short story The Devil's Gold): A Novel (Cotton Malone),592.0,Ballantine Books,2011-12-27,4.1
Stefan Zweig,Paperback,1712.0,Letter from an Unknown Woman and Other Stories,200.0,Pushkin Press,2013-8-13,4.4
J A Whiting,Paperback,1713.0,Panic in Paxton Park (A Paxton Park Mystery) (Volume 2),260.0,CreateSpace Independent Publishing Platform,2017-10-25,4.7
Brick,Kindle,1714.0,Hood Misfits Volume 2: Carl Weber Presents,304.0,Urban Books,2015-7-28,4.8
Peter Straub,Kindle,1715.0,Floating Dragon,624.0,Berkley,2003-8-5,4.3
Amanda Stevens,Hardcover,1716.0,The Awakening: A Paranormal Romance Novel (The Graveyard Queen),416.0,MIRA,2017-3-28,4.8
Simon R. Green,Paperback,1717.0,"Nightingale's Lament (Nightside, Book 3)",256.0,Ace,2004-4-27,4.5
Victoria Laurie,Hardcover,1718.0,A Panicked Premonition (Psychic Eye Mystery),368.0,Berkley,2018-6-5,4.5
Nathaniel Rich,Hardcover,1719.0,Odds Against Tomorrow: A Novel,320.0,Picador,2014-4-1,3.6
Jonathan Maberry,Kindle,1720.0,Dead Man's Song (A Pine Deep Novel),512.0,Kensington,2016-8-30,4.1
Robert K. Silverberg,Kindle,1721.0,Lord Valentine's Castle: Book One of the Majipoor Cycle,480.0,Ace,2012-5-1,4.1
R. A. Dick,Paperback,1722.0,The Ghost and Mrs. Muir: Vintage Movie Classics,192.0,Vintage,2014-9-23,4.6
Alice Hoffman,Kindle,1723.0,The Third Angel: A Novel,289.0,Broadway Books,2009-3-3,3.9
Félix J. Palma,Hardcover,1724.0,The Map of Time: A Novel (The Map of Time Trilogy),720.0,Pocket Books,2012-6-26,3.4
Shirley Rousseau Murphy,Paperback,1725.0,Cat Under Fire: A Joe Grey Mystery (Joe Grey Mystery Series),256.0,Avon,1998-12-9,4.7
Steve McHugh,Hardcover,1726.0,A Flicker of Steel (The Avalon Chronicles),,47North,2018-7-3,
Juliet Blackwell,Hardcover,1727.0,Give Up the Ghost (Haunted Home Renovation),336.0,Berkley,2015-12-1,4.8
Katherine Neville,Hardcover,1728.0,The Magic Circle,560.0,Ballantine Books,1999-1-30,3.4
Rose Pressey,Hardcover,1729.0,"If You've Got It, Haunt It (A Haunted Vintage Mystery)",304.0,Kensington,2014-12-2,4.1
Jonathan Maberry,Kindle,1730.0,Ghost Road Blues (A Pine Deep Novel),480.0,Kensington,2016-5-31,4.2
Victoria Hamilton,Hardcover,1731.0,White Colander Crime (A Vintage Kitchen Mystery),304.0,Berkley,2015-11-3,4.2
Tim Washburn,Paperback,1732.0,Powerless,464.0,Pinnacle,2015-10-27,4.2
Heather Graham,Hardcover,1733.0,Phantom Evil (Krewe of Hunters),368.0,MIRA,2012-3-27,4.3
Ge Fei,Paperback,1734.0,The Invisibility Cloak (New York Review Books Classics),144.0,NYRB Classics,2016-10-11,4.1
Juliet Blackwell,Kindle,1735.0,Dead Bolt: A Haunted Home Renovation Mystery (Haunted Home Repair Mystery),336.0,Berkley,2011-12-6,4.4
Juliet Blackwell,Kindle,1736.0,Home for the Haunting: A Haunted Home Renovation Mystery,336.0,Berkley,2013-12-3,4.6
Amanda M. Lee,Paperback,1737.0,Every Witch Way But Wicked: A Wicked Witches of the Midwest Mystery (Volume 2),206.0,CreateSpace Independent Publishing Platform,2013-3-28,4.6
Andy McDermott,Hardcover,1738.0,The Pyramid of Doom: A Novel,496.0,Bantam,2010-9-28,4.1
Alena Graedon,Hardcover,1739.0,The Word Exchange,384.0,Anchor,2015-2-3,3.8
Warren Ellis,Kindle,1740.0,Crooked Little Vein,304.0,William Morrow Paperbacks,2008-7-22,4.0
Fay Weldon,Hardcover,1741.0,The Life and Loves of a She Devil,288.0,Ballantine Books,1985-8-12,3.9
Delia James,Hardcover,1742.0,By Familiar Means (A Witch's Cat Mystery),336.0,Berkley,2016-9-27,4.6
Joe Hart,Paperback,1743.0,The Last Girl (The Dominion Trilogy),384.0,Thomas & Mercer,2016-3-1,4.1
Laura Spinella,Paperback,1744.0,Echo Moon (A Ghost Gifts Novel),428.0,Montlake Romance,2018-5-22,
Kim Harrison,Hardcover,1745.0,The Drafter (The Peri Reed Chronicles),560.0,Pocket Books,2016-4-19,4.0
Glen Cook,Hardcover,1746.0,"Bitter Gold Hearts (Garrett, P.I., Book 2)",288.0,Ace,2007-4-1,4.7
Wilkie Martin,Kindle,1747.0,Inspector Hobbes and the Curse: unhuman II - a Fast Paced Comedy Crime Fantasy Romance (Volume 2),354.0,The Witcherley Book Company,2013-10-28,4.4
Julianna Baggott,Hardcover,1748.0,Pure,431.0,Grand Central Publishing,2012-9-4,4.1
Matt Ruff,Paperback,1749.0,Bad Monkeys: A Novel (P.S.),256.0,Harper Perennial,2008-8-12,3.8
Brick,Kindle,1750.0,Carl Weber's Kingpins: ATL,304.0,Urban Books,2017-3-28,3.9
R E McDermott,Paperback,1751.0,Push Back: A Post Apocalyptic Thriller (The Disruption Series) (Volume 2),390.0,R.E. McDermott,2016-7-26,4.8
Steven Brust,Hardcover,1752.0,The Skill of Our Hands: A Novel (The Incrementalists),352.0,Tor Books,2018-1-2,4.1
Raymond E Feist,Paperback,1753.0,"Krondor the Assassins (The Riftwar Legacy, Book 2)",416.0,HarperTorch,2000-11-7,4.2
John P. Logsdon,Hardcover,1754.0,Grave Creatures (Las Vegas Paranormal Police Department) (Volume 2),244.0,CreateSpace Independent Publishing Platform,2017-11-15,4.7
Caitlin R. Kiernan,Kindle,1755.0,The Drowning Girl,352.0,Ace,2012-3-6,4.0
Tom Jenks,Hardcover,1756.0,American Short Story Masterpieces: A Rich Selection of Recent Fiction from America's Best Modern Writers,528.0,Dell,1989-4-2,4.2
Melissa F. Olson,Hardcover,1757.0,Dead Spots (Scarlett Bernard),293.0,47North,2012-10-30,4.3
Kelley Armstrong,Paperback,1758.0,Personal Demon,544.0,Bantam,2008-9-30,4.2
Michelle Sagara,Paperback,1759.0,Cast in Flight (Chronicles of Elantra),544.0,MIRA,2016-10-25,4.6
Nancy Atherton,Hardcover,1760.0,Aunt Dimity: Vampire Hunter (Aunt Dimity Mystery),304.0,Penguin Books,2009-1-27,4.5
Mark Z. Danielewski,Paperback,1761.0,Whalestoe Letters,86.0,Pantheon,2000-10-10,3.9
Robert Coover,Hardcover,1762.0,The Universal Baseball Association,256.0,The Overlook Press,2011-11-1,4.1
Craig Schaefer,Hardcover,1763.0,Glass Predator (Harmony Black Series),332.0,47North,2017-3-28,4.5
Kay Hooper,Kindle,1764.0,A Deadly Web (A Bishop Files Novel),304.0,Berkley,2015-4-7,3.8
NISIOISIN,Kindle,1765.0,Decapitation: Kubikiri Cycle (Zaregoto Series),322.0,Vertical,2017-1-24,5.0
Rod Duncan,Paperback,1766.0,The Queen of All Crows: The First Book in The Map of Unknown Things (1map of Unknown Things),352.0,Angry Robot,2018-1-2,4.3
Dewey Lambdin,Hardcover,1767.0,A King's Commander: The Alan Lewrie Naval Adventures #7 (Bk. 7),448.0,McBooks Press,2008-1-1,4.3
Simon R. Green,Paperback,1768.0,The Bride Wore Black Leather (A Nightside Book),320.0,Ace,2012-12-24,4.4
Paul Cornell,Paperback,1769.0,Who Killed Sherlock Holmes? (Shadow Police),368.0,Pan Macmillan,2017-5-1,4.3
Donald Goines,Hardcover,1770.0,Dopefiend,320.0,Holloway House,2007-5-1,4.6
Charlaine Harris,Hardcover,1771.0,Sookie Stackhouse 8-copy Boxed Set (Sookie Stackhouse / Southern Vampire),2500.0,Ace,2009-9-29,4.6
Raymond E Feist,Hardcover,1772.0,Rage of a Demon King: Book Three of the Serpentwar Saga,608.0,Harper Voyager,2010-12-28,4.2
Ernst Junger,Paperback,1773.0,The Glass Bees (New York Review Books Classics),224.0,NYRB Classics,2000-9-30,4.5
Dean Koontz,Hardcover,1774.0,The Darkest Evening of the Year: A Novel,480.0,Bantam,2012-5-29,3.9
F. Paul Wilson,Paperback,1775.0,Conspiracies: A Repairman Jack Novel,416.0,Tor Books,2008-9-30,4.2
Peter Telep,Hardcover,1776.0,Aftermath (Splinter Cell: Blacklist),384.0,Berkley,2013-10-1,4.1
Leslie Meier,Hardcover,1777.0,Trick Or Treat Murder (A Lucy Stone Mystery),256.0,Kensington,2011-9-1,4.1
Terry Goodkind,Kindle,1778.0,The Law of Nines,576.0,Jove,2010-8-31,4.0
Sean Pidgeon,Kindle,1779.0,Finding Camlann: A Novel,352.0,W. W. Norton & Company,2014-1-13,4.0
Elicia Hyder,Hardcover,1780.0,The Angel of Death (The Soul Summoner Series) (Volume 3),406.0,Forge Creek Press,2016-7-16,4.8
David Crawford,Kindle,1781.0,Collision Course,339.0,Berkley,2012-11-6,3.2
Nalini Singh,Hardcover,1782.0,"Tangle of Need: A Psy-Changeling Novel (Psy-Changeling Novel, A)",448.0,Berkley,2012-12-4,4.2
Ridley Pearson,Hardcover,1783.0,Lock and Key: The Initiation,384.0,HarperCollins,2017-5-2,4.3
Gordon Parks,Paperback,1784.0,Learning Tree,240.0,Fawcett,1987-6-12,4.6
G. K. Chesterton,Kindle,1785.0,The Man Who Was Thursday: A Nightmare (Penguin Classics),192.0,Penguin Classics,2011-5-31,4.1
Carrie Vaughn,Kindle,1786.0,Bannerless (The Bannerless Saga),288.0,John Joseph Adams/Mariner Books,2017-7-11,4.0
Dima Zales,Paperback,1787.0,The Thought Readers (Mind Dimensions Book 1) (Volume 1),302.0,Mozaika Publications,2014-10-2,4.2
Craig Schaefer,Kindle,1788.0,Harmony Black (Harmony Black Series),332.0,47North,2016-2-1,4.3
Andy McDermott,Hardcover,1789.0,Empire of Gold: A Novel (Nina Wilde and Eddie Chase),544.0,Bantam,2011-9-27,4.1
Frank Schatzing,Paperback,1790.0,The Swarm: A Novel,912.0,William Morrow Paperbacks,2007-5-8,4.0
Kim Harrison,Paperback,1791.0,The Operator (The Peri Reed Chronicles),496.0,Pocket Books,2016-11-22,4.4
John Ringo,Kindle,1792.0,"A Deeper Blue (Paladin of Shadows, Book 5)",432.0,Baen,2008-5-20,4.6
Tim LaHaye,Kindle,1793.0,Babylon Rising: The Secret on Ararat,416.0,Bantam,2006-11-28,4.5
Taylor Anderson,Paperback,1794.0,Storm Surge (Destroyermen),512.0,Ace,2014-5-6,4.6
R. L. Stine,Kindle,1795.0,"The New Girl (Fear Street, No. 1)",176.0,Simon Pulse,2006-8-1,4.2
Brandi Johnson,Paperback,1796.0,Carl Weber's Kingpins: Cleveland,304.0,Urban Books,2017-4-25,4.5
Patrick S. Tomlinson,Hardcover,1797.0,The Ark: Children of a Dead Earth Book One,400.0,Angry Robot,2015-11-3,3.9
John Wyndham,Kindle,1798.0,The Midwich Cuckoos,224.0,Penguin UK,2008-9-23,4.1
Juliet Blackwell,Paperback,1799.0,A Toxic Trousseau,352.0,Berkley,2016-7-5,4.8
Molly MacRae,Paperback,1800.0,Knot the Usual Suspects (Haunted Yarn Shop Mystery),352.0,Berkley,2015-9-1,4.3
Heather Graham,Kindle,1801.0,"Haunted Destiny: A paranormal, thrilling suspense novel (Krewe of Hunters)",368.0,MIRA,2016-5-24,4.6
Heather Graham,Paperback,1802.0,The Hidden (Krewe of Hunters),368.0,MIRA,2015-9-29,4.6
John Dixon,Kindle,1803.0,Devil's Pocket,352.0,Gallery Books,2015-8-4,4.5
Daniel H. Wilson,Kindle,1804.0,Robogenesis,464.0,Vintage,2015-3-17,3.9
Nick Mamatas,Kindle,1805.0,I Am Providence: A Novel,256.0,Night Shade Books,2016-8-9,4.1
Carsten Stroud,Kindle,1806.0,Niceville: Book One of the Niceville Trilogy (Vintage Crime/Black Lizard),464.0,Vintage Crime/Black Lizard,2013-8-13,3.6
David L. Golemon,Kindle,1807.0,Legacy: An Event Group Thriller (Event Group Thrillers),624.0,St. Martin's Paperbacks,2012-5-22,4.4
Jasper Fforde,Kindle,1808.0,The Fourth Bear: A Nursery Crime (Jack Spratt Investigates),378.0,Penguin Books,2007-7-31,4.7
Sheila Connolly,Hardcover,1809.0,Golden Malicious (An Orchard Mystery),304.0,Berkley,2013-10-1,4.3
E.J. Copperman,Paperback,1810.0,Inspector Specter (A Haunted Guesthouse Mystery),304.0,Berkley,2014-12-2,4.5
Yasutaka Tsutsui,Hardcover,1811.0,Paprika (Vintage Contemporaries),352.0,Vintage,2013-2-12,3.6
Hiromi Kawakami,Hardcover,1812.0,Record of a Night too Brief (Japanese Novellas),158.0,Pushkin Press,2017-12-5,3.5
Murasaki Shikibu,Paperback,1813.0,The Tale of Genji (Penguin Classics),352.0,Penguin Classics,2006-2-28,3.3
L. D. Colter,Hardcover,1814.0,A Borrowed Hell,185.0,Digital Fantasy Fiction,,4.4
Lynsay Sands,Paperback,1815.0,Runaway Vampire: An Argeneau Novel (Argeneau Vampire),368.0,Avon,2016-2-23,4.5
Glen Cook,Hardcover,1816.0,"Gilded Latten Bones: A Garrett, P.I., Novel",368.0,Ace,2010-11-2,4.5
Brett Battles,Hardcover,1817.0,Destroyer (Rewinder Series),252.0,47North,2016-1-12,3.7
Leigh Perry,Paperback,1818.0,A Skeleton in the Family (A Family Skeleton Mystery),304.0,Berkley,2013-9-3,4.6
Guy Gavriel Kay,Hardcover,1819.0,Sailing to Sarantium (Sarantine Mosaic),448.0,Ace,2010-9-7,4.4
Wilkie Martin,Kindle,1820.0,Inspector Hobbes and the Bones: Cozy Mystery Comedy Crime Fantasy (unhuman) (Volume 4),348.0,The Witcherley Book Company,2016-12-16,4.5
Jeannette de Beauvoir,Paperback,1821.0,Murder at Fantasia Fair: A Provincetown Mystery (Provincetown Theme Week) (Volume 2),282.0,HomePort Press,2017-9-28,4.7
Simon R. Green,Hardcover,1822.0,"Hex and the City (Nightside, Book 4)",256.0,Ace,2005-2-22,4.3
Shani Struthers,Paperback,1823.0,This Haunted World Book Two: The Eleventh Floor,328.0,Authors Reach 1,2017-9-28,4.4
Laura Childs,Paperback,1824.0,Keepsake Crimes (A Scrapbooking Mystery),244.0,Berkley,2003-5-6,4.0
Victor LaValle,Paperback,1825.0,Big Machine: A Novel,384.0,Spiegel & Grau,2010-3-9,3.5
Lynsay Sands,Kindle,1826.0,"Bite Me If You Can (Argeneau Vampires, Book 6)",384.0,Avon,2007-1-30,4.6
Heather Graham,Paperback,1827.0,The Death Dealer,368.0,MIRA,2008-12-23,4.5
Jeremy Robinson,Kindle,1828.0,Omega (a Jack Sigler Thriller),316.0,Breakneck Media,2013-9-10,4.8
Peter Tieryas,Paperback,1829.0,United States of Japan,448.0,Angry Robot,2017-8-1,3.7
G.S. Denning,Paperback,1830.0,Warlock Holmes - My Grave Ritual,,Titan Books,2018-5-15,
Ellery Adams,Paperback,1831.0,Pies and Prejudice (A Charmed Pie Shoppe Mystery),304.0,Berkley,2012-7-3,4.4
S.D. Perry,Paperback,1832.0,Resident Evil: Nemesis (Resident Evil (Titan Mass Market)),320.0,Titan Books,2012-11-20,4.7
John Varley,Hardcover,1833.0,Irontown Blues (Eight Worlds),304.0,Ace,2018-8-28,
Merry Shannon,Kindle,1834.0,Sword of the Guardian (Legends of Ithyria),272.0,Bold Strokes Books,2006-4-1,4.5
Rebecca Zanetti,Paperback,1835.0,Sweet Revenge (Sin Brothers),384.0,Forever,2014-6-24,4.7
Nancy Atherton,Paperback,1836.0,Aunt Dimity: Snowbound,272.0,Penguin Books,2005-2-1,4.5
Heather Graham,Paperback,1837.0,The Forgotten (Krewe of Hunters),343.0,MIRA,2015-7-28,4.6
Ben Marcus,Hardcover,1838.0,Leaving the Sea: Stories (Vintage Contemporaries),288.0,Vintage,2014-10-7,3.8
Kate Mosse,Hardcover,1839.0,Citadel: A Novel,720.0,William Morrow Paperbacks,2014-10-7,4.2
Juliet Blackwell,Hardcover,1840.0,Murder on the House: A Haunted Home Renovation Mystery (Haunted Home Repair Mystery),336.0,Berkley,2012-12-4,4.5
Anne Washburn,Hardcover,1841.0,The Twilight Zone (Oberon Modern Plays),96.0,Oberon Books,2018-3-18,
J A Whiting,Kindle,1842.0,Fortune's Wheel (A Claire Rollins Mystery) (Volume 4),300.0,CreateSpace Independent Publishing Platform,2017-9-21,4.7
Donald Goines,Hardcover,1843.0,Inner City Hoodlum,256.0,Holloway House,1992-8-1,4.4
Stephen King,Hardcover,1844.0,The Talisman: A  Novel,944.0,Pocket Books,2012-9-25,4.5
Alice Hoffman,Hardcover,1845.0,The Ice Queen: A Novel,211.0,Back Bay Books,2006-1-3,4.1
John P. Logsdon,Kindle,1846.0,Swarm of Fire (Las Vegas Paranormal Police Department) (Volume 5),188.0,CreateSpace Independent Publishing Platform,2018-2-4,4.8
Rachel Caine,Hardcover,1847.0,"Thin Air (Weather Warden, Book 6)",336.0,Ace,2007-8-7,3.9
Kelley Armstrong,Hardcover,1848.0,No Humans Involved (Women of the Otherworld),544.0,Bantam,2008-2-26,4.5
Guillermo Camacho,Kindle,1849.0,The Elites,284.0,Independently published,2018-2-28,2.0
Koji Suzuki,Paperback,1850.0,"Ring (Ring Series, Book 1)",282.0,Vertical,2004-4-25,4.2
John Banville,Paperback,1851.0,The Blue Guitar (Vintage International),272.0,Vintage,2016-8-9,3.3
T.C. Boyle,Hardcover,1852.0,A Friend of the Earth,349.0,Penguin Books,2001-9-1,3.8
Amitav Ghosh,Hardcover,1853.0,"The Calcutta Chromosome: A Novel of Fevers, Delirium & Discovery",320.0,Harper Perennial,2001-1-23,3.6
Heather Blake,Kindle,1854.0,It Takes a Witch: A Wishcraft Mystery,320.0,Berkley,2012-1-3,4.4
Nancy Atherton,Hardcover,1855.0,Aunt Dimity Goes West (Aunt Dimity Mystery),293.0,Penguin Books,2008-1-29,4.5
Kim Stanley Robinson,Hardcover,1856.0,Green Earth (Science in the Capital Trilogy),1088.0,Del Rey,2015-11-3,4.4
John Saul,Kindle,1857.0,Nathaniel: A Novel,384.0,Bantam,1984-7-1,4.0
F. Paul Wilson,Hardcover,1858.0,The Dark at the End (Repairman Jack),432.0,Tor Books,2012-9-25,4.4
William R. Forstchen,Kindle,1859.0,Pillar to the Sky: A Novel,576.0,Tor Books,2016-11-1,3.9
Lynsay Sands,Paperback,1860.0,Bitten By Cupid (An Argeneau Vampire Novella),384.0,Avon,2010-1-12,4.2
Jack Whyte,Kindle,1861.0,"Standard of Honor (Templar Trilogy, No 2)",800.0,Berkley,2008-7-29,4.2
Andy Weir,Hardcover,1862.0,Artemisa / Artemis (Spanish Edition),320.0,Nova,2018-2-27,4.5
Robert Kirkman,Paperback,1863.0,The Walking Dead: The Fall of the Governor: Parts 1 and 2 (The Walking Dead Series),544.0,St. Martin's Griffin,2014-11-25,4.5
Robert Kirkman,Hardcover,1864.0,The Walking Dead: Rise of the Governor and The Road to Woodbury (The Walking Dead Series),624.0,St. Martin's Griffin,2014-11-25,4.7
