Author,Format,ID,Name,Pages,Publisher,Publishing_Date,Rating
Christopher Greyson,Kindle Edition,1408.0,Pure of Heart: An Epic Fantasy,243.0,Greyson Media,2015-01-19,4.05
Dawn Cook,Kindle Edition,1409.0,"Vérité Perdue: Vérité, T4 (Fantasy)",546.0,Milady,2011-03-30,4.07
Jim Butcher,Audible Audio,1410.0,Urban Enemies: A Collection of Urban Fantasy Stories,,"Recorded Books, Inc.",2017-08-01,3.58
Bram Stoker,Paperback,1411.0,Crooken Sands (Fantasy and Horror Classics),22.0,Fantasy and Horror Classics,2011-04-28,3.2
Michelle Olley,Paperback,1412.0,Fetish: Masterpieces of Erotic Fantasy Photography,224.0,Running Press,1999-11-23,4.23
Shirley Kennedy,Paperback,1413.0,Lady Flora's Fantasy,224.0,Signet,2001-11-01,3.0
Roger Zelazny,,1414.0,Bringt Mir Den Kopf Des Märchenprinzen Fantasy Roman,,,,3.72
E. Nesbit,Hardcover,1415.0,"The Magic City by Edith Nesbit, Fiction, Fantasy & Magic",144.0,Aegypan,2008-05-01,3.97
Michael Dobrzycki,Paperback,1416.0,The Art of Drawing Dragons: Mythological Beasts and Fantasy Creatures,144.0,Walter Foster Publishing,2007-05-01,4.1
Fantasy Flight Games,Hardcover,1417.0,Dragonstar: Guide to the Galaxy,176.0,Fantasy Flight Games,2002-07-02,3.9
Lisa Barham,Paperback,1418.0,A Girl Like Moi,265.0,Simon Pulse,2006-12-01,3.7
Joan Lowery Nixon,Paperback,1419.0,In The Face of Danger,151.0,Laurel Leaf,1996-07-01,3.95
Agatha Christie,ebook,1420.0,Partners in Crime: A Tommy & Tuppence Adventure,,HarperCollins Publishers,2005-05-31,3.76
Hidenori Kusaka,Paperback,1421.0,"Pokémon Adventures, Vol. 18",192.0,VIZ Media - Children's,2013-09-03,4.32
Hans Jürgen Press,Hardcover,1422.0,The Adventures of the Black Hand Gang,128.0,Holiday House,1983-04-01,4.28
Hidenori Kusaka,Paperback,1423.0,"Pokémon Adventures, Vol. 19",192.0,VIZ Media - Children's,2013-11-05,4.34
Robert E. Howard,Audio CD,1424.0,The Coming of Conan the Cimmerian: The Original Adventures of the Greatest Sword and Sorcery Hero of All Time!,0.0,Tantor Media,2009-06-25,4.15
Marc Brown,Paperback,1425.0,Arthur Lost and Found,32.0,"Little, Brown Books for Young Readers",2000-09-01,4.06
Phil Masters,Paperback,1426.0,GURPS Discworld: Adventures on the Back of the Turtle,240.0,Steve Jackson Games,1998-08-06,3.82
Mike   Jackson,Paperback,1427.0,The Adventures of My Grandpa Bert,94.0,Createspace,2013-08-24,4.67
Hergé,Hardcover,1428.0,"The Adventures of Tintin, Vol. 3: The Crab With the Golden Claws / The Shooting Star / The Secret of the Unicorn",192.0,"Little, Brown Books for Young Readers",1994-05-02,4.3
P.J. O'Rourke,Paperback,1429.0,"Republican Party Reptile: The Confessions, Adventures, Essays and (Other) Outrages of P.J. O'Rourke",220.0,Atlantic Monthly Press,1995-09-29,3.84
Elizabeth Parkinson Bellows,Kindle Edition,1430.0,John William And The Bandits of Basswood,162.0,Pronoun,2016-07-27,3.92
Anonymous,Nook,1431.0,life and adventures of Lazarillo de Tormes,,,,3.49
Vonda Sinclair,ebook,1432.0,My Daring Highlander,250.0,Vonda Sinclair,2013-03-29,4.19
Thornton W. Burgess,Paperback,1433.0,The Adventures of Jerry Muskrat,96.0,Dover Publications,1993-11-08,4.06
Elliott Hester,Paperback,1434.0,Adventures of a Continental Drifter,301.0,Griffin,2006-09-19,3.34
Edgar Rice Burroughs,Mass Market Paperback,1435.0,Tarzan: The Lost Adventure,272.0,Del Rey,1997-04-28,3.66
Fantasy Flight Games,Hardcover,1436.0,Rogue Trader: Lure Of The Expanse,144.0,Fantasy Flight Games,2010-05-04,3.89
William Morris,Kindle Edition,1437.0,The Wood Beyond the World (Wildside Fantasy),107.0,,,3.64
Stella Gemmell,Kindle Edition,1438.0,La Cité,576.0,Bragelonne,2013-09-27,3.55
Dawn Cook,Kindle Edition,1439.0,"Vérité Oubliée: Vérité, T3 (Fantasy)",542.0,Milady,2011-03-16,4.03
R.A. Salvatore,Kindle Edition,1440.0,"Archimage: Retour à Gauntlgrym, T1",576.0,Milady,2016-09-23,4.32
Viola Rivard,Kindle Edition,1441.0,The Dragon's Appraiser: A Fantasy Romance Novel,206.0,Viola Rivard,2015-09-07,3.92
Isaac Asimov,Mass Market Paperback,1442.0,Asimov Fantasies: Curses,350.0,signet fantasy,1989-09-05,3.79
Jade James,ebook,1443.0,Naughty Fantasies,69.0,"Loose Id, LLC",2009-07-21,3.43
Nora Roberts,ebook,1444.0,Magic & Fantasy,,,,4.33
Kayleigh Malcolm,ebook,1445.0,Pursuing Their Fantasies,68.0,Decadent Publishing,2015-02-20,4.0
L. Ron Hubbard,Paperback,1446.0,Writers of the Future Volume 34: The Best New Sci Fi and Fantasy Short Stories of the Year,,,,4.0
Nathalie Gray,Paperback,1447.0,"Secrets, Volume 29: Indulge Your Fantasies",323.0,"Red Sage Publishing, Inc.",2010-07-01,4.33
Dominic Montserrat,Paperback,1448.0,"Akhenaten: History, Fantasy and Ancient Egypt",219.0,Routledge,2002-12-26,4.27
Marlon Mccaulsky,Nook,1449.0,Urban Fantasies Book 1,0.0,Emerald Star Press,2011-05-25,4.38
Martin McKenna,Paperback,1450.0,Digital Fantasy Painting Workshop,160.0,Harper Design,2004-10-05,3.7
Creative Hon,Paperback,1451.0,"Last Fantasy, Volume 1",192.0,TokyoPop,2006-03-07,3.73
Meg Silver,ebook,1452.0,Paramour,120.0,,,4.35
Alice Mills,Hardcover,1453.0,"Mythology: Myths, Legends and Fantasies",528.0,Global Book Publishing,2005-07-01,4.43
Tony Millionaire,Paperback,1454.0,The Adventures of Sock Monkey,117.0,Dark Horse Comics,2000-08-08,4.19
Lois McMaster Bujold,Audio,1455.0,Memory: A Miles Vorkosigan Adventure,,Blackstone Audiobooks,2006-01-01,4.44
Clive Cussler,Kindle Edition,1456.0,Treasure of Khan: Dirk Pitt #19,704.0,Penguin,2012-06-07,3.89
Carlos Magdalena,Hardcover,1457.0,The Plant Messiah: Adventures in Search of the World’s Rarest Species,238.0,Viking,2017-06-01,4.14
R.A. Montgomery,Paperback,1458.0,House of Danger,144.0,Chooseco,2006-05-01,3.41
Hidenori Kusaka,Paperback,1459.0,"Pokémon Adventures: Diamond and Pearl/Platinum, Vol. 6",208.0,VIZ Media - Children's,2012-10-02,4.28
Colleen L. Reece,Paperback,1460.0,The Mayflower Adventure,135.0,Barbour Publishing,1998-12-01,3.6
Walt Disney Company,Hardcover,1461.0,Pinocchio and His Puppet Show Adventure,42.0,Random House Books for Young Readers,1973-10-12,4.15
Sandra Hill,Paperback,1462.0,Snow on the Bayou,368.0,Forever,2014-08-26,4.09
Alfred Jarry,Paperback,1463.0,Adventures in 'Pataphysics,334.0,Atlas Press (GB),2001-09-01,4.2
Stanley Coren,Paperback,1464.0,Born to Bark: My Adventures with an Irrepressible and Unforgettable Dog,320.0,Atria Books,2011-08-16,3.82
David Casarett,Hardcover,1465.0,Shocked: Adventures in Bringing Back the Recently Dead,272.0,Current,2014-07-31,3.53
Karen Jean Matsko Hood,Paperback,1466.0,Adventure Travel: A Daily Journal,,,,4.1
Victoria  Roberts,Paperback,1467.0,Kissing the Highlander,479.0,Createspace Independent Publishing Platform,2015-02-10,4.2
Jack London,Paperback,1468.0,"The Iron Heel by Jack London, Fiction, Action & Adventure",,Aegypan,2007-02-01,3.74
Sean B. Carroll,Paperback,1469.0,Into the Jungle: Great Adventures in the Search for Evolution,207.0,Pearson,2008-09-01,4.04
Marc Brown,Hardcover,1470.0,Arthur's Teacher Moves In: An Arthur Adventure (Arthur Adventure Series),32.0,"Little, Brown Books for Young Readers",2000-09-01,3.88
L.R. Walker,Kindle Edition,1471.0,The Mystery of Garabandal: Fantasy or Fraud? Ghost or God?,280.0,Newtonia Publishing LLC,2013-11-05,4.32
Jonathan Green,Paperback,1472.0,Howl of the Werewolf,320.0,Wizard,2007-09-25,3.65
Mercedes Lackey,ebook,1473.0,A Tangled Web: A Fantasy Retelling of a Greek Mythology Romance,,Harlequin Special Releases,2017-09-01,3.82
Dawn Cook,Kindle Edition,1474.0,"Vérité Cachée: Vérité, T2 (Fantasy)",514.0,Milady,2011-02-09,3.93
Sean Wallace,Paperback,1475.0,Best New Fantasy,237.0,Wildside Press,2006-08-29,2.69
Kumiko Sudo,Paperback,1476.0,Fantasies & Flowers,135.0,McGraw-Hill Companies,1999-12-11,3.72
Marion Zimmer Bradley,Mass Market Paperback,1478.0,The Best of Marion Zimmer Bradley Fantasy Magazine Volume 2,248.0,Aspect,2009-12-19,3.85
Kiki Howell,Kindle Edition,1479.0,Cimmerian Shade: A Limited Edition Paranormal Romance & Urban Fantasy Collection,3046.0,Naughty Nights Press LLC,2017-09-12,4.42
Steve   Jackson,Paperback,1480.0,The Trolltooth Wars,,Puffin Books,1989-04-06,3.31
Gordon Van Gelder,Kindle Edition,1481.0,"Fantasy & Science Fiction, March/April 2014",,"Spilogale, Inc.",2014-03-01,3.54
Susan Cooper,,1482.0,King Of Shadows/Fantasy,,,,3.7
H.P. Lovecraft,Paperback,1483.0,"The Shunned House by H. P. Lovecraft, Fiction, Fantasy, Classics, Horror",48.0,Aegypan,2011-05-01,3.57
Isaac Asimov,,1484.0,Mammoth Book Of Short Fantasy Novels,,,,3.62
Jonathan Green,Paperback,1485.0,Curse of the Mummy,240.0,Puffin Books,1995-10-26,3.21
Harmon Cooper,Kindle Edition,1486.0,High Fantasy,262.0,Boycott Books,2015-12-26,4.16
Thomas Hardy,Paperback,1487.0,Two on a Tower: A Romantic Fantasy,262.0,Createspace,2014-03-28,3.7
Arthur Machen,Hardcover,1488.0,"The Three Impostors by Arthur Machen, Fiction, Fantasy, Horror, Fairy Tales, Folk Tales, Legends & Mythology",,Wildside Press,2004-07-01,4.05
Robert Earl,Paperback,1489.0,The Corrupted (Warhammer Fantasy Roleplay),252.0,Games Workshop(uk),2006-10-10,3.52
Laurence Klavan,Paperback,1490.0,The Family Unit and Other Fantasies,200.0,ChiZine Publications,2014-08-15,3.4
Karen Perkins,Kindle Edition,1491.0,Dead Reckoning: A Caribbean Pirate Adventure,359.0,LionheART Publishing house,2013-10-18,4.0
Enid Blyton,Paperback,1492.0,The Faraway Tree Adventure,160.0,Red Fox,1993-02-27,4.32
Thornton W. Burgess,Paperback,1493.0,The Adventures of Johnny Chuck,96.0,Dover Publications,1995-01-06,4.11
Arthur Conan Doyle,Nook,1494.0,The Adventure of the Mazarin Stone,,New Century Books,2010-11-30,3.52
Gary Paulsen,Paperback,1495.0,Tucket's Home,112.0,Yearling,2002-02-12,4.11
Oliver Jeffers,Hardcover,1496.0,The Hueys in None the Number: A Counting Adventure,32.0,Philomel,2014-07-01,3.77
Terrell Harris Dougan,Hardcover,1497.0,That Went Well: Adventures in Caring for My Sister,224.0,Hyperion,2009-01-06,3.6
John Granger,Paperback,1498.0,The Deathly Hallows Lectures: The Hogwarts Professor Explains the Final Harry Potter Adventure,290.0,Unlocking Press,2008-07-15,4.29
George Bernard Shaw,Paperback,1499.0,The Adventures of the Black Girl in Her Search for God,112.0,Hesperus Press,2007-03-01,3.72
Mary Pope Osborne,Paperback,1500.0,Adventure on the Amazon,80.0,Red Fox,2008-05-01,3.91
Lynette Eason,Paperback,1501.0,Holiday Illusion,218.0,Love Inspired Suspense,2008-11-01,4.15
Lisa Lampanelli,Hardcover,1502.0,"Chocolate, Please: My Adventures in Food, Fat, and Freaks",304.0,It Books,2009-09-15,3.51
R.J. Bronson,Paperback,1503.0,Dandelion Adventure,64.0,Mario Nitti,2014-12-10,4.0
Julian Stockwin,Hardcover,1504.0,Conquest,340.0,Hodder & Stoughton,2011-06-01,4.09
Bradley Trevor Greive,Hardcover,1505.0,Tomorrow: Adventures in an Uncertain World,120.0,Andrews McMeel Publishing,2003-10-01,4.18
E. Catherine Tobler,Paperback,1506.0,Rings of Anubis,349.0,Masque Books,2014-07-22,3.59
Joan Lowery Nixon,Paperback,1507.0,Caught in the Act,160.0,Laurel Leaf,1996-03-03,3.88
Millie Marotta,Paperback,1508.0,Millie Marotta's Animal Kingdom: A Colouring Book Adventure,96.0,Batsford Ltd,2014-08-14,4.28
Arthur Machen,Paperback,1509.0,The White People: A Fantasy Horror,38.0,Createspace,2014-07-12,4.03
John Grant,Hardcover,1510.0,The Encyclopedia of Fantasy and Science Fiction Art Techniques,176.0,Running Press Book Publishers,1996-03-01,3.85
Emma Jay,Kindle Edition,1511.0,Her Island Fantasy,60.0,,,3.9
Fantasy Flight Games,Hardcover,1512.0,Only War Core Rulebook,400.0,Fantasy Flight Games,2012-11-15,3.97
Tsuyoshi Fujitaka,Kindle Edition,1513.0,My Big Sister Lives in a Fantasy World: The World's Strongest Little Brother?!,168.0,J-Novel Club,2016-12-03,3.98
Larry Lefkowitz,Paperback,1514.0,Laughing into the Fourth Dimension: 25 Humorous Fantasy & Science Fiction Stories,138.0,Wayman Publishing,2013-07-01,2.33
Patrick Califia-Rice,Paperback,1515.0,Doing It for Daddy: Short and Sexy Fiction about a Very Forbidden Fantasy,240.0,Alyson Books,1994-12-01,4.01
Marion Zimmer Bradley,Unknown Binding,1516.0,Marion Zimmer Bradley's Fantasy Worlds,342.0,Marion Zimmer Bradley Literary Works Trust,1998-08-26,4.06
K.T. Smith,Mass Market Paperback,1517.0,Fantasies,192.0,HarperPrism,1992-08-28,3.38
Arthur W. Saha,Paperback,1518.0,The Year's Best Fantasy Stories 13,238.0,DAW,1987-11-03,3.36
Keith Deininger,Paperback,1519.0,Meridian Codex Dark Fantasy Compendium: Books 1 & 2,468.0,Meridian Codex,2016-01-06,4.75
Hua Hsu,Hardcover,1520.0,A Floating Chinaman: Fantasy and Failure Across the Pacific,288.0,Harvard University Press,2016-06-07,3.81
Asti Hustvedt,Paperback,1521.0,"The Decadent Reader: Fiction, Fantasy, and Perversion from Fin-de-Siècle France",1104.0,Zone Books,1998-11-01,4.46
Larry Elliott,Paperback,1522.0,Fantasy Island,,Constable & Robinson,2007-05-24,3.61
Daniel M. Ogilvie,Hardcover,1523.0,Fantasies of Flight,258.0,"Oxford University Press, USA",2003-12-01,3.96
E.C. Tubb,Kindle Edition,1524.0,The Science-Fantasy Megapack: 25 Classic Tales from Fantasy Adventures,352.0,Wildside Press,2013-09-09,3.76
Donna  Gallagher,ebook,1525.0,Pippa's Fantasy,106.0,Total-E-Bound Publishing,2013-04-01,4.44
Ellen Datlow,Paperback,1526.0,Demons and Dreams,528.0,Legend,1989-04-13,3.65
Jean Lowe Carlson,Kindle Edition,1527.0,Bloodmark (The Kingsmen Chronicles #2): An Epic Fantasy Adventure,732.0,Jean Lowe Carlson,2017-03-20,4.66
Huw Lewis-Jones,Hardcover,1528.0,Explorers' Sketchbooks: The Art of Discovery & Adventure,320.0,Chronicle Books,2017-03-28,4.4
B.A. Williamson,Paperback,1529.0,The Marvelous Adventures of Gwendolyn Gray,300.0,,,4.07
Jackie Mae,Paperback,1530.0,The Key: A Taylor and Alan Adventure,150.0,Jackie Mae,2014-12-21,4.31
Charles Dickinson,Paperback,1531.0,The Widows' Adventures,400.0,William Morrow Paperbacks,1999-03-09,3.8
Dan Parry,Paperback,1532.0,Moonshot: The Inside Story of Mankind's Greatest Adventure,336.0,Ebury Press,2009-05-07,3.98
Elise Broach,Hardcover,1533.0,The Miniature World of Marvin & James,112.0,Henry Holt and Co. (BYR),2014-02-04,3.65
Nadja Spiegelman,Hardcover,1534.0,Lost in NYC: A Subway Adventure: A TOON Graphic,52.0,TOON Graphics,2015-04-07,4.02
Jon Stephen Fink,Paperback,1535.0,Further Adventures,368.0,Harper Perennial,2009-10-13,3.4
Stanislav Grof,Paperback,1536.0,When the Impossible Happens: Adventures in Non-ordinary Realities,360.0,Sounds True,2006-06-01,3.96
Julian Smith,Paperback,1537.0,Crossing the Heart of Africa: An Odyssey of Love and Adventure,344.0,Harper Perennial,2010-12-07,3.61
David Lynn Golemon,Audible Audio,1538.0,Event,16.0,Recorded Books,2013-04-10,3.87
Carolyn Jourdan,Kindle Edition,1539.0,The School for Mysteries: A Paranormal Adventure,209.0,Athenaeus Media,2014-04-28,3.31
Jeremy Robinson,Paperback,1540.0,Empire,366.0,Breakneck Media,2016-04-01,4.38
David N. Sebastian,Paperback,1541.0,The Dragon Sorceress,246.0,,,3.54
L. Frank Baum,Nook,1542.0,"Dorothy and the wizard in Oz; a faithful record of their amazing adventures in an underground world, and how with the aid of their friends Zeb Hugson, Eureka the Kitten, and Jim the Cab-Horse, they finally reached the wonderful Land of Oz",0.0,Chicago : Reilly & Lee,,3.78
Darlene N. Bocek,Paperback,1543.0,Trunk of Scrolls: A Family Adventure,331.0,Entrust Source Publishers,2016-10-13,4.53
Kelley Townley,Paperback,1544.0,"The Adventures of Prince Camar and Princess Badoura (Arabian Nights Adventures, #1)",136.0,Harpendore,2016-02-22,4.67
Arnold Bennett,Paperback,1545.0,The Card: A Story of Adventure in the Five Towns,224.0,Penguin Classics,1991-10-01,3.82
Hidenori Kusaka,Paperback,1546.0,"Pokémon Adventures, Vol. 15: Ruby & Sapphire",144.0,VIZ Media - Children's,2013-03-05,4.3
Tracy Hickman,Hardcover,1547.0,Dragonlance: Adventures,128.0,TSR,1987-12-01,4.05
Jim Bambra,Mass Market Paperback,1548.0,Dead of Night,,,,3.48
Edgar Rice Burroughs,Kindle Edition,1549.0,At the Earth's Core/Pellucidar,306.0,,,3.76
Bobby Sharpe,Paperback,1550.0,The Destineers' Journal of Fantasy Nations,152.0,Lulu.com,2009-02-19,4.9
Robert Silverberg,Paperback,1551.0,Fantasy: The Best of 2001,424.0,iBooks,2002-06-21,3.38
Daniel Tascona,Kindle Edition,1552.0,Fardoor: A Fantasy Adventure,275.0,,,3.79
Fritz Leiber,Hardcover,1553.0,"The Big Time by Fritz Leiber, Science Fiction, Fantasy",134.0,Aegypan,2011-06-01,3.27
Thomas Hunter Dillon,Paperback,1554.0,"FANtasies (FANtasies, #1)",,,,0.0
Winston K. Marks,Hardcover,1555.0,"Breeder Reaction by Winston Marks, Science Fiction, Fantasy",24.0,Aegypan,2011-08-01,3.31
Nikki Palmer,Kindle Edition,1556.0,Emily's Fantasies,,,,4.42
José Zorrilla,Paperback,1557.0,Don Juan Tenorio: A Religious-Fantasy Drama in Two Parts,206.0,Juan de La Cuesta-Hispanic Monographs,2012-08-01,3.65
John Crowley,Kindle Edition,1558.0,Aegypt,443.0,Gateway,2013-10-10,3.84
Avril Ashton,ebook,1559.0,Until the Sunset,,Evernight Publishing,2014-05-14,3.65
Paul       Mason,Paperback,1560.0,The Crimson Tide,224.0,Puffin,1992-01-30,3.17
Harvey Cox,Hardcover,1561.0,The Feast of Fools: A Theological Essay on Festivity and Fantasy,204.0,"Harvard University Press (Cambridge, MA)",1969-01-01,4.08
H. Rider Haggard,Paperback,1562.0,The People of the Mist: A Classic Lost Race Fantasy Novel,208.0,Createspace Independent Publishing Platform,2015-10-27,3.78
Shoshanna Evers,Paperback,1563.0,"Dominatrix Fantasy Trilogy Set: Spanked, Denied & Collared",116.0,Createspace,2012-03-12,3.82
Leila Bryce Sin,,1564.0,Elfmoon,,,,3.96
Charles L. Adler,Hardcover,1565.0,"Wizards, Aliens, and Starships: Physics and Math in Fantasy and Science Fiction",378.0,Princeton University Press,2014-02-02,3.87
Charlie Richards,ebook,1566.0,Gustav's Gargoyle Adventure,137.0,Extasy Books,2012-11-01,3.94
Herman Melville,Nook,1567.0,Billy Budd,100.0,Adventure Classics,2010-12-18,3.1
Enid Blyton,Hardcover,1568.0,The Family at Red-Roofs (Mystery & Adventure),256.0,Award Publications Ltd,1999-08-01,4.13
Deepak Chopra,Paperback,1569.0,The Daughters of Joy: An Adventure of the Heart,256.0,NAL,2003-09-02,3.52
Robert Twigger,Hardcover,1570.0,White Mountain: A Cultural Adventure Through the Himalayas,480.0,Pegasus Books,2017-10-03,3.86
Gary Paulsen,Paperback,1571.0,Call Me Francis Tucket,112.0,Yearling,1996-10-01,4.09
Richard Halliburton,Paperback,1572.0,The Glorious Adventure,360.0,The Long Riders' Guild Press,2002-01-29,4.29
Mike    Scott,Hardcover,1573.0,Adventures of a Waterboy,272.0,Lilliput Press,2012-06-06,4.28
Philip Pullman,Hardcover,1574.0,The Adventures of John Blake: Mystery of the Ghost Ship,160.0,Scholastic/Graphix,2017-06-01,3.64
Matt Bronleewe,Kindle Edition,1575.0,Illuminated,,,,3.42
Bill Peet,Paperback,1576.0,Hubert's Hair Raising Adventure,40.0,HMH Books for Young Readers,1979-09-19,4.23
Nicholas Christopher,Hardcover,1577.0,The True Adventures of Nicolo Zen,288.0,Knopf Books for Young Readers,2014-01-07,3.49
Katja Vartiainen,Paperback,1578.0,Elves & the Agro Adventure,104.0,Amazon,2016-11-21,3.6
Mini Grey,Hardcover,1579.0,The Adventures of the Dish and the Spoon,32.0,Alfred A. Knopf,2006-08-08,3.53
Dean Koontz,Hardcover,1580.0,Robot Santa: The Further Adventures of Santa's Twin,72.0,HarperCollins Publishers,2004-10-01,4.04
Richard T.  Ryan,Hardcover,1581.0,The Stone of Destiny: A Sherlock Holmes Adventure,,MX Publishing,2017-06-05,4.73
Sam McBratney,Hardcover,1582.0,The Adventures of Little Nutbrown Hare,72.0,Candlewick,2012-08-28,3.91
Martin W. Sandler,Hardcover,1583.0,The Impossible Rescue: The True Story of an Amazing Arctic Adventure,164.0,Candlewick,2012-09-11,3.76
David Soman,Hardcover,1584.0,The Amazing Adventures of Bumblebee Boy,40.0,Dial Books,2011-10-04,3.85
Mercy Celeste,Kindle Edition,1585.0,Match Day,193.0,MJC Press,2017-08-14,3.49
McKenna Chase,Kindle Edition,1586.0,Caribbean Fantasy,41.0,McKenna Chase,2011-09-12,3.35
K. Elliott,Kindle Edition,1587.0,Fantasy II,,,,4.4
L. Rosario,Paperback,1588.0,Captive Fantasy,267.0,The Wild Rose Press,2007-11-21,3.78
Mike  Simpson,Paperback,1589.0,The Taste of Life: A Biblical Fantasy,72.0,CrossBooks Publishing,2011-08-22,2.6
Richard Huijing,Paperback,1590.0,The Dedalus Book of Dutch Fantasy,400.0,Dedalus,1994-11-01,4.29
Robert P. Mills,Paperback,1591.0,A Decade of Fantasy and Science Fiction,,Dell Books,1962-01-01,3.56
André Nusselder,Paperback,1592.0,Interface Fantasy: A Lacanian Cyborg Ontology,170.0,Mit Press,2009-09-11,3.67
Gordon Van Gelder,Kindle Edition,1593.0,"The Magazine of Fantasy & Science Fiction, March/April 2015",,"Spilogale, Inc.",2015-02-27,4.03
Jonathan Strahan,Paperback,1594.0,The Best Science Fiction and Fantasy of the Year: Volume Eleven,500.0,Solaris,2017-04-18,3.88
Peter Darvill-Evans,Paperback,1595.0,Beneath Nightmare Castle,256.0,Puffin Books,1987-02-26,3.58
Anya Summers,Kindle Edition,1596.0,"Love Me, Master Me",146.0,Blushing Books Publications,2016-09-14,4.59
Ian Livingstone,Paperback,1597.0,Return to Firetop Mountain,208.0,Wizard Books,2003-11-06,3.63
Laura Guevara,ebook,1598.0,Fantasies,56.0,"Shara Azod, LLC",2010-09-01,4.0
"SFX, Fantasy",Paperback,1599.0,Warrior Girl,128.0,Lulu.com,2006-09-12,3.5
Myke Cole,Paperback,1600.0,Gemini Cell (Reawakening Trilogy 1): A gripping military fantasy of battle and bloodshed,416.0,Headline,2015-02-12,3.69
Lucia Jordan,Kindle Edition,1601.0,Intimate Fantasy Book One & Two: Special Edition,81.0,,,3.64
M.K. Mancos,Paperback,1603.0,Tickle My Fantasy,288.0,Samhain Publishing,2009-12-01,3.84
Cassandra Gold,ebook,1604.0,Fantasies: Strings Attached,121.0,Loose Id LLC,2013-11-01,3.7
Julian Stockwin,Hardcover,1605.0,Victory,320.0,McBooks Press,2010-10-01,4.18
Sam Ferguson,Kindle Edition,1606.0,Jonathan Haymaker,242.0,Dragon Scale Publishing,2015-12-25,4.04
Hidenori Kusaka,Paperback,1607.0,"Pokémon Adventures: Diamond and Pearl/Platinum, Vol. 8",192.0,VIZ Media - Children's,2013-06-04,4.45
Mark  Cartwright,ebook,1608.0,The Adventures of Blizzard,,Authorhouse,2015-06-25,3.67
Marc Brown,Paperback,1609.0,Arthur's First Sleepover (Arthur Adventure Series),32.0,"L,B Kids",2005-09-07,4.12
Rick Reilly,Hardcover,1610.0,Hate Mail from Cheerleaders: And Other Adventures from the Life of Reilly,320.0,Sports Illustrated Books,2007-05-01,3.86
Hergé,Hardcover,1611.0,"The Adventures of Tintin, Vol. 1: Tintin in the Land of the Soviets / Tintin in the Congo",206.0,Egmont Books (UK),2007-02-01,3.88
Erin Hunter,Hardcover,1612.0,Warrior Cats - Special Adventure 3 - Blausterns Prophezeiung,551.0,Beltz & Gelberg,2013-09-09,4.56
Joseph W. Svec III,Paperback,1613.0,Sherlock Holmes and the Adventure of Grinning Cat,156.0,MX Publishing,2015-12-14,3.89
Leslie Carroll,Paperback,1614.0,Royal Affairs: A Lusty Romp Through the Extramarital Adventures That Rocked the British Monarchy,447.0,Berkley Books,2008-06-03,3.84
Brian Wainwright,Paperback,1615.0,The Adventures of Alianore Audley,212.0,Bewrite Books,2005-02-01,4.06
David Denby,Paperback,1616.0,"Great Books: My Adventures with Homer, Rousseau, Woolf, and Other Indestructible Writers of the Western World",496.0,Simon & Schuster,1997-09-25,3.84
Deborah Diesen,Kindle Edition,1617.0,The Pout-Pout Fish,32.0,"Farrar, Straus and Giroux (BYR)",2008-03-18,4.29
Rhoda Blumberg,Paperback,1618.0,Shipwrecked!: The True Adventures of a Japanese Boy,80.0,HarperCollins,2003-01-07,3.9
Mary Devlin Lynch,Paperback,1619.0,The Quilt Ripper,190.0,devlinsbooks,2016-01-10,4.01
Janice Macleod,Hardcover,1620.0,A Paris Year: My Day-to-Day Adventures in the Most Romantic City in the World,272.0,St. Martin's Press,2017-07-10,4.17
Brian K. Vaughan,Paperback,1621.0,The Amazing Adventures of the Escapist: Volume 2,152.0,Dark Horse Comics,2004-12-07,3.49
Arthur Conan Doyle,Audiobook,1622.0,The Adventure of the Solitary Cyclist,0.0,DH Audio,1997-10-01,3.73
Theodore R. Cogswell,Mass Market Paperback,1623.0,"Spock, Messiah!",182.0,Bantam,1993-09-01,3.19
Don Richardson,Paperback,1624.0,Peace Child: International Adventures,233.0,YWAM Publishing,2004-01-01,4.32
Poul Anderson,Paperback,1625.0,Three Hearts and Three Lions,167.0,,,3.9
Ayn Cates Sullivan,Kindle Edition,1626.0,A Story of Becoming: An Inspiring Fantasy fable,52.0,"Infinite Light Publishing, LLC",2015-12-31,4.26
Peter Hindley,Paperback,1627.0,The Perfect Crime: A Story of Truth or Fantasy,293.0,RoseDog Books,2011-10-05,3.5
Isaac Asimov,Paperback,1628.0,Giants,351.0,Roc,1985-11-05,3.87
Sarah A. Hoyt,Paperback,1629.0,All Night Awake,368.0,Ace,2003-10-28,3.19
R. Danielle Egan,Paperback,1630.0,Flesh for Fantasy: Producing and Consuming Exotic Dance,272.0,Seal Press,2005-12-21,3.98
Connie Willis,Paperback,1631.0,Nebula Awards 33: The year's best SF and fantasy chosen by the Science-fiction and Fantasy Writers of America,288.0,Mariner Books,1999-04-29,3.64
Cassandre Dayne,ebook,1632.0,Forced Fantasies,,Naughty Nights Press,2011-12-01,4.05
Jamie Denton,Paperback,1633.0,Valentine Fantasy,218.0,Harlequin,2005-02-01,3.65
Fantasy Flight Games,Hardcover,1634.0,Dragonstar: Starfarers Handbook,176.0,Fantasy Flight Games,2002-01-22,3.97
Robert C. O'Brien,Library Binding,1635.0,The Silver Crown (Aladdin Fantasy),322.0,,,3.94
Piper Denna,Kindle Edition,1636.0,Victoria's Secret Wish,205.0,Piper Denna,2014-04-02,4.07
Katica Locke,ebook,1637.0,The Vampire Next Door,62.0,Shadowfire Press LLC,2010-02-05,3.2
Laura Harner,ebook,1638.0,Whisper Taboo,169.0,Hot Corner Press,2013-01-08,3.46
Tee Morris,Paperback,1639.0,The Complete Guide to Writing Fantasy: The Opus Magnus,296.0,Dragon Moon Press,2003-09-01,4.04
Piers Anthony,Paperback,1640.0,The Magic of Xanth: An Enchanting Fantasy Trilogy,0.0,Ballantine Books (Mm),1987-08-01,4.05
Jessica Leake,Kindle Edition,1641.0,Arcana: A Historical Fantasy,268.0,Talos,2016-01-05,3.75
Anthony Beal,ebook,1642.0,The Escapists: An Erotic Fantasy Novel,,Hexed Flesh Books,2012-04-29,4.17
Ann Vremont,ebook,1643.0,Fantasy Curves 269,,Saturn 8 Media,2012-11-07,3.48
Isaac Asimov,Hardcover,1644.0,Visions of Fantasy: Tales from the Masters,180.0,Doubleday Books for Young Readers,1989-09-01,3.43
Rebecca Otowa,Hardcover,1645.0,My Awesome Japan Adventure,48.0,Tuttle Publishing,2013-11-05,3.97
Cheryl Alters Jamison,Hardcover,1646.0,Around the World in 80 Dinners: The Ultimate Culinary Adventure,272.0,William Morrow,2008-03-11,2.79
