Author,Format,ID,Name,Pages,Publisher,Publishing_Date,Rating
Gregory M. Juzwick,Hardcover,3369.0,Rising from the Ashes: Guardians of the Hidden Lair,236.0,Outskirts Press,2012-3-26,5.0
RJ Baker,Paperback,3370.0,King of Assassins (The Wounded Kingdom),416.0,Orbit,2018-8-7,
Beth Schluter,Hardcover,3371.0,The Voyage: The Robot Army Trilogy: Part 2 (Volume 2),270.0,W & B Publishers Inc.,2015-5-12,
Richard Warren Strong,Hardcover,3372.0,A year in the shoes of Lepton Kwaark,352.0,CreateSpace Independent Publishing Platform,2014-10-7,
R M Garcia,Paperback,3373.0,The Vampir Manual of the Reich (The Foundlings) (Volume 2),30.0,CreateSpace Independent Publishing Platform,2011-8-24,3.5
Joy Drinkwater,Hardcover,3374.0,The Table,114.0,"iUniverse, Inc.",2004-12-9,
Barry Hoffman,Kindle,3375.0,The Elfowl Saga: Part III:The Stones of Gralich,354.0,iUniverse,2002-10-16,
David Falash,Hardcover,3376.0,Dangerous Duty,246.0,Black Leaf Publishing,2013-10-9,5.0
Simone Chiodini,Paperback,3377.0,Infinite Power Defied,282.0,Outskirts Press,2015-3-12,2.0
Snorri Kristijansson,Hardcover,3378.0,Swords of Good Men (The Valhalla Saga),352.0,Jo Fletcher Books,2015-1-6,3.7
Valerie Michaels,Kindle,3379.0,Captive,,"Toplink Publishing, LLC",2017-8-14,4.5
Julius C. Johnson,Hardcover,3380.0,Knight of the Burning Blade: The Hounds of Hell,346.0,Outskirts Press,2011-5-19,5.0
Derek Gunn,Hardcover,3381.0,Vampire Apocalypse: A World Torn Asunder,216.0,KHP Publishers,2006-9-1,3.6
LC Luca Calzetta,Paperback,3382.0,L'alba di una nuova era: La leggenda dell'Angelo Azzurro (Italian Edition),228.0,Independently published,2017-12-5,
Sgt. Wayne Anthony Pope,Kindle,3383.0,Earth Invasion,176.0,iUniverse,2015-6-20,
Valarie Mechling,Hardcover,3384.0,The Scourge of Narak (Tales of the Seventh Empire),386.0,"inquisitiveDesign, LLC",2013-11-1,
Robert Midgett,Kindle,3385.0,Vagabonds,164.0,Same Old Story Productions,2013-9-12,5.0
Philip McCutchan,Hardcover,3386.0,Captain at Arms (Camden),426.0,Chivers,1999-6-1,
Vanilla Orchid Books,Kindle Edition,0.0,Brides of Fantasy,,,,0.0
Caleb Carr,Paperback,1.0,The Italian Secretary: A Further Adventure Of Sherlock Holmes,288.0,Sphere,2015-11-27,3.19
Ludwig Bemelmans,Paperback,2.0,When You Lunch with the Emperor: The Adventures of Ludwig Bemelmans,320.0,Overlook Books,2006-09-26,3.86
C. Alexander London,Paperback,3.0,We Dine With Cannibals,384.0,Puffin Books,2013-01-03,4.19
Jane Coxwell,Hardcover,4.0,Fresh Happy Tasty: An Adventure in 100 Recipes,320.0,William Morrow Cookbooks,2013-05-14,3.7
Brian Pinkney,Paperback,5.0,The Adventures of Sparrowboy,40.0,Aladdin Paperbacks,2000-07-01,3.64
Leslie Johansen Nack,Paperback,6.0,"Fourteen: A Daughter's Memoir of Adventure, Sailing, and Survival",300.0,She Writes Press,2015-10-20,4.25
Jules Verne,Paperback,7.0,Claudius Bombarnac: The Adventures of a Special Correspondent,180.0,Tark Classic Fiction,2008-05-01,3.45
Brandon Sanderson,Paperback,8.0,Mistborn Adventure Game,573.0,Crafty Games,2012-07-01,4.09
Tracy Ellen,Paperback,9.0,Family & Fortune,224.0,Tracy Ellen INK,2015-07-02,4.45
Rifka Kreiter,Paperback,10.0,Home Free: Adventures of a Child of the Sixties,280.0,She Writes Press,2017-05-16,3.89
John Burningham,Hardcover,11.0,Borka: The Adventures of a Goose with no Feathers,32.0,Random Century,1992-11-27,3.89
Katie Van Camp,Hardcover,12.0,CookieBot!: A Harry and Horsie Adventure,36.0,Balzer + Bray,2011-05-31,3.76
Mark Twain,Kindle Edition,13.0,"The Adventures of Tom Sawyer, Part 2.",35.0,,,3.96
Chris Heimerdinger,,14.0,"The Feathered Serpent, Part 2",,,,4.15
Tim Grove,Paperback,15.0,A Grizzly in the Mail and Other Adventures in American History,256.0,University of Nebraska Press,2014-05-01,3.62
S.G. Rogers,ebook,16.0,The Druid,67.0,Musa Publishing,2012-04-20,4.36
Loren D. Estleman,Paperback,17.0,The Further Adventures of Sherlock Holmes: Sherlock Holmes vs. Dracula,224.0,Titan Books,2012-11-06,3.92
Julie Kenner,Paperback,18.0,Pax Demonica,258.0,Julie Kenner,2014-05-13,3.86
Hirohiko Araki,Hardcover,19.0,"JoJo's Bizarre Adventure: Part 1—Phantom Blood, Vol. 2",319.0,VIZ Media,2015-05-05,4.19
Aaron Shepard,Kindle Edition,20.0,"The Magic Flyswatter: A Superhero Tale of Africa, Retold from the Mwindo Epic",35.0,Skyhook Press,2017-03-31,3.28
Marion Zimmer Bradley,Kindle Edition,21.0,"Le Talisman écarlate (Le Cycle du Trillium, tome 2)",573.0,Le Livre de Poche,2013-03-01,3.54
Fritz Leiber,Paperback,22.0,"Gather, Darkness! (Nucleus Fantasy & Science Fiction)",240.0,Collier Books,1992-12-01,3.64
Nancy Friday,Mass Market Paperback,23.0,Men in Love: Men's Sexual Fantasies: The Triumph of Love Over Rage,544.0,Dell,1982-12-15,3.7
Fay Sampson,Paperback,24.0,Finnglas and the Stones of Choosing,176.0,Lion Hudson,2003-03-01,3.84
Bella Bentley,Kindle Edition,25.0,McKenzie's Fantasy,31.0,FireFly Lights,2012-10-25,3.52
Trish F. Leger,Kindle Edition,27.0,Her Druid Fantasy,280.0,Self Published,2014-06-24,4.33
Jennifer L. Miller,Paperback,28.0,Ladies and Gentlemen of Fantasy 2014,430.0,LG Anthologies,2014-07-08,4.25
Creative Hon,Paperback,29.0,"Last Fantasy, Volume 2",168.0,TokyoPop,2006-07-11,4.3
Laura Elrick,Paperback,30.0,Fantasies in Permeable Structures,74.0,Factory School,2005-01-01,4.5
Evangeline Walton,Board book,31.0,Prince of Annwn,192.0,Scribner Paper Fiction,1992-02-04,3.85
E.E. Knight,Kindle Edition,32.0,"Le Destin du dragon: L'Âge du feu, T6",372.0,Milady,2013-02-01,3.77
Jane Yolen,Hardcover,33.0,Dragons & Dreams: A Collection of New Fantasy and Science Fiction Stories,180.0,HarperCollins Publishers,1986-04-01,3.71
Aimee Easterling,Kindle Edition,34.0,Beyond Secret Worlds: Ten Stories of Paranormal Fantasy and Romance,256.0,Bestselling Boxed Sets,2015-12-01,3.95
Harry Connolly,Kindle Edition,35.0,Bad Little Girls Die Horrible Deaths and Other Tales of Dark Fantasy,153.0,Radar Ave Press,2014-07-02,3.86
Sabine Lippert,Hardcover,36.0,Sabine Lippert's Beaded Fantasies: 30 Romantic Jewelry Projects,144.0,Lark Crafts,2012-05-01,4.48
Dawn Atkins,ebook,37.0,Forbidden Fantasies Bundle (Includes: Forbidden Fantasies #1-3) (Harlequin Blaze),768.0,Harlequin,2006-06-01,4.0
Theresa Troutman,,38.0,London Loves,,,,4.54
Jay Hosler,Hardcover,39.0,The Sandwalk Adventures: An Adventure in Evolution in Five Chapters,159.0,Active Synapse,2003-12-01,4.08
R.A. Montgomery,Paperback,40.0,The Lost Jewels of Nabooti,131.0,Chooseco,2006-05-01,3.38
MaryJanice Davidson,Paperback,41.0,Adventures of the Teen Furies,183.0,Hard Shell Word Factory,2001-07-01,3.36
Harold Taw,Paperback,42.0,Adventures of the Karaoke King,538.0,AmazonEncore,2011-05-17,2.75
Craig Stephen Copland,Paperback,43.0,Sherlock Holmes Never Dies: Six New Adventures of the World's Greatest Detective,688.0,iUniverse,2015-08-20,3.65
John Shirley,Mass Market Paperback,44.0,Untold Adventures,376.0,Wizards of the Coast,2011-06-07,3.43
Annie  Wood,Paperback,45.0,Just a Theory: A Quantum Love Adventure,136.0,Knock on Wood Productions,2014-12-26,4.5
Sharon Lee,ebook,46.0,Misfits,,Baen (sponsoring SRM Publisher),2008-06-01,4.38
Joshua Glenn,Paperback,47.0,Unbored Adventure: Serious Fun for Everyone,176.0,Bloomsbury USA,2015-10-06,4.4
Tim Flannery,Paperback,48.0,The Explorers: Stories of Discovery and Adventure from the Australian Frontier,400.0,Grove Press,2000-09-11,3.66
David  Howard,Hardcover,49.0,Chasing Phil: The Adventures of Two Undercover Agents with the World's Most Charming Con Man,371.0,Crown Publishing Group (NY),2017-10-10,3.94
Natasha Allegri,Paperback,50.0,Adventure Time With Fionna and Cake #6,,Boom! Studios,2013-07-03,4.44
Richard Branson,Hardcover,51.0,The Adventure of Business,352.0,Virgin Books,2010-08-16,3.8
Art Baltazar,Paperback,52.0,"Tiny Titans, Volume 2: Adventures in Awesomeness",144.0,DC Comics,2009-05-26,4.14
Fred Tribuzzo,Paperback,53.0,American Sky: Good Landings and Other Flying Adventures,272.0,Koehler Books,2014-04-15,4.36
Shannon  Jones,Hardcover,54.0,"KeeKee's Big Adventures in Amsterdam, Netherlands",40.0,Calithumpian Press,2016-10-11,4.61
V.A. Boeholt,Paperback,55.0,The Ship Captain's Tale: A Counting Adventure,40.0,Little Five Star,2015-05-19,5.0
Young-Hee Kim,Paperback,56.0,Evyione: Ocean Fantasy Volume 9,,Udon,,4.39
Hollie Hutchins,Kindle Edition,57.0,Her Darkest Fantasies: The Dragon’s Heart,538.0,,,4.0
Arthur W. Saha,Paperback,58.0,The Year's Best Fantasy Stories 7,192.0,DAW,1981-10-06,3.3
Robert H.  Boyer,Mass Market Paperback,59.0,The Phoenix Tree: An Anthology Of Myth Fantasy,279.0,Avon Books,1980-09-01,3.95
Erica Lynn,Kindle Edition,60.0,Desiring Lacey,182.0,Self Published,2017-05-03,4.59
Cleo Peitsche,Nook,61.0,Wide Awake,,Pouch Productions,2013-05-24,4.0
James Branch Cabell,Audible Audio,62.0,Jurgen: A Landmark Fantasy Novel,,Neil Gaiman Presents,2012-09-25,3.94
M.R. James,Paperback,63.0,The Haunted Dolls' House,24.0,Fantasy and Horror Classics,2013-05-13,4.25
Fantasy Flight Games,Hardcover,64.0,Dark Heresy: The Church of the Damned: Roleplaying in the Grim Darkness of the 41st Millennium,69.0,Fantasy Flight Games,2011-12-27,3.1
Jacky Gray,Kindle Edition,65.0,Archer: A Swashbuckling Medieval Fantasy Romance,176.0,,,3.94
Isaac Asimov,Paperback,66.0,"Mythical Beasts: Isaac Asimov's Magical Worlds of Fantasy, Vol. 6",343.0,Roc,1986-05-06,3.66
Al Sarrantonio,Paperback,67.0,"Flights: Extreme Visions Fantasy, Vol II",432.0,Roc,2006-04-04,3.61
Dawn M. Schiller,Paperback,68.0,Faemaker: Making Fantasy Characters in Polymer Clay,127.0,Impact,2012-08-09,4.42
Nigel Edwards,Kindle Edition,69.0,Waif (A fantasy short story from Greyhart Press),23.0,,,2.81
Anna Kyss,Kindle Edition,70.0,Winter Escapes (Young Adult Fantasy Ebook Sampler),,Winter Escapes,2012-12-03,4.45
Linda S. Kauffman,Paperback,71.0,Bad Girls and Sick Boys: Fantasies in Contemporary Art and Culture,324.0,University of California Press,1998-10-01,4.04
Tom Kidd,Hardcover,72.0,"Otherworlds: How to Imagine, Paint and Create Epic Scenes of Fantasy",192.0,Impact,2010-11-08,4.53
Orson Scott Card,Audio Cassette,73.0,"Best Fantasy Value Collection, 3 (Fantasy Library)",,Dercum Audio,1997-11-01,0.0
Mary  Stewart,Hardcover,74.0,A Walk in Wolf Wood: A Tale of Fantasy and Magic,148.0,William Morrow & Company,1984-04-01,3.78
Liz Maverick,Paperback,75.0,Adventures of an Ice Princess,272.0,NAL Trade,2004-10-05,2.55
Jess Erin,Paperback,76.0,"Wrapped Up in Lies (The Adventures of Ms. Fortune, #1)",326.0,Createspace Independent Publishing Platform,2015-11-21,4.14
Ansha Kotyk,Paperback,77.0,Gangsterland (Ink Portal Adventure #1),175.0,Busstop Press,2012-11-15,4.19
Adam Graham,Paperback,78.0,Powerhouse: Hard Pressed,226.0,Create Space,2013-06-01,4.14
Zach Weinersmith,Paperback,79.0,Trial of the Clone: An Interactive Adventure!,282.0,Breadpig,2012-10-09,3.48
Isabella L. Bird,Paperback,80.0,Adventures in the Rocky Mountains,128.0,Penguin Books,2007-09-25,3.82
George Kennan,Paperback,81.0,"Tent Life in Siberia: An Incredible Account of Siberian Adventure, Travel, and Survival",448.0,Skyhorse Publishing,2007-03-17,4.1
Jeff Grubb,Hardcover,82.0,Forgotten Realms: Adventures,210.0,TSR,1990-04-01,3.83
Inhae Lee,Hardcover,83.0,My Milk Toof: The Adventures of ickle and Lardee,176.0,Chronicle Books,2011-03-23,4.42
W. Haden Blackman,Paperback,84.0,"Star Wars: Clone Wars Adventures, Vol. 1",96.0,Dark Horse Books,2004-07-20,3.75
Brian  Doyle,Hardcover,85.0,The Adventures of John Carson in Several Quarters of the World: A Novel of Robert Louis Stevenson,229.0,Thomas Dunne Books,2017-03-28,3.93
Liz Pichon,Kindle Edition,86.0,Tom Gates 13: Epic Adventure (kind of),256.0,Scholastic Fiction,2017-10-05,4.65
Barbara Smucker,Paperback,87.0,Amish Adventure,,Puffin,1984-08-07,3.48
Erin Brady,,88.0,And The Winner Is (The Adventures of Marty Peters),,,,3.56
Ted Botha,Paperback,89.0,Mongo: Adventures in Trash,256.0,Bloomsbury USA,2005-06-06,3.86
Julian Stockwin,Hardcover,90.0,The Privateer's Revenge,324.0,McBooks Press,2008-10-01,4.1
Sam Siciliano,Paperback,91.0,The Further Adventures of Sherlock Holmes: The Web Weaver,394.0,Titan Books,2012-01-10,3.74
Alec Cedric Xander,Kindle Edition,92.0,Fantasy,210.0,X-Scandal Books,2014-05-22,5.0
Jacqueline Furby,Paperback,93.0,Fantasy,185.0,Routledge,2011-10-13,3.2
Kyle Stone,Paperback,95.0,MENagerie: Stories Of Passion And Dark Fantasy,168.0,Baskerville Books,2000-08-01,3.25
Russ Thorne,Hardcover,96.0,"Zombies: Fantasy Art, Fiction & the Movies",128.0,Flame Tree Publishing,2013-11-15,3.83
Steven L. Kent,Hardcover,98.0,The Making of Final Fantasy: The Spirits Within,240.0,Brady Games,2001-08-02,3.93
Jan Messent,Paperback,99.0,Jan Messent's Knit a Fantasy Story,96.0,Search Press,2006-08-01,3.75
Ashley Horn,Kindle Edition,100.0,Beyond the Pillars: An Anthology of Pagan Fantasy,320.0,Bibliotheca Alexandrina,2013-10-02,4.33
Janice Maynard,Kindle Edition,101.0,Suite Revenge (Suite Fantasy),89.0,Cool Gus Publishing,2013-11-23,3.5
Horace Ponii,ebook,102.0,Horses and Farms For Fantasy Writers,,Smashwords,2012-06-18,5.0
Sarah Scheele,,103.0,Facets of Fantasy: A Collection,360.0,CreateSpace,2016-02-05,4.36
Ming-Ju Sun,Paperback,105.0,Flower Fashion Fantasies,64.0,Dover Publications,2012-11-21,3.94
Anonymous,Paperback,106.0,Japanese Tales from Times Past: Stories of Fantasy and Folklore from the Konjaku Monogatari Shu,288.0,Tuttle Publishing,2015-08-04,4.1
Karen Brueggeman,Kindle Edition,107.0,Fruzzle's Mystery Talent: A Bed Time Fantasy Story for Children ages 3-10,48.0,Dolphins Publishing and Karen Brueggeman,2013-11-18,4.49
Isaac Asimov,Mass Market Paperback,108.0,Cosmic Knights: Isaac Asimov's Magical Worlds of Fantasy 3,339.0,Signet,1985-01-01,3.55
Keith Baker,Hardcover,109.0,Sharn: City of Towers,192.0,Wizards of the Coast,2004-11-12,3.88
Jim Pavelec,Paperback,110.0,Hell Beasts: How to Draw Grotesque Fantasy Creatures,128.0,Impact,2007-07-06,3.64
Laurie Hyman,Paperback,111.0,Sweet Tales: The Adventures of Miss Jade & Britt the Kit,77.0,Red Sky Presents,2014-12-01,4.33
Clive Cussler,Paperback,112.0,Lost City: a Novel from the Numa Files,658.0,Paragon,,3.88
Barney Hoskyns,Paperback,113.0,"Hotel California: The True-Life Adventures of Crosby, Stills, Nash, Young, Mitchell, Taylor, Browne, Ronstadt, Geffen, the Eagles, and Their Many Friends",324.0,Wiley (TP),2006-06-01,3.8
Laura Joh Rowland,Hardcover,114.0,Bedlam,352.0,The Overlook Press,2010-05-13,3.27
Arthur Conan Doyle,Audio CD,115.0,The Complete Adventures of Sherlock Holmes,9.0,In Audio,2005-09-01,4.38
Arthur Conan Doyle,Audio Cassette,116.0,The Adventure of the Three Gables,0.0,DH Audio,1998-07-01,3.42
C.E.  Johnson,Kindle Edition,117.0,Redstone,,Clan Publishing,2016-05-06,4.57
Paolo Hewitt,Paperback,118.0,Getting High: The Adventures of Oasis,416.0,Hyperion,1997-04-01,4.06
Edgar Rice Burroughs,Paperback,119.0,"The Return of Tarzan: The Adventures of Lord Greystoke, Book Two",288.0,Fall River,2011-10-04,3.8
James Oliver Curwood,Hardcover,120.0,The Wolf Hunters (a Tale of Adventure in the Wilderness),,IndyPublish.com,,4.04
Richard A. Lupoff,Paperback,121.0,Edgar Rice Burroughs : Master of Adventure,317.0,Ace Books,1975-01-01,4.02
Arthur Conan Doyle,Paperback,122.0,The Adventure of the Six Napoleons and Other Cases,368.0,Penguin Classics,2014-09-04,4.04
Ralph E. Vaughan,Paperback,123.0,Sherlock Holmes: Cthulhu Mythos Adventures,260.0,Dog in the Night Books,2015-08-01,3.97
Jen Hatmaker,Paperback,124.0,Road Trip: Five Adventures You're Meant To Live,192.0,NavPress,2006-07-12,4.01
Stuart Douglas,Paperback,125.0,The Further Adventures of Sherlock Holmes - The Counterfeit Detective,272.0,Titan Books,2016-10-18,3.98
P.N. Elrod,Mass Market Paperback,126.0,The Adventures of Myhr,385.0,Baen Books,2003-05-20,3.55
Michael Asher,Paperback,127.0,Khartoum: The Ultimate Imperial Adventure,512.0,Penguin,2006-11-02,4.28
V.E. Ulett,Paperback,128.0,Captain Blackwell's Prize,272.0,Old Salt Press,2013-08-16,3.91
Kristi Charish,ebook,129.0,Owl and the Electric Samurai,416.0,Simon & Schuster,2017-05-08,3.95
Joan Aiken,Hardcover,130.0,"The Green Flash and Other Tales of Horror, Suspense, and Fantasy",163.0,"Holt, Rinehart, and Winston",1971-01-01,3.65
Edward L. Ferman,Hardcover,131.0,The Magazine of Fantasy and Science Fiction: A 30-year Retrospective,310.0,Doubleday Books,1980-01-01,3.78
Ellison James,Kindle Edition,132.0,Fantasy League,15.0,,,2.4
Rosie Attwood,Kindle Edition,133.0,Rose's Fantasy,,Clean Christian Western Romance,2016-02-05,4.15
Carl East,Kindle Edition,134.0,Fantasy Inc,82.0,,,2.6
MFR,Paperback,135.0,Forbidden Fantasies,84.0,,,3.75
Aaron Michaels,ebook,136.0,Fantasy Man,21.0,Torquere Books,2010-08-01,3.33
Esmeralda Greene,Kindle Edition,137.0,Teacher Fantasy,,,,3.0
Jill Nojack,Kindle Edition,138.0,Magic Unbound,127.0,IndieHeart Press,2017-11-03,3.74
"SFX, Fantasy",Paperback,139.0,Lost in Another Realm,104.0,Lulu.com,2006-09-13,2.5
"SFX, Fantasy",Paperback,140.0,The Dark Warriors,120.0,Lulu.com,2006-11-27,2.5
R.L. Martinez,Kindle Edition,141.0,In The Blood: A Richly Dark High Fantasy Series Book # 1,374.0,Lakewater Press,2016-03-21,4.28
Tim Lebbon,Kindle Edition,142.0,Dusk: a dark fantasy novel,492.0,Dreaming in Fire,2017-08-17,3.48
Fantasy Flight Games,Hardcover,143.0,Warhammer Fantasy Roleplay: The Creature Guide,112.0,Fantasy Flight Games,2011-01-25,3.86
Fantasy Flight Games,Hardcover,144.0,Rogue Trader: The Koronus Bestiary,144.0,Fantasy Flight Games,2013-01-08,3.88
Fantasy Flight Games,Paperback,145.0,Dragonstar: Imperial Supply,128.0,Fantasy Flight Games,2003-01-28,3.36
Karin Shah,Kindle Edition,146.0,Halfling: A Young Adult Romantic Fantasy,282.0,Soul Mate publishing,2015-04-15,4.18
Rebecca York,Kindle Edition,147.0,White Christmas (A Christmas Fantasy Novella),86.0,Light Street Press,2016-12-01,3.76
Brigid Peppin,Hardcover,148.0,Fantasy: The Golden Age of Fantastic Illustration,191.0,Watson-Guptill,1975-01-01,4.45
Rush Limbaugh,Kindle Edition,149.0,Rush Revere and the Star-Spangled Banner,240.0,Threshold Editions,2015-10-27,4.37
Amanda Adams,Paperback,150.0,Ladies of the Field: Early Women Archaeologists and Their Search for Adventure,240.0,Greystone Books,2010-08-23,3.7
Robyn Peterman,ebook,151.0,Pirate Dave and his Randy Adventures,100.0,Smashwords,2013-05-22,3.44
Arthur Conan Doyle,Kindle Edition,152.0,"Sherlock Holmes: The Ultimate Collection: The Adventures of Sherlock Holmes, Memoirs of Sherlock Holmes, The Return of Sherlock Holmes, AND MORE!",900.0,,,4.51
Josh Elder,Paperback,153.0,Scribblenauts Unmasked: A DC Comics Adventure,208.0,DC Comics,2015-02-17,3.89
Petr Macek,Paperback,154.0,Sherlock Holmes and the Adventure of the Cold-Served Revenge,232.0,MX Publishing,2014-09-17,3.22
R.A. Montgomery,Paperback,155.0,Lost on the Amazon,114.0,Chooseco,2006-08-01,3.48
Cavan Scott,Paperback,156.0,The Escape,96.0,Egmont Books Ltd,2016-02-25,3.31
Gertrude Bell,Paperback,157.0,The Desert and the Sown: The Syrian Adventures of the Female Lawrence of Arabia,368.0,Cooper Square Publishers,2001-11-13,4.03
Sondra Marshak,Mass Market Paperback,158.0,"Star Trek: The New Voyages, 2",252.0,Bantam,1978-01-01,3.47
Edward Packard,Hardcover,159.0,Who Killed Harlowe Thrombey?,122.0,Grey Castle Press,1981-01-01,3.73
Elise Broach,Hardcover,160.0,James to the Rescue,112.0,Henry Holt and Co. (BYR),2015-10-20,3.85
Diane Von Furstenberg,Hardcover,161.0,"Diane: A Signature Life: My Adventures in Fashion, Business, and Life",237.0,Simon & Schuster,1998-11-04,3.72
Merlin Tuttle,Hardcover,162.0,The Secret Lives of Bats: My Adventures with the World's Most Misunderstood Mammals,288.0,Houghton Mifflin Harcourt,2015-10-20,4.33
William Saroyan,,163.0,The Adventures of Wesley Jackson,,,,4.29
Leonard J. Arrington,Hardcover,164.0,Adventures of a Church Historian,272.0,University of Illinois Press,1998-05-01,4.17
C.S. Crook,Paperback,165.0,Johnny's Heroic Adventure,64.0,CreateSpace,2014-08-02,3.5
Sy Montgomery,Hardcover,166.0,"Birdology: Adventures with a Pack of Hens, a Peck of Pigeons, Cantankerous Crows, Fierce Falcons, Hip Hop Parrots, Baby Hummingbirds, and One Murderously Big Living Dinosaur",260.0,Atria Books,2010-04-06,4.11
Paul Richards,Paperback,167.0,Substrata: Open World Dark Fantasy,239.0,Udon Entertainment,2014-07-29,4.75
Sarah Bowles,Kindle Edition,168.0,"Drawing Mentor 14, Fantasy Drawing",54.0,Amazon Digital Services,2012-01-01,3.58
Marc Gascoigne,Paperback,169.0,Allansia,336.0,Puffin Books,1994-07-07,3.62
Diamant,Kindle Edition,170.0,Other Voices: An Urban Fantasy Anthology,220.0,Diamant,2013-07-19,4.0
Nancy Friday,Mass Market Paperback,171.0,Forbidden Flowers: More Women's Sexual Fantasies,336.0,Pocket Books,1991-02-01,3.66
Jonathan Green,Paperback,172.0,Night of the Necromancer,383.0,Wizard Books,2010-03-01,3.54
Cherry Allen,Kindle Edition,173.0,Mona Loves Monsters: A Halloween Gangbang (The Rape Fantasies),14.0,,,3.64
Donald Wandrei,Hardcover,174.0,Don't Dream: The Collected Horror and Fantasy Fiction of Donald Wandrei,394.0,Fedogan & Bremer,1997-08-01,3.33
Susan J. Napier,Paperback,175.0,From Impressionism to Anime: Japan as Fantasy and Fan Cult in the Mind of the West,272.0,Palgrave Macmillan,2007-12-15,3.92
H.P. Lovecraft,ebook,176.0,The Dunwich Horror (Fantasy and Horror Classics),74.0,Fantasy and Horror Classics,2016-03-30,3.84
John Joseph Adams,Kindle Edition,177.0,"Fantasy Magazine, August 2011",,,,3.44
Dicey Grenor,Kindle Edition,178.0,"Best Friends, Fantasy Lovers",197.0,,,4.33
Christopher Cerf,Paperback,179.0,Vintage Anthology of Science Fantasy,0.0,Random House Trade,1966-02-01,4.06
Brander Matthews,Kindle Edition,180.0,Tales of Fantasy and Fact,95.0,,,3.22
Rachel S. William,Kindle Edition,181.0,Her Menage Fantasies,140.0,,,3.29
Colin Manlove,Hardcover,182.0,The Fantasy Literature of England,230.0,Palgrave Macmillan,1999-07-30,3.5
Michael Burns,Paperback,183.0,Digital Fantasy Painting,160.0,Watson-Guptill,2002-10-01,3.88
Mal Sanders,Kindle Edition,184.0,Submissive Wife: Rape Fantasy,33.0,Amazon Digital Services,2012-05-19,3.25
Peter Haining,Paperback,185.0,Knights of Madness: Further Comic Tales of Fantasy,252.0,Souvenir Press,1998-08-27,3.71
Lynda Renham,Kindle Edition,186.0,Coconuts and Wonderbras: A Romantic Comedy Adventure,272.0,Raucous Publishing,2012-06-27,3.95
Jeffrey M. Daniels,Paperback,187.0,What If?,260.0,Booklocker.com,2010-10-20,3.88
Albert Payson Terhune,Kindle Edition,188.0,"LAD A DOG, FURTHER ADVENTURES OF LAD, BUFF: A COLLIE AND OTHER DOG STORIES, BRUCE HIS DOG, BLACK CAESAR'S CLAN: 6 DOG-NOVELS",,Business and Leadership Publishing,2015-05-20,4.24
Dav Pilkey,Kindle Edition,189.0,"Captain Underpants and the Big, Bad Battle of the Bionic Booger Boy Part 2: The Revenge of the Ridiculous Robo-Boogers: The Adventures Of Bionic Booger Boy: Night Of The Nasty Nostril Nuggets Part 2",175.0,Scholastic Paperbacks,2013-05-28,4.18
Dina Marie Filippini,Paperback,190.0,The Adventures of Precious Penny,36.0,Createspace Independent Publishing Platform,2015-02-08,4.75
Giada De Laurentiis,Paperback,191.0,Paris!,144.0,Grosset & Dunlap,2013-09-03,4.05
Karl Dickey,Paperback,192.0,Liri An Adventure Toward Freedom,260.0,Blue Shark Media,2014-08-06,3.0
Deborah   Davis,Hardcover,193.0,The Trip: Andy Warhol's Plastic Fantastic Cross-Country Adventure,336.0,Atria Books,2015-07-28,3.76
Meljean Brook,Kindle Edition,194.0,The Kraken King and the Greatest Adventure,70.0,InterMix,2014-06-03,4.48
Charles Kingsley,,195.0,The Water Babies (Classic Adventures),,,,3.37
Enid Blyton,Audio Cassette,196.0,Five Go Off to Camp,0.0,Chivers Audio Books,1999-07-01,3.92
Natacha Du Pont de Bie,Paperback,197.0,Ant Egg Soup: The Adventures of a Food Tourist in Laos,342.0,Hodder & Stoughton,2005-02-01,3.86
Chrissie Manby,Paperback,198.0,A Proper Family Adventure,384.0,Hodder,2015-07-16,4.2
Virginia L. Kroll,Paperback,199.0,Equal Shmequal,32.0,Charlesbridge Pub Inc,2005-06-01,3.92
Ann McGovern,Paperback,200.0,Shark Lady: True Adventures of Eugenie Clark,96.0,Scholastic Paperbacks,1995-05-01,4.04
David Maule,Paperback,201.0,Three Adventures of Sherlock Holmes,67.0,Pearson Education,2008-10-03,3.76
Theoni Pappas,Paperback,202.0,The Adventures of Penrose the Mathematical Cat,132.0,Wide World Publishing,1997-10-24,4.04
Carlos Prieto,Hardcover,203.0,The Adventures of a Cello,368.0,University of Texas Press,2006-10-01,3.47
Philip K. Dick,Paperback,204.0,"The Defenders by Philip K. Dick, Science Fiction, Fantasy, Adventure",40.0,Aegypan,2011-05-01,3.68
Alan Ryan,Mass Market Paperback,205.0,Haunting Women: Stories of Fear and Fantasy by Women Writers,210.0,Avon Books,,4.0
Wendy Mass,Hardcover,206.0,Ray Bradbury: Master of Science Fiction and Fantasy,104.0,Enslow Publishers,2004-04-01,4.06
Wes Erhlichman,Leather Bound,207.0,Final Fantasy XII Limited Edition Guide,176.0,Bradygames,2006-10-04,4.03
Algernon Blackwood,Paperback,208.0,The Empty Sleeve (Fantasy and Horror Classics),24.0,Fantasy and Horror Classics,2011-04-28,3.81
Rachel Nixx,ebook,209.0,Forcing Corinne,25.0,Rachel Nixx,2012-11-24,3.15
Allen Wheelis,Paperback,210.0,The Illusionless Man: Fantasies and Meditations on Disillusionment,206.0,Other Press (NY),2000-01-17,4.44
Orson Scott Card,Audio Cassette,211.0,"The Best Fantasy Stories of the Year, 1989",,Dercum Audio,1991-06-01,3.67
Rich Horton,Paperback,212.0,Unplugged: The Web's Best Sci-Fi & Fantasy: 2008 Download,295.0,Wyrm Publishing,2009-12-23,3.66
Hazel Heald,Paperback,213.0,The Horror in the Museum,38.0,Fantasy and Horror Classics,2011-04-28,3.97
Phil Foglio,Hardcover,214.0,"Agatha Heterodyne & The Clockwork Princess: A Gaslamp Fantasy With Adventure, Romance & Mad Science",109.0,Airship Entertainment,,4.41
Thomas Hunter Dillon,,215.0,"FANtasies: Volume 2 (FANtasies, #2)",,,,0.0
Philip K. Dick,Paperback,216.0,"The Crystal Crypt by Philip K. Dick, Science Fiction, Fantasy",34.0,Aegypan,2011-10-05,3.52
Gordon Van Gelder,Paperback,217.0,"Fantasy & Science Fiction, July/August 2011",258.0,Spilogale,2011-07-01,3.53
Gordon Van Gelder,Paperback,218.0,"Fantasy & Science Fiction, March/April 2013",258.0,"Spilogale, Inc.",2013-03-01,3.38
S.M. Blooding,Kindle Edition,219.0,A Barrel of Whiskey -,398.0,Whistling Book Press,2016-08-22,4.33
