_id,ltable_ID,rtable_ID,ltable_Name,ltable_Author,ltable_Publisher,ltable_Publishing_Date,ltable_Format,ltable_Pages,ltable_Rating,rtable_Name,rtable_Author,rtable_Publisher,rtable_Publishing_Date,rtable_Format,rtable_Pages,rtable_Rating
832,386,2659,The Fantasy Benefit: The 2018 Fantasy Baseball Draft Guide,,Independently published,2018-2-26,Kindle,361.0,4.9,Titan: The Fighting Fantasy World,Steve   Jackson,Puffin Books,1986-10-30,Paperback,,3.95
835,386,2682,The Fantasy Benefit: The 2018 Fantasy Baseball Draft Guide,,Independently published,2018-2-26,Kindle,361.0,4.9,The Bastard's Blade: A Medieval Fantasy Romance,Luca Thrace,Createspace Independent Publishing Platform,2015-12-15,Kindle Edition,322.0,4.2
837,386,2692,The Fantasy Benefit: The 2018 Fantasy Baseball Draft Guide,,Independently published,2018-2-26,Kindle,361.0,4.9,The Complete Guide to Writing Fantasy: Alchemy with Words,Darin Park,Dragon Moon Press,2002-09-01,Paperback,361.0,3.83
840,386,2720,The Fantasy Benefit: The 2018 Fantasy Baseball Draft Guide,,Independently published,2018-2-26,Kindle,361.0,4.9,Fantasy Genesis: A Creativity Game for Fantasy Artists,Chuck Lukacs,IMPACT,2010-03-10,Paperback,144.0,4.38
843,386,2728,The Fantasy Benefit: The 2018 Fantasy Baseball Draft Guide,,Independently published,2018-2-26,Kindle,361.0,4.9,Final Fantasy: The Spirits Within,Dean Wesley Smith,Pocket Books,2001-06-26,Paperback,230.0,3.31
846,386,2769,The Fantasy Benefit: The 2018 Fantasy Baseball Draft Guide,,Independently published,2018-2-26,Kindle,361.0,4.9,Four in the Garden: A Spiritual Fantasy about Trust and Transformation,Rick Hocker,Hocker Press,2014-11-15,Paperback,342.0,4.44
853,386,2808,The Fantasy Benefit: The 2018 Fantasy Baseball Draft Guide,,Independently published,2018-2-26,Kindle,361.0,4.9,"The Best Science Fiction and Fantasy of the Year, Volume 8",Jonathan Strahan,Solaris,2014-05-08,Paperback,618.0,3.71
855,386,2834,The Fantasy Benefit: The 2018 Fantasy Baseball Draft Guide,,Independently published,2018-2-26,Kindle,361.0,4.9,The Tough Guide to Fantasy Land,Diana Wynne Jones,Gollancz,2004-11-18,Hardcover,243.0,3.94
857,386,2838,The Fantasy Benefit: The 2018 Fantasy Baseball Draft Guide,,Independently published,2018-2-26,Kindle,361.0,4.9,The Case of Charles Dexter Ward (Fantasy and Horror Classics),H.P. Lovecraft,Fantasy and Horror Classics,2016-03-30,ebook,200.0,4.19
860,386,2881,The Fantasy Benefit: The 2018 Fantasy Baseball Draft Guide,,Independently published,2018-2-26,Kindle,361.0,4.9,Salon Fantastique: Thirty Original Tales of Fantasy,Ellen Datlow,Thunder's Mouth Press,2006-10-01,Paperback,396.0,3.42
866,386,2954,The Fantasy Benefit: The 2018 Fantasy Baseball Draft Guide,,Independently published,2018-2-26,Kindle,361.0,4.9,Get Inked: Indie Inked Fantasy Romance Sampler,Melissa Pearl,Smashwords,2013-11-18,ebook,471.0,4.0
868,386,2957,The Fantasy Benefit: The 2018 Fantasy Baseball Draft Guide,,Independently published,2018-2-26,Kindle,361.0,4.9,The Chinese Language: Fact and Fantasy,John DeFrancis,University of Hawaii Press,1986-03-01,Paperback,331.0,3.76
869,386,2958,The Fantasy Benefit: The 2018 Fantasy Baseball Draft Guide,,Independently published,2018-2-26,Kindle,361.0,4.9,The Dedalus Book of Finnish Fantasy (Dedalus Literary Fantasy Anthologies),Johanna Sinisalo,Dedalus,2006-08-01,Paperback,337.0,3.9
873,404,58,The Amazing Spider-Man & Amazing Fantasy No.15,,Barnes & Noble,2003-0-0,Kindle,245.0,4.2,The Year's Best Fantasy Stories 7,Arthur W. Saha,DAW,1981-10-06,Paperback,192.0,3.3
876,404,99,The Amazing Spider-Man & Amazing Fantasy No.15,,Barnes & Noble,2003-0-0,Kindle,245.0,4.2,Jan Messent's Knit a Fantasy Story,Jan Messent,Search Press,2006-08-01,Paperback,96.0,3.75
883,404,170,The Amazing Spider-Man & Amazing Fantasy No.15,,Barnes & Noble,2003-0-0,Kindle,245.0,4.2,Other Voices: An Urban Fantasy Anthology,Diamant,Diamant,2013-07-19,Kindle Edition,220.0,4.0
884,404,178,The Amazing Spider-Man & Amazing Fantasy No.15,,Barnes & Noble,2003-0-0,Kindle,245.0,4.2,"Best Friends, Fantasy Lovers",Dicey Grenor,,,Kindle Edition,197.0,4.33
885,404,182,The Amazing Spider-Man & Amazing Fantasy No.15,,Barnes & Noble,2003-0-0,Kindle,245.0,4.2,The Fantasy Literature of England,Colin Manlove,Palgrave Macmillan,1999-07-30,Hardcover,230.0,3.5
886,404,184,The Amazing Spider-Man & Amazing Fantasy No.15,,Barnes & Noble,2003-0-0,Kindle,245.0,4.2,Submissive Wife: Rape Fantasy,Mal Sanders,Amazon Digital Services,2012-05-19,Kindle Edition,33.0,3.25
892,404,250,The Amazing Spider-Man & Amazing Fantasy No.15,,Barnes & Noble,2003-0-0,Kindle,245.0,4.2,Bill Gibb: Fashion and Fantasy,Iain Webb,Victoria & Albert Museum,2008-10-01,Hardcover,144.0,3.88
901,404,325,The Amazing Spider-Man & Amazing Fantasy No.15,,Barnes & Noble,2003-0-0,Kindle,245.0,4.2,Infernal Magic: An Urban Fantasy Novel,C.N. Crawford,Createspace Independent Publishing Platform,2016-06-30,Paperback,308.0,4.05
902,404,332,The Amazing Spider-Man & Amazing Fantasy No.15,,Barnes & Noble,2003-0-0,Kindle,245.0,4.2,The Wise Woman and Other Fantasy Stories,George MacDonald,Lion Publishing,1981-10-30,Paperback,172.0,4.14
903,404,355,The Amazing Spider-Man & Amazing Fantasy No.15,,Barnes & Noble,2003-0-0,Kindle,245.0,4.2,Once Upon a Fantasy,Lia Davis,Fated Desires Publishing,2016-02-23,ebook,,5.0
905,404,361,The Amazing Spider-Man & Amazing Fantasy No.15,,Barnes & Noble,2003-0-0,Kindle,245.0,4.2,"The Magazine of Fantasy & Science Fiction, July/August 2017",C.C. Finlay,"Spilogale, Inc.",2017-07-01,Paperback,258.0,3.94
910,404,392,The Amazing Spider-Man & Amazing Fantasy No.15,,Barnes & Noble,2003-0-0,Kindle,245.0,4.2,The Pleasure of Avin's Fantasy,Samantha Wellshauna,,,Kindle Edition,21.0,2.72
911,404,395,The Amazing Spider-Man & Amazing Fantasy No.15,,Barnes & Noble,2003-0-0,Kindle,245.0,4.2,Milking Maggie (A Lactation Fantasy),Ashley K. Bennet,Bridle Books,2012-11-01,Kindle Edition,66.0,3.67
912,404,397,The Amazing Spider-Man & Amazing Fantasy No.15,,Barnes & Noble,2003-0-0,Kindle,245.0,4.2,Unit Origami Fantasy,Tomoko Fuse,,,Paperback,158.0,4.6
915,404,437,The Amazing Spider-Man & Amazing Fantasy No.15,,Barnes & Noble,2003-0-0,Kindle,245.0,4.2,The Year's Best Fantasy Stories 11,Arthur W. Saha,DAW Books,1985-11-05,Paperback,238.0,3.08
918,404,447,The Amazing Spider-Man & Amazing Fantasy No.15,,Barnes & Noble,2003-0-0,Kindle,245.0,4.2,The Mammoth Book of Great Fantasy,Mike Ashley,Robinson Publishing,2001-09-27,Paperback,512.0,3.43
922,404,481,The Amazing Spider-Man & Amazing Fantasy No.15,,Barnes & Noble,2003-0-0,Kindle,245.0,4.2,"The Magazine of Fantasy & Science Fiction, Sept/Oct 2013",Gordon Van Gelder,"Spilogale, Inc.",2013-09-01,Kindle Edition,,3.5
923,404,484,The Amazing Spider-Man & Amazing Fantasy No.15,,Barnes & Noble,2003-0-0,Kindle,245.0,4.2,The Year's Best Fantasy Stories 8,Arthur W. Saha,DAW,1982-10-01,Paperback,191.0,3.17
924,404,503,The Amazing Spider-Man & Amazing Fantasy No.15,,Barnes & Noble,2003-0-0,Kindle,245.0,4.2,The Masked Man: A Memoir and Fantasy of Hollywood,Tom Wilson,BookBaby,2012-10-01,Kindle Edition,277.0,3.89
930,404,522,The Amazing Spider-Man & Amazing Fantasy No.15,,Barnes & Noble,2003-0-0,Kindle,245.0,4.2,"The Magazine of Fantasy & Science Fiction, November/December 2014",Gordon Van Gelder,"Spilogale, Inc.",2014-10-25,Kindle Edition,,3.71
931,404,544,The Amazing Spider-Man & Amazing Fantasy No.15,,Barnes & Noble,2003-0-0,Kindle,245.0,4.2,The Year's Best Fantasy Stories 4,Lin Carter,DAW,1978-12-05,Paperback,208.0,3.92
933,404,547,The Amazing Spider-Man & Amazing Fantasy No.15,,Barnes & Noble,2003-0-0,Kindle,245.0,4.2,Miss Hargreaves: A Fantasy,Frank Baker,Tartarus Press,2004-06-24,Hardcover,266.0,3.32
937,404,588,The Amazing Spider-Man & Amazing Fantasy No.15,,Barnes & Noble,2003-0-0,Kindle,245.0,4.2,The Year's Best Fantasy Stories 6,Lin Carter,DAW,1980-11-04,Mass Market Paperback,191.0,3.47
939,404,593,The Amazing Spider-Man & Amazing Fantasy No.15,,Barnes & Noble,2003-0-0,Kindle,245.0,4.2,The Friends in Fantasy Forest,Ulf Stark,Ikea,2015-09-01,Hardcover,32.0,3.86
940,404,595,The Amazing Spider-Man & Amazing Fantasy No.15,,Barnes & Noble,2003-0-0,Kindle,245.0,4.2,Leaving Fantasy Land,James E. Parker,James E. Parker,2012-03-29,Kindle Edition,186.0,4.0
944,404,628,The Amazing Spider-Man & Amazing Fantasy No.15,,Barnes & Noble,2003-0-0,Kindle,245.0,4.2,Malafrena Fantasy Roman,Ursula K. Le Guin,,,,,3.46
948,404,665,The Amazing Spider-Man & Amazing Fantasy No.15,,Barnes & Noble,2003-0-0,Kindle,245.0,4.2,The Morris-Jumel Mansion Anthology of Fantasy and Paranormal Fiction,Camilla Saly-Monzingo,Smashwords Edition,2016-10-13,ebook,,3.75
949,404,670,The Amazing Spider-Man & Amazing Fantasy No.15,,Barnes & Noble,2003-0-0,Kindle,245.0,4.2,"The Magazine of Fantasy & Science Fiction, March/April 2017",C.C. Finlay,"Spilogale, Inc.",2017-03-01,,258.0,3.75
950,404,691,The Amazing Spider-Man & Amazing Fantasy No.15,,Barnes & Noble,2003-0-0,Kindle,245.0,4.2,The Real Fantasy,Caroline Anderson,Mills & Boon,1996-10-11,Mass Market Paperback,192.0,2.8
951,404,694,The Amazing Spider-Man & Amazing Fantasy No.15,,Barnes & Noble,2003-0-0,Kindle,245.0,4.2,A Midnight Fantasy,Thomas Bailey Aldrich,,,Kindle Edition,48.0,4.0
953,404,701,The Amazing Spider-Man & Amazing Fantasy No.15,,Barnes & Noble,2003-0-0,Kindle,245.0,4.2,"The Magazine of Fantasy & Science Fiction, May/June 2015",C.C. Finlay,"Spilogale, Inc.",2015-04-27,Kindle Edition,,3.63
955,404,727,The Amazing Spider-Man & Amazing Fantasy No.15,,Barnes & Noble,2003-0-0,Kindle,245.0,4.2,City of Masks: An Epic Fantasy Novel,Ashley Capes,Snapping Turtle Books,2014-05-24,Kindle Edition,423.0,3.89
962,404,785,The Amazing Spider-Man & Amazing Fantasy No.15,,Barnes & Noble,2003-0-0,Kindle,245.0,4.2,The Amazing Airship Adventure,Derrick Belanger,MX Publishing,2014-12-04,Paperback,88.0,4.0
964,404,797,The Amazing Spider-Man & Amazing Fantasy No.15,,Barnes & Noble,2003-0-0,Kindle,245.0,4.2,"The Magazine of Fantasy and Science Fiction, September 1991",Kristine Kathryn Rusch,"Mercury Press, Inc.",1991-09-01,Paperback,162.0,3.58
965,404,798,The Amazing Spider-Man & Amazing Fantasy No.15,,Barnes & Noble,2003-0-0,Kindle,245.0,4.2,The Symbiont (A Time Travel Fantasy),T.L.B. Wood,,,Kindle Edition,,3.9
966,404,810,The Amazing Spider-Man & Amazing Fantasy No.15,,Barnes & Noble,2003-0-0,Kindle,245.0,4.2,"The Magazine of Fantasy and Science Fiction, May/June 2013",Gordon Van Gelder,"Spilogale, Inc.",2013-05-01,Kindle Edition,258.0,3.59
971,404,847,The Amazing Spider-Man & Amazing Fantasy No.15,,Barnes & Noble,2003-0-0,Kindle,245.0,4.2,"The Magazine of Fantasy & Science Fiction, September/October 2014",Gordon Van Gelder,"Spilogale, Inc.",2014-08-25,Kindle Edition,,3.73
977,404,881,The Amazing Spider-Man & Amazing Fantasy No.15,,Barnes & Noble,2003-0-0,Kindle,245.0,4.2,A Famous Broken Heart: A Fantasy Novel,Ann Druyan,Stonehill Publishers,1977-01-01,Unknown Binding,113.0,3.88
981,404,920,The Amazing Spider-Man & Amazing Fantasy No.15,,Barnes & Noble,2003-0-0,Kindle,245.0,4.2,Falling for His Fantasy: Book 1,C.A.   Taylor,,,Kindle Edition,68.0,3.04
982,404,921,The Amazing Spider-Man & Amazing Fantasy No.15,,Barnes & Noble,2003-0-0,Kindle,245.0,4.2,The Year's Best Fantasy Stories 2,Lin Carter,DAW,1976-08-17,Paperback,192.0,3.52
985,404,925,The Amazing Spider-Man & Amazing Fantasy No.15,,Barnes & Noble,2003-0-0,Kindle,245.0,4.2,A Time For Fantasy,Daisy Freeman,,,Nook,,5.0
986,404,929,The Amazing Spider-Man & Amazing Fantasy No.15,,Barnes & Noble,2003-0-0,Kindle,245.0,4.2,Amanda's Fantasy,Norman Filler,,,Kindle Edition,45.0,2.54
987,404,948,The Amazing Spider-Man & Amazing Fantasy No.15,,Barnes & Noble,2003-0-0,Kindle,245.0,4.2,The Amazing Adventures of Chilly Billy,Peter Mayle,Escargot Books,2013-10-15,Paperback,52.0,4.51
988,404,956,The Amazing Spider-Man & Amazing Fantasy No.15,,Barnes & Noble,2003-0-0,Kindle,245.0,4.2,Lesser - A Villainous Urban Fantasy,M.T. Murphy,Lex Talionis Books,2011-09-11,Kindle Edition,291.0,4.05
991,404,967,The Amazing Spider-Man & Amazing Fantasy No.15,,Barnes & Noble,2003-0-0,Kindle,245.0,4.2,"Fantasy & Science Fiction, Jan/Feb 2013",Gordon Van Gelder,"Spilogale, Inc.",2013-01-01,Paperback,,3.63
997,404,1007,The Amazing Spider-Man & Amazing Fantasy No.15,,Barnes & Noble,2003-0-0,Kindle,245.0,4.2,"The Magazine of Fantasy & Science Fiction, July/August 2016",C.C. Finlay,"Spilogale, Inc.",2016-06-25,Kindle Edition,,3.92
998,404,1009,The Amazing Spider-Man & Amazing Fantasy No.15,,Barnes & Noble,2003-0-0,Kindle,245.0,4.2,"Le Sang: Le Dernier Souffle, T2 (Fantasy)",Fiona McIntosh,Milady,2011-05-27,Kindle Edition,667.0,3.93
1004,404,1048,The Amazing Spider-Man & Amazing Fantasy No.15,,Barnes & Noble,2003-0-0,Kindle,245.0,4.2,"Orona (Epic Science Fiction and Fantasy, #1)",Adam  James,Adam James,2015-04-11,Kindle Edition,260.0,3.26
1007,404,1078,The Amazing Spider-Man & Amazing Fantasy No.15,,Barnes & Noble,2003-0-0,Kindle,245.0,4.2,"Gary Gygax's Living Fantasy (Gygaxian Fantasy Worlds, #3)",Gary Gygax,Troll Lord Games,2003-07-03,Hardcover,160.0,3.73
1008,404,1079,The Amazing Spider-Man & Amazing Fantasy No.15,,Barnes & Noble,2003-0-0,Kindle,245.0,4.2,Strange Science Fantasy,Scott Morse,IDW Publishing,2011-04-12,Paperback,196.0,3.73
1009,404,1081,The Amazing Spider-Man & Amazing Fantasy No.15,,Barnes & Noble,2003-0-0,Kindle,245.0,4.2,Der Falke des Lichts Fantasy Roman,Gillian Bradshaw,Rowohlt Taschenbuch Verlag GmbH,1984-11-01,,346.0,3.88
1010,404,1084,The Amazing Spider-Man & Amazing Fantasy No.15,,Barnes & Noble,2003-0-0,Kindle,245.0,4.2,The Secret of Fantasy Forest,Francine Pascal,Sweet Valley,1996-09-01,Paperback,96.0,3.89
1011,404,1086,The Amazing Spider-Man & Amazing Fantasy No.15,,Barnes & Noble,2003-0-0,Kindle,245.0,4.2,The Second Page: An Offbeat Fantasy Adventure,Clark Nielsen,,,Kindle Edition,260.0,3.5
1012,404,1088,The Amazing Spider-Man & Amazing Fantasy No.15,,Barnes & Noble,2003-0-0,Kindle,245.0,4.2,Malika - Warrior Queen Part One: An African Historical Fantasy Graphic Novel,Roye Okupe,YouNeek Studios,2017-05-17,Paperback,144.0,3.79
1013,404,1109,The Amazing Spider-Man & Amazing Fantasy No.15,,Barnes & Noble,2003-0-0,Kindle,245.0,4.2,The Magazine of Fantasy & Science Fiction September/October 2015,C.C. Finlay,"Spilogale, Inc.",2015-08-29,Kindle Edition,329.0,3.53
1014,404,1115,The Amazing Spider-Man & Amazing Fantasy No.15,,Barnes & Noble,2003-0-0,Kindle,245.0,4.2,Draw & Paint Fantasy Females,Tom  Fleming,Impact,2009-08-01,Paperback,127.0,3.93
1017,404,1146,The Amazing Spider-Man & Amazing Fantasy No.15,,Barnes & Noble,2003-0-0,Kindle,245.0,4.2,"The Magazine of Fantasy & Science Fiction, July/August, 2015",C.C. Finlay,"Spilogale, Inc.",2015-06-27,Kindle Edition,,3.74
1018,404,1150,The Amazing Spider-Man & Amazing Fantasy No.15,,Barnes & Noble,2003-0-0,Kindle,245.0,4.2,The Year's Best Australian Fantasy & Horror 2010,Liz Grzyb,Ticonderoga Publications,2011-09-01,Paperback,484.0,4.35
1019,404,1155,The Amazing Spider-Man & Amazing Fantasy No.15,,Barnes & Noble,2003-0-0,Kindle,245.0,4.2,The Year's Best Fantasy Stories 3,Lin Carter,DAW,1977-11-15,Paperback,240.0,3.89
1021,404,1157,The Amazing Spider-Man & Amazing Fantasy No.15,,Barnes & Noble,2003-0-0,Kindle,245.0,4.2,"The Mad, Bad Duke: Historical Fantasy",Jennifer Ashley,Ja / AG Publishing,2016-10-16,Paperback,,3.97
1026,404,1188,The Amazing Spider-Man & Amazing Fantasy No.15,,Barnes & Noble,2003-0-0,Kindle,245.0,4.2,"The Magazine of Fantasy & Science Fiction, November/December 2016",C.C. Finlay,"Spilogale, Inc.",2016-10-28,Kindle Edition,,3.81
1027,404,1189,The Amazing Spider-Man & Amazing Fantasy No.15,,Barnes & Noble,2003-0-0,Kindle,245.0,4.2,"The Magazine of Fantasy & Science Fiction, July/August 2014",C.C. Finlay,"Spilogale, Inc.",2014-06-28,Kindle Edition,,3.78
1030,404,1220,The Amazing Spider-Man & Amazing Fantasy No.15,,Barnes & Noble,2003-0-0,Kindle,245.0,4.2,The Dedalus Book of Spanish Fantasy,Margaret Jull Costa,Dedalus,1999-05-01,Paperback,332.0,3.56
1033,404,1264,The Amazing Spider-Man & Amazing Fantasy No.15,,Barnes & Noble,2003-0-0,Kindle,245.0,4.2,Ryder: A Young Adult Fantasy Short,Parrisha Martelly,,,Kindle Edition,,5.0
1034,404,1265,The Amazing Spider-Man & Amazing Fantasy No.15,,Barnes & Noble,2003-0-0,Kindle,245.0,4.2,The Year's Best Fantasy Stories 5,Lin Carter,DAW,1980-01-02,Mass Market Paperback,204.0,4.0
1042,404,1302,The Amazing Spider-Man & Amazing Fantasy No.15,,Barnes & Noble,2003-0-0,Kindle,245.0,4.2,Dress Me Up In Your Fantasy,Coffee Lover,,,ebook,,3.35
1049,404,1336,The Amazing Spider-Man & Amazing Fantasy No.15,,Barnes & Noble,2003-0-0,Kindle,245.0,4.2,The Myth of Persephone in Girls' Fantasy Literature,Holly Blackford,Routledge,2011-08-25,Hardcover,248.0,2.75
1052,404,1342,The Amazing Spider-Man & Amazing Fantasy No.15,,Barnes & Noble,2003-0-0,Kindle,245.0,4.2,Ape No Evil: A Wildlife Fantasy,Milika M.,CreateSpace Published,2010-07-20,,220.0,1.0
1054,404,1364,The Amazing Spider-Man & Amazing Fantasy No.15,,Barnes & Noble,2003-0-0,Kindle,245.0,4.2,Yokohama Chinatown Fantasy Vol. 1,Yuji Nishi,Level Comics,2010-08-01,Paperback,212.0,4.24
1056,404,1372,The Amazing Spider-Man & Amazing Fantasy No.15,,Barnes & Noble,2003-0-0,Kindle,245.0,4.2,Steel and Shadow: An Epic Fantasy,LaJonn O. Klein,Midnight Sun Publishing,2013-01-15,Kindle Edition,125.0,3.82
1057,404,1377,The Amazing Spider-Man & Amazing Fantasy No.15,,Barnes & Noble,2003-0-0,Kindle,245.0,4.2,Fairies & Fantasy,Felicia Mires,,,,,4.06
1058,404,1408,The Amazing Spider-Man & Amazing Fantasy No.15,,Barnes & Noble,2003-0-0,Kindle,245.0,4.2,Pure of Heart: An Epic Fantasy,Christopher Greyson,Greyson Media,2015-01-19,Kindle Edition,243.0,4.05
1066,404,1478,The Amazing Spider-Man & Amazing Fantasy No.15,,Barnes & Noble,2003-0-0,Kindle,245.0,4.2,The Best of Marion Zimmer Bradley Fantasy Magazine Volume 2,Marion Zimmer Bradley,Aspect,2009-12-19,Mass Market Paperback,248.0,3.85
1070,404,1484,The Amazing Spider-Man & Amazing Fantasy No.15,,Barnes & Noble,2003-0-0,Kindle,245.0,4.2,Mammoth Book Of Short Fantasy Novels,Isaac Asimov,,,,,3.62
1072,404,1489,The Amazing Spider-Man & Amazing Fantasy No.15,,Barnes & Noble,2003-0-0,Kindle,245.0,4.2,The Corrupted (Warhammer Fantasy Roleplay),Robert Earl,Games Workshop(uk),2006-10-10,Paperback,252.0,3.52
1077,404,1516,The Amazing Spider-Man & Amazing Fantasy No.15,,Barnes & Noble,2003-0-0,Kindle,245.0,4.2,Marion Zimmer Bradley's Fantasy Worlds,Marion Zimmer Bradley,Marion Zimmer Bradley Literary Works Trust,1998-08-26,Unknown Binding,342.0,4.06
1082,404,1550,The Amazing Spider-Man & Amazing Fantasy No.15,,Barnes & Noble,2003-0-0,Kindle,245.0,4.2,The Destineers' Journal of Fantasy Nations,Bobby Sharpe,Lulu.com,2009-02-19,Paperback,152.0,4.9
1084,404,1562,The Amazing Spider-Man & Amazing Fantasy No.15,,Barnes & Noble,2003-0-0,Kindle,245.0,4.2,The People of the Mist: A Classic Lost Race Fantasy Novel,H. Rider Haggard,Createspace Independent Publishing Platform,2015-10-27,Paperback,208.0,3.78
1085,404,1583,The Amazing Spider-Man & Amazing Fantasy No.15,,Barnes & Noble,2003-0-0,Kindle,245.0,4.2,The Impossible Rescue: The True Story of an Amazing Arctic Adventure,Martin W. Sandler,Candlewick,2012-09-11,Hardcover,164.0,3.76
1087,404,1586,The Amazing Spider-Man & Amazing Fantasy No.15,,Barnes & Noble,2003-0-0,Kindle,245.0,4.2,Caribbean Fantasy,McKenna Chase,McKenna Chase,2011-09-12,Kindle Edition,41.0,3.35
1088,404,1589,The Amazing Spider-Man & Amazing Fantasy No.15,,Barnes & Noble,2003-0-0,Kindle,245.0,4.2,The Taste of Life: A Biblical Fantasy,Mike  Simpson,CrossBooks Publishing,2011-08-22,Paperback,72.0,2.6
1090,404,1593,The Amazing Spider-Man & Amazing Fantasy No.15,,Barnes & Noble,2003-0-0,Kindle,245.0,4.2,"The Magazine of Fantasy & Science Fiction, March/April 2015",Gordon Van Gelder,"Spilogale, Inc.",2015-02-27,Kindle Edition,,4.03
1091,404,1621,The Amazing Spider-Man & Amazing Fantasy No.15,,Barnes & Noble,2003-0-0,Kindle,245.0,4.2,The Amazing Adventures of the Escapist: Volume 2,Brian K. Vaughan,Dark Horse Comics,2004-12-07,Paperback,152.0,3.49
1092,404,1626,The Amazing Spider-Man & Amazing Fantasy No.15,,Barnes & Noble,2003-0-0,Kindle,245.0,4.2,A Story of Becoming: An Inspiring Fantasy fable,Ayn Cates Sullivan,"Infinite Light Publishing, LLC",2015-12-31,Kindle Edition,52.0,4.26
1095,404,1639,The Amazing Spider-Man & Amazing Fantasy No.15,,Barnes & Noble,2003-0-0,Kindle,245.0,4.2,The Complete Guide to Writing Fantasy: The Opus Magnus,Tee Morris,Dragon Moon Press,2003-09-01,Paperback,296.0,4.04
1097,404,1642,The Amazing Spider-Man & Amazing Fantasy No.15,,Barnes & Noble,2003-0-0,Kindle,245.0,4.2,The Escapists: An Erotic Fantasy Novel,Anthony Beal,Hexed Flesh Books,2012-04-29,ebook,,4.17
1099,404,1665,The Amazing Spider-Man & Amazing Fantasy No.15,,Barnes & Noble,2003-0-0,Kindle,245.0,4.2,"The Book of Dragons by Edith Nesbit, Fiction, Fantasy & Magic",E. Nesbit,Aegypan,2008-06-01,Hardcover,108.0,3.88
1102,404,1673,The Amazing Spider-Man & Amazing Fantasy No.15,,Barnes & Noble,2003-0-0,Kindle,245.0,4.2,Dream Tide (Fantasy Men),Cindy Gerard,Loveswept,1993-08-01,Mass Market Paperback,223.0,3.88
1105,404,1703,The Amazing Spider-Man & Amazing Fantasy No.15,,Barnes & Noble,2003-0-0,Kindle,245.0,4.2,The Best Horror from Fantasy Tales,Stephen Jones,Running Press,2003-07-13,Paperback,288.0,3.46
1107,404,1707,The Amazing Spider-Man & Amazing Fantasy No.15,,Barnes & Noble,2003-0-0,Kindle,245.0,4.2,The Return of Innocence: A Fantasy Adventure,Duane Simolke,iUniverse,2006-03-20,Paperback,168.0,4.25
1108,404,1708,The Amazing Spider-Man & Amazing Fantasy No.15,,Barnes & Noble,2003-0-0,Kindle,245.0,4.2,A Reader's Guide to Fantasy,Baird Searles,Avon Books,1982-07-01,Paperback,217.0,3.91
1110,404,1743,The Amazing Spider-Man & Amazing Fantasy No.15,,Barnes & Noble,2003-0-0,Kindle,245.0,4.2,The Book of Fantasy,Jorge Luis Borges,Viking Books,1988-11-01,Hardcover,384.0,4.37
1112,404,1749,The Amazing Spider-Man & Amazing Fantasy No.15,,Barnes & Noble,2003-0-0,Kindle,245.0,4.2,The Scarlet Plague: The Original Book: (Annotated): A Dark Fantasy Original,Jack London,RonnSays,2015-06-20,Kindle Edition,,3.6
1113,404,1754,The Amazing Spider-Man & Amazing Fantasy No.15,,Barnes & Noble,2003-0-0,Kindle,245.0,4.2,Sketching from the Imagination: Fantasy,Sean Andrew Murray,3DTotal Publishing,2014-11-25,Paperback,320.0,4.35
1114,404,1755,The Amazing Spider-Man & Amazing Fantasy No.15,,Barnes & Noble,2003-0-0,Kindle,245.0,4.2,Evangeline's Fantasy Man,Ida Plassay,America Star Books,2009-05-04,Paperback,210.0,4.63
1117,404,1829,The Amazing Spider-Man & Amazing Fantasy No.15,,Barnes & Noble,2003-0-0,Kindle,245.0,4.2,Anima: Beyond Fantasy,Carlos B. Garcia Aparicio,Fantasy Flight Games,2008-10-28,Hardcover,315.0,3.83
1122,404,1864,The Amazing Spider-Man & Amazing Fantasy No.15,,Barnes & Noble,2003-0-0,Kindle,245.0,4.2,Better Than 8: Fantasy,Erin Jamison,Tadpole Productions,2011-05-27,ebook,132.0,3.81
1124,404,1870,The Amazing Spider-Man & Amazing Fantasy No.15,,Barnes & Noble,2003-0-0,Kindle,245.0,4.2,The Christmas Fantasy,K.T. Grant,Decadent Publishing,2010-12-12,ebook,69.0,2.75
1125,404,1873,The Amazing Spider-Man & Amazing Fantasy No.15,,Barnes & Noble,2003-0-0,Kindle,245.0,4.2,Drawing & Painting Fantasy Worlds,Finlay Cowan,Writer's Digest Books,2006-05-25,Paperback,121.0,3.78
1128,404,1897,The Amazing Spider-Man & Amazing Fantasy No.15,,Barnes & Noble,2003-0-0,Kindle,245.0,4.2,Magic Touch: 11 Urban/Paranormal Fantasy Novels,Becca Mills,,,ebook,,3.71
1133,404,1938,The Amazing Spider-Man & Amazing Fantasy No.15,,Barnes & Noble,2003-0-0,Kindle,245.0,4.2,The Sentinel (Masterworks of Science Fiction and Fantasy),Arthur C. Clarke,Berkley,1986-12-01,Paperback,260.0,3.94
1137,404,1969,The Amazing Spider-Man & Amazing Fantasy No.15,,Barnes & Noble,2003-0-0,Kindle,245.0,4.2,Derniers jours (Fantasy),Adam Nevill,Bragelonne,2014-05-02,Kindle Edition,456.0,3.78
1138,404,2002,The Amazing Spider-Man & Amazing Fantasy No.15,,Barnes & Noble,2003-0-0,Kindle,245.0,4.2,The Year's Best Science Fiction & Fantasy 2015 Edition,Rich Horton,Prime Books,2015-06-02,Kindle Edition,576.0,3.63
1145,404,2049,The Amazing Spider-Man & Amazing Fantasy No.15,,Barnes & Noble,2003-0-0,Kindle,245.0,4.2,The Drawing of the Dark (Fantasy Masterworks),Tim Powers,Gollancz,2010-11-11,Kindle Edition,336.0,3.91
1146,404,2054,The Amazing Spider-Man & Amazing Fantasy No.15,,Barnes & Noble,2003-0-0,Kindle,245.0,4.2,Fantasists on Fantasy,Robert H.  Boyer,Avon Books,1984-02-01,Paperback,10.0,3.79
1150,404,2130,The Amazing Spider-Man & Amazing Fantasy No.15,,Barnes & Noble,2003-0-0,Kindle,245.0,4.2,The Necromancer Candle: And Two Additional Tales of Contemporary Fantasy,Randy McCharles,EDGE Science Fiction and Fantasy Publishing,2015-06-15,Paperback,224.0,4.29
1152,404,2164,The Amazing Spider-Man & Amazing Fantasy No.15,,Barnes & Noble,2003-0-0,Kindle,245.0,4.2,A Treasury of Modern Fantasy,Terry Carr,Avon,1981-03-01,Hardcover,588.0,4.17
1156,404,2195,The Amazing Spider-Man & Amazing Fantasy No.15,,Barnes & Noble,2003-0-0,Kindle,245.0,4.2,Discoveries In Fantasy,Lin Carter,,,,243.0,3.81
1157,404,2197,The Amazing Spider-Man & Amazing Fantasy No.15,,Barnes & Noble,2003-0-0,Kindle,245.0,4.2,Every Woman's Fantasy,Vicki Lewis Thompson,Harlequin Books,2004-07-01,Paperback,267.0,3.48
1161,404,2229,The Amazing Spider-Man & Amazing Fantasy No.15,,Barnes & Noble,2003-0-0,Kindle,245.0,4.2,"The Year's Best Science Fiction & Fantasy, 2013",Rich Horton,Prime Books,2013-07-02,Paperback,573.0,3.73
1164,404,2240,The Amazing Spider-Man & Amazing Fantasy No.15,,Barnes & Noble,2003-0-0,Kindle,245.0,4.2,THE CASPAK TRILOGY : The Fantasy Novel -,Edgar Rice Burroughs,Unsecretbooks,2013-02-01,ebook,1078.0,3.89
1165,404,2273,The Amazing Spider-Man & Amazing Fantasy No.15,,Barnes & Noble,2003-0-0,Kindle,245.0,4.2,Create Amazing Fantasy Characters (Drawing Fantasy Art),Steve Beaumont,Arcturus Publishing Limited,2012-05-15,Paperback,128.0,3.58
